,source,year,date,title,is_sarcastic
1075,Hard Times,2018,2018-01-01,Drummer Really Doesn’t Need Help from Singer Bashing on Floor Tom,1
1076,Hard Times,2018,2018-01-01,I’m the Wizard Airbrushed on the Side of a Van. Free Me From This Prison Bestowed.,1
1077,Hard Times,2018,2018-01-01,VIDEO: One Note Studio,1
1078,Hard Times,2018,2018-01-01,Crowd Surfing Gang Brutally Enforces “Locals Only” Policy at Punk Show,1
1079,Hard Times,2018,2018-01-01,Time Traveler with Dire Warning Dismissed as Annoying Cybergoth,1
1080,Hard Times,2018,2018-01-01,Time Traveler with Dire Warning Dismissed as Annoying Cybergoth,1
1081,Hard Times,2018,2018-01-01,Def Leppard and Journey Tour Tickets to be Covered by Medicare,1
1082,Hard Times,2018,2018-01-01,Grown Man Keeping Guitar Pick in His Wallet “Just in Case”,1
1083,Hard Times,2018,2018-01-01,DIY: How to Build Your Own Guitar for Twice the Price of a Store Bought Guitar,1
1084,Hard Times,2018,2018-01-01,Angry Busta Rhymes Delivers Stern Lecture to Son in 11 Seconds,1
1085,Hard Times,2018,2018-01-01,Crust Punk Fills Uneven Beard With Patches,1
1086,Hard Times,2018,2018-01-01,We Rank the Members of She & Him,1
1087,Hard Times,2018,2018-01-01,Singer Asks Much Larger City 20 Minutes from Venue How They’re Feeling Tonight,1
1088,Hard Times,2018,2018-01-01,Prog Community Demands a Disney Princess Who’s Into Rush,1
1089,Hard Times,2018,2018-01-01,Record Store Just Going to Pass On Badly Scratched Copy of The Offspring’s ‘Americana’ Like It’s Nothing,1
1090,Hard Times,2018,2018-01-01,"If a Secret Show Ye Wish to See, Answer Me These Riddles Three!",1
1091,Hard Times,2018,2018-01-01,‘Weird Al’ Yankovic Polarizes Fans with Childish Gambino Parody ‘This Is My Hair I Cut’,1
1092,Hard Times,2018,2018-01-01,Goth in Happy Relationship Considers Gray Sweater,1
1093,Hard Times,2018,2018-01-01,Fat Wreck Chords Releases Heartfelt Statement Signing Every Band Who Defends NOFX in Next 24 Hours,1
1094,Hard Times,2018,2018-01-01,Know-It-All Zeppelin Fan Heavily Influenced by Works of Know-It-All Tolkien Fan,1
1095,Hard Times,2018,2018-01-01,Man Ironically Listening to Nü-Metal Alone in Car for 5th Time This Week,1
1096,Hard Times,2018,2018-01-01,Five Reasons Skin-to-Skin Contact Is so Important for Bonding With the Show Promoter,1
1097,Hard Times,2018,2018-01-01,SAT Prep Book Announces New ‘Nonsense Cedric Bixler-Zavala Words’ Edition,1
1098,Hard Times,2018,2018-01-01,Unity: Gang Vocals Successfully Multi-Tracked by Single Lonely Punk,1
1099,Hard Times,2018,2018-01-01,Title of Song Sneakily Placed in Lyrics of Last Verse Instead of Chorus,1
1100,Hard Times,2018,2018-01-01,Band Pic Ruined by Smiling Drummer,1
1101,Hard Times,2018,2018-01-01,Nardwuar Surprises Canadian Musician With Original Recording of His Funeral,1
1102,Hard Times,2018,2018-01-01,"Excuse Me Miss, May I Have This Circle Pit?",1
1103,Hard Times,2018,2018-01-01,Is That Bald Guy Ian Mackaye? A Field Guide for Easy Identification,1
1104,Hard Times,2018,2018-01-01,Punk Car Shopper Doesn’t Give a Fuck What J.D. Power & Associates Thinks,1
1105,Hard Times,2018,2018-01-01,Band’s #1 Supporter Just Closest Friend Without Musical Talent,1
1106,Hard Times,2018,2018-01-01,Action Bronson Gunned Down by Diabetes,1
1107,Hard Times,2018,2018-01-01,Band Undecided on Who This Next One Goes out To,1
1108,Hard Times,2018,2018-01-01,Lumineers Frontman Shatters Foot During Stomp Solo,1
1109,Hard Times,2018,2018-01-01,Punk Mom Just Happy to Have Everyone at Same House Show,1
1110,Hard Times,2018,2018-01-01,Study: Female Bands Only Paid 78% the Exposure of Their Male Counterparts,1
1111,Hard Times,2018,2018-01-01,Lead Guitarist Secretly Re-Records Rhythm Guitarist’s Voicemail Message,1
1112,Hard Times,2018,2018-01-01,Report: Science Teacher In Romantic Relationship With Art Student,1
1113,Hard Times,2018,2018-01-01,"My DIY, Inclusive, All-Ages Venue Is for Everybody. Here Are Its Incredibly Specific Set of Rules",1
1114,Hard Times,2018,2018-01-01,White Guy Excited to Finally Sit Down and Miss the Point of Childish Gambino Video,1
1115,Hard Times,2018,2018-01-01,"Move Over, Taylor Swift! This Pop Punk Frontman Is Also Going to Prom With a Young Fan!",1
1116,Hard Times,2018,2018-01-01,Benefit Concert to Save Guitar Center Features 97 Dudes Playing “Sweet Child O’ Mine”,1
1117,Hard Times,2018,2018-01-01,Drummer Heavily Inspired By John Bonham’s Drinking,1
1118,Hard Times,2018,2018-01-01,Man Who Brought Own Microphone from Home About to Ruin Karaoke Night,1
1119,Hard Times,2018,2018-01-01,Losing Job Just the Sort of Push Woman Needed to Start Cassette Label,1
1120,Hard Times,2018,2018-01-01,What Is an Incel and Why Did We Use a Picture of Elvis Costello for This Article?,1
1121,Hard Times,2018,2018-01-01,Mid-20s Punk out of Touch With Music Years Ahead of Schedule,1
1122,Hard Times,2018,2018-01-01,Subway Conductor Asks for More Overwhelming Hissing Noise in Monitor,1
1123,Hard Times,2018,2018-01-01,Gibson Execs Consider Selling a Few Guitars to Get Through Rough Patch,1
1124,Hard Times,2018,2018-01-01,Man to Keep Hitting Next on Shuffle Until He Gets Exact Song He Wants,1
1125,Hard Times,2018,2018-01-01,Metal Guitarist Putting a Bunch of Unnecessary Umlauts in Written Response to Sexual Assault Allegations,1
1126,Hard Times,2018,2018-01-01,"Welcome to Rockville Held Up in Multi-Day Battle Against Welcome to Papersville, Scissorsville",1
1127,Hard Times,2018,2018-01-01,We Spent The Day With Prominent Alt-Right Blogger Kanye West,1
1128,Hard Times,2018,2018-01-01,Man Celebrates Another Year of Favorite Music and Movies Becoming Less Relevant,1
1129,Hard Times,2018,2018-01-01,Stubborn Balding Punk Down to 2/3 of a Mohawk,1
1130,Hard Times,2018,2018-01-01,Stranded Death Metal Band Resorts to Cannibalism Before Considering Any Other Options,1
1131,Hard Times,2018,2018-01-01,"I Put up With Your Bullshit When Bowie Died, so You Will Listen to This Avicii Song and You Will Like It",1
1132,Hard Times,2018,2018-01-01,Record Store Finally Sells Last Stock of 2015 RSD Exclusives,1
1133,Hard Times,2018,2018-01-01,Record Store Dispatches Weird Guy to Flip Through Same Stack of Records You Are,1
1134,Hard Times,2018,2018-01-01,This Old Guy’s Cover of Jeff Buckley’s Hallelujah is INSANELY GOOD!,1
1135,Hard Times,2018,2018-01-01,Barista Unaware Frequent Customer Has Three Albums Worth of Pop-Punk Songs About Her,1
1136,Hard Times,2018,2018-01-01,"Mayor of Rockville, U.S.A. Deemed Unfit to Lead in Simplest Capacity",1
1137,Hard Times,2018,2018-01-01,Sigur Rós Karaoke Massive Flop at Office Party,1
1138,Hard Times,2018,2018-01-01,Punk Unsure Which Green Day Records He’s Allowed to Like,1
1139,Hard Times,2018,2018-01-01,“Telephone Pole Wanted” Flyer Stapled to Local Bassist,1
1140,Hard Times,2018,2018-01-01,Sigur Rós Karaoke Massive Flop at Office Party,1
1141,Hard Times,2018,2018-01-01,Punk Unsure Which Green Day Records He’s Allowed to Like,1
1142,Hard Times,2018,2018-01-01,“Telephone Pole Wanted” Flyer Stapled to Local Bassist,1
1143,Hard Times,2018,2018-01-01,Coachella Goer Just Kinda Assumed Mac DeMarco Would Be There,1
1144,Hard Times,2018,2018-01-01,Man with Raunchy Band T-Shirt Almost Brave Enough to Wear It in Public,1
1145,Hard Times,2018,2018-01-01,Swarms of Bees Head to Coachella to Pollinate Thousands of Flower Crowns,1
1146,Hard Times,2018,2018-01-01,Half-Pack of Cigarettes Found on Venue Floor Triples Crust Punk’s Net Worth,1
1147,Hard Times,2018,2018-01-01,Band Accomplishes Life-Long Goal of Playing in Europe to Four People,1
1148,Hard Times,2018,2018-01-01,"It’s Time for Another American Revolution, According to the Three Public Enemy Songs I Know",1
1149,Hard Times,2018,2018-01-01,Original Lineup of Trump Administration to Reunite for Coachella,1
1150,Hard Times,2018,2018-01-01,Parent Who Is Reason for All Your Problems Suggests Listening to Happier Music,1
1151,Hard Times,2018,2018-01-01,Investigation: Did Billy Idol Fans Create The World’s First Meme?,1
1152,Hard Times,2018,2018-01-01,Folk Punk Drummer Thought Other Band Was Bringing Washboard and Arrangement of Cans,1
1153,Hard Times,2018,2018-01-01,Inconsiderate Neighbor Only Blasts St. Anger-Era Metallica Through Walls,1
1154,Hard Times,2018,2018-01-01,Amazing: Meet The Singular Punk Who Refuses to Conform to Religion,1
1155,Hard Times,2018,2018-01-01,"Dedicated Metalhead Uses TaxSlayer to Annihilate, Properly File His 1040EZ",1
1156,Hard Times,2018,2018-01-01,Uh Oh: Myspace Just Sold All the Data About Your Emo Phase to the Russians,1
1157,Hard Times,2018,2018-01-01,New Decemberists Album Includes Syllabus,1
1158,Hard Times,2018,2018-01-01,Help! I’ve Been in My 30s for 2 Years Now and I Still Don’t Like The Hold Steady,1
1159,Hard Times,2018,2018-01-01,Google Honors Punk History With Terribly Offensive GG Allin Doodle,1
1160,Hard Times,2018,2018-01-01,Badass English Teacher Assigns Van Halen’s 1984,1
1161,Hard Times,2018,2018-01-01,Punk Toddler Doesn’t Give a Fuck You’ve Got Her Nose,1
1162,Hard Times,2018,2018-01-01,We Sent Our Intern to Interview Brockhampton and Now He’s Their Merch Guy Or Something,1
1163,Hard Times,2018,2018-01-01,"Boycott Big Pharma: Support Lil Pharma, a Soundcloud Rapper Who Sells Me Xanax",1
1164,Hard Times,2018,2018-01-01,Crust Punk Squatting in Tree Accidentally Saves Park From Demolition,1
1165,Hard Times,2018,2018-01-01,Anti-Flag Slips One Pro-Trump Song in Set to Make Sure People Still Listening,1
1166,Hard Times,2018,2018-01-01,Dad Thinks a Hard Day’s Work Is Pretty Punk Rock If You Ask Him,1
1167,Hard Times,2018,2018-01-01,"Bush Didn’t Do 9/11, but They Made ‘Machinehead’ and That’s a Close Second in My Book",1
1168,Hard Times,2018,2018-01-01,Limits of Casual Friday Policy Tested with Goatwhore Shirt,1
1169,Hard Times,2018,2018-01-01,Hundreds of Door Guys Protest as More Venues Announce Intentions to Automate by 2020,1
1170,Hard Times,2018,2018-01-01,Everyone at House Show Confused How Middle-Aged Man Found out About This,1
1171,Hard Times,2018,2018-01-01,Aging Punk Willing to Give New Music From 2004 a Listen,1
1172,Hard Times,2018,2018-01-01,"End of a Dynasty? Green Day Trades Mike Dirnt to NoFX for Eric Melvin, El Hefe, Bag of Weed",1
1173,Hard Times,2018,2018-01-01,How Can Racism Still Exist When It Was Defeated by Ska in 1998?,1
1174,Hard Times,2018,2018-01-01,New Kid in Scene Not Sure Which Merch Table to Aimlessly Stand By,1
1175,Hard Times,2018,2018-01-01,"Rushmore, The Life Aquatic, Royal Tenenbaums – Which is the Best Kinks Album?",1
1176,Hard Times,2018,2018-01-01,Drummer at SXSW Has Some App Ideas in Case Band Doesn’t Get Record Deal,1
1177,Hard Times,2018,2018-01-01,Optimistic Aging Punk Sees Tour as Half Over,1
1178,Hard Times,2018,2018-01-01,Aging Hardcore Frontman’s Rant on Gender Identity Most Likely Meant to Be Positive,1
1179,Hard Times,2018,2018-01-01,Punk Ventriloquist Doven’t Give a Vuck iv His Livs are Moving,1
1180,Hard Times,2018,2018-01-01,Sad: 70% of High School Seniors Can’t Even Find Steve Albini on a Map,1
1181,Hard Times,2018,2018-01-01,Abandoned Building Every Hardcore Band Poses in Front of Converted to Condos,1
1182,Hard Times,2018,2018-01-01,$5 Tub of Spackle Best Hope of Getting Punk House Security Deposit Back,1
1183,Hard Times,2018,2018-01-01,Help! Cat Stevens Fell Asleep on My Lap and I Don’t Wanna Move,1
1184,Hard Times,2018,2018-01-01,Host Graciously Offers Band One Damp Towel to Share,1
1185,Hard Times,2018,2018-01-01,Host Graciously Offers Band One Damp Towel to Share,1
1186,Hard Times,2018,2018-01-01,Hardcore Flight Attendant Dedicates Flight to “Real Mother Fuckers in Coach”,1
1187,Hard Times,2018,2018-01-01,Pop-Punk Frontman Shunned by Peers for Dating Age-Appropriate Woman,1
1188,Hard Times,2018,2018-01-01,Maturing Punk Frontman Richie Butthole Beginning to Regret Stage Name,1
1189,Hard Times,2018,2018-01-01,Has Jeff Rosenstock Sold Out Now That He Found a Ten Dollar Bill on the Ground?,1
1190,Hard Times,2018,2018-01-01,Metalhead Running out of Body Parts to Carve Slayer Into,1
1191,Hard Times,2018,2018-01-01,Band On Tour From Minneapolis Wants You to Know It’s Not Actually Cold,1
1192,Hard Times,2018,2018-01-01,Crust Punk Candidate Vows to Decrease Jobs,1
1193,Hard Times,2018,2018-01-01,Help! My Small Family Restaurant is Becoming Some Kind of Iconic Punk Thing,1
1194,Hard Times,2018,2018-01-01,"I Know More About This Band Than You, so Don’t Even Try to Have Fun Tonight",1
1195,Hard Times,2018,2018-01-01,Björk Vanishes After Fan Tricks Her Into Saying Name Backwards,1
1196,Hard Times,2018,2018-01-01,"New Fossil Record Shows Punk Died 10,000 Years Before Previously Believed",1
1197,Hard Times,2018,2018-01-01,Tour Bus Quits Band to Go Back to School Bus,1
1198,Hard Times,2018,2018-01-01,Pop Punk Vocalist Wears Three Tank Tops to Bundle up for Winter,1
1199,Hard Times,2018,2018-01-01,Punk on The Price Is Right Hopes Next Showcase Includes Place to Crash,1
1200,Hard Times,2018,2018-01-01,Senses Fail to Offer Seminars on Ear Protection to Retain Aging Fans,1
1201,Hard Times,2018,2018-01-01,Thousands of Metalheads Make Pilgrimage to Lemmy-Shaped Oil Stain in Mechanic’s Garage,1
1202,Hard Times,2018,2018-01-01,Punk Assures Friends New Boyfriend More Fucked up Than He Appears,1
1203,Hard Times,2018,2018-01-01,Aging Goth Removes Ribs to Put Socks on With Ease,1
1204,Hard Times,2018,2018-01-01,"Bakersfield, Calif. Approved as Testing Ground for New GMO KoЯn",1
1205,Hard Times,2018,2018-01-01,5 Mountain Goats Songs To Avoid On Valentine’s Day,1
1206,Hard Times,2018,2018-01-01,Kinky Punk Couple Experiments With Poser Play,1
1207,Hard Times,2018,2018-01-01,Best Packaging? King Krule’s New Album Comes Wrapped in a Spooky Old House,1
1208,Hard Times,2018,2018-01-01,Woman Prepares for Involuntary Music Trivia Before Wearing Band Shirt,1
1209,Hard Times,2018,2018-01-01,D.R.I. Logo Takes Silver in 5000-Meter Men’s Speed Skate Event,1
1210,Hard Times,2018,2018-01-01,Crust Punk House Evacuated After Bath Bomb Threat,1
1211,Hard Times,2018,2018-01-01,Here’s the Full Quincy Jones Interview Everyone Is Talking About,1
1212,Hard Times,2018,2018-01-01,K-Pop Star Escapes to Freedom in North Korea,1
1213,Hard Times,2018,2018-01-01,Ultimate Weezer Box Set Just 12 Copies of Blue Album,1
1214,Hard Times,2018,2018-01-01,If You Really Love Punk so Much Name All the Bands,1
1215,Hard Times,2018,2018-01-01,Crime Lab Says Fibers at Punk Show Came From Black T-Shirt,1
1216,Hard Times,2018,2018-01-01,Crowbar’s Corner: Directions to the Middle East,1
1217,Hard Times,2018,2018-01-01,Crust Punk Outside Whole Foods Needs Just $15 for a Sandwich,1
1218,Hard Times,2018,2018-01-01,Justin Timberlake Asks if Friend’s Band Can Open Super Bowl Halftime Show,1
1219,Hard Times,2018,2018-01-01,Facebook Algorithm Tweak to Only Show Bands’ Sexual Assault Accusation Responses,1
1220,Hard Times,2018,2018-01-01,Metal Album Art Gives Demons Unrealistic Body Expectations,1
1221,Hard Times,2018,2018-01-01,Metallica Merch Booth World’s 32nd Largest Economy,1
1222,Hard Times,2018,2018-01-01,Baby Boomer Juggalo Concerned Millennial Juggalos Won’t Promote Same Dope-Ass Juggavalues,1
1223,Hard Times,2018,2018-01-01,Punk Band YouTube Series to Release Split 7-Episode Season with Other Punk Band YouTube Series,1
1224,Hard Times,2018,2018-01-01,As a Dead Kennedys Fan I Have Some Strong Political Opinions That Stop in the mid 80s,1
1225,Hard Times,2018,2018-01-01,Steampunk Beaten Up By Steamjock,1
1226,Hard Times,2018,2018-01-01,Nobody Sure if Post Rock Band Has Started Playing Yet,1
1227,Hard Times,2018,2018-01-01,Progressive Punk Asks if He Could “Homeless Person” a Cigarette,1
1228,Hard Times,2018,2018-01-01,"Jeff Sessions’ Weed Repeal is Bad for the Economy, Health Care, and 311",1
1229,Hard Times,2018,2018-01-01,13 ½-Year-Old Punk Has Midlife Crisis,1
1230,Hard Times,2018,2018-01-01,Local Punk Spends 10th Winter Failing to Realize Doc Martens Are Not Winter Boots,1
1231,Hard Times,2018,2018-01-01,If You’ve Carved ‘Slayer’ Into Your Arm You Could Be Looking At A Huge Cash Settlement,1
1232,Hard Times,2018,2018-01-01,Modern-Day Rockefeller Pays $6 for Sliding Scale Admission,1
1233,Hard Times,2018,2018-01-01,BREAKING: Satan to Award Slayer with Gold Watch for Lifetime of Service,1
1234,Hard Times,2018,2018-01-01,Panda Bear Refusing to Mate in Captivity,1
1235,Hard Times,2018,2018-01-01,"Shit! According to My Psychic, My Spirit Animal Is That Dancing Guy from the Mighty Mighty Bosstones",1
1236,Hard Times,2018,2018-01-01,"Neil Peart Treats Himself to Big, Shiny Drum",1
1237,Hard Times,2018,2018-01-01,Musician on First Date Checks Set List for Next Anecdote,1
1238,Hard Times,2018,2018-01-01,Feminist Pioneer: This Man Championed ‘Free Bleeding’ More Than 30 Years Ago,1
1239,Hard Times,2018,2018-01-01,Band on DIY Festival Comfortably Sets up Equipment Within Designated 12-Second Timeframe,1
1240,Hard Times,2018,2018-01-01,Alice Cooper Unveils Plans for First Republican Goth Golf Course,1
1241,Hard Times,2018,2018-01-01,The Menzingers Announce Concept Album About Coaching Little League,1
1242,Hard Times,2018,2018-01-01,Indie Goat Thinks Vinyl Tastes Better,1
1243,Hard Times,2018,2018-01-01,Report: One in Five Jazz Cats Go Hog Wild Blowing on That Saxophone,1
1244,Hard Times,2018,2018-01-01,Deranged Man Jumps in Front of Train Concert,1
1245,Hard Times,2018,2018-01-01,Tiny NPR Editor Sick of These Bands Using His Desk,1
1246,Hard Times,2018,2018-01-01,Man Finally Turns Life-Long Passion Into Part-Time Hobby,1
1247,Hard Times,2018,2018-01-01,Bose Introduces Music-Cancelling Headphones,1
1248,Hard Times,2018,2018-01-01,Dexter Holland Introduces Brand of Wine that Gets Worse with Age,1
1249,Hard Times,2018,2018-01-01,Experimental Song Fails,1
1250,Hard Times,2018,2018-01-01,First Date to DIY Basement Show Going About as Well as One Would Expect,1
1251,Hard Times,2018,2018-01-01,"Hard-Hitting Journalist Asks Where Band Name Came From, if They’re Having Fun on Tour",1
1252,Hard Times,2018,2018-01-01,Forward-Thinking Band Drafts Public Apology at First Practice,1
1253,Hard Times,2018,2018-01-01,Morrissey Announces Cancellation of Frank Ocean Show,1
1254,Hard Times,2018,2018-01-01,New Shazam Feature Identifies Which TED Talk Friend Ripped off During Debate,1
1255,Hard Times,2018,2018-01-01,Zack de la Rocha Listening to Paul Ryan at Gym,1
1256,Hard Times,2018,2018-01-01,Buckethead Finally Reveals Origin of Mysterious Nickname,1
1257,Hard Times,2018,2018-01-01,BREAKING: Lana Del Rey Ordered to “Pay What You Want” in Radiohead Lawsuit,1
1258,Hard Times,2018,2018-01-01,"Grind Band Announces Two-Day, 50-City Tour",1
1259,Hard Times,2018,2018-01-01,Man Worried Punk Friends Only Like Him for His Basement,1
1260,Hard Times,2018,2018-01-01,How to Pretend You Still Listen to Death Grips,1
1261,Hard Times,2018,2018-01-01,True Location of Secret Show Inside Heart All Along,1
1262,Hard Times,2018,2018-01-01,Unconditional: My Punk Son Has Always Been Like a Step-Son to Me,1
1263,Hard Times,2018,2018-01-01,"Disgusting, Sweaty Man at Local Show Thinks Female Guitarist’s Armpit Hair Is Gross",1
1264,Hard Times,2018,2018-01-01,Archaeologists Uncover Mambos #1-4,1
1265,Hard Times,2018,2018-01-01,Mikey Erg Not Even Sure Which Band He’s Drumming For Right Now,1
1266,Hard Times,2018,2018-01-01,Study: Song That Faded Out Possibly Never Ended,1
1267,Hard Times,2018,2018-01-01,Trumpet Player Stuck in Traffic Turns Shitty Ska Band Into Okay Punk Band,1
1268,Hard Times,2018,2018-01-01,"These Three Syrian Kids Overcame Every Obstacle to Record a Heavy Metal Album, Which We Give a 2/10",1
1269,Hard Times,2018,2018-01-01,Venue’s Glade Plug-In Doing the Best It Can,1
1270,Hard Times,2018,2018-01-01,Tom Waits Sued by Dive Bar Bathroom Stall for Plagiarism,1
1271,Hard Times,2018,2018-01-01,Punk Band’s New Years Eve Set Pushed Back to 12:30,1
1272,Hard Times,2018,2018-01-01,I Moved to Long Island Yesterday and I’m Already Kicked out of Glassjaw,1
1273,Hard Times,2018,2018-01-01,Vocalist Explains Drum Part Should Be Less “bum-da-bum-da-bum-bum” and More “bum-bum-da-da-bum-bum-bum”,1
1274,Hard Times,2018,2018-01-01,GG Allin-Inspired Frontman Has Nightmare About Being Clothed On Stage,1
1275,Hard Times,2019,2019-01-01,Barista Wishes More People Would Care He Is Gotye,1
1276,Hard Times,2019,2019-01-01,Amateur GG Allin Impersonator Can’t Go With Everyone Watching Him,1
1277,Hard Times,2019,2019-01-01,Punk on Pawn Stars Offered $300 to Leave Store Without Causing a Scene,1
1278,Hard Times,2019,2019-01-01,"“Cotton Eye Joe” by Rednex Is World’s Sexiest Song, Because You Assholes Didn’t Take Our Poll Seriously",1
1279,Hard Times,2019,2019-01-01,Smashed Guitar Had One Day Until Retirement,1
1280,Hard Times,2019,2019-01-01,Scientists Discover Theoretical Fourth Thing To Do With Hands During Show,1
1281,Hard Times,2019,2019-01-01,Dead Friend Invited to Show on Facebook Just in Case,1
1282,Hard Times,2019,2019-01-01,Aging Punks Outside Venue Share Their Best New Ailments of 2019,1
1283,Hard Times,2019,2019-01-01,Everclear Frontman “Honestly Not Surprised” Dad a No-Show at Christmas Again,1
1284,Hard Times,2019,2019-01-01,Santa Sneaks Bandcamp Link to His Lo-fi Indie EP Into Child’s Stocking,1
1285,Hard Times,2019,2019-01-01,Local Band Banned Locally,1
1286,Hard Times,2019,2019-01-01,Christian Rock Groupie Waiting Until Marriage to Go Backstage,1
1287,Hard Times,2019,2019-01-01,Lying Frontman Can Clearly Hear Motherfuckers in Back,1
1288,Hard Times,2019,2019-01-01,"Punk on “Chopped” Knows Exactly What Entree to Make With Mars Bar, Leftover Mac n’ Cheese, Warm PBR",1
1289,Hard Times,2019,2019-01-01,Local School Board Unsure Why Billy Corgan Speaking at Meeting,1
1290,Hard Times,2019,2019-01-01,Punk Carolers Regretting Decision to Sing “Last Caress”,1
1291,Hard Times,2019,2019-01-01,Sleepy Punk Puts Tiny Nightcaps On Each Individual Mohawk Spike,1
1292,Hard Times,2019,2019-01-01,Papa Roach Fan Still Alive Weeks After Head Severed,1
1293,Hard Times,2019,2019-01-01,"Registered Sex Offender Excited, Legally Required to Announce New Tour Dates",1
1294,Hard Times,2019,2019-01-01,Exhibitionist Punk Removes Tape from Webcam,1
1295,Hard Times,2019,2019-01-01,Hardcore Frontman Wants to Open Up This Relationship,1
1296,Hard Times,2019,2019-01-01,Hungover Man Guesses He Owns Local Band’s CD Now,1
1297,Hard Times,2019,2019-01-01,Everyone at Punk Show Worried Everyone Else Will Find Out About Their Rich Parents,1
1298,Hard Times,2019,2019-01-01,Punk on Deathbed About to Utter Final Words Just Waiting for a Few More Loved Ones to Show Up,1
1299,Hard Times,2019,2019-01-01,We Talked to Generation X to Figure Out Why They Ruined the Economy,1
1300,Hard Times,2019,2019-01-01,Waffle House Closest Thing Small Town Has to Punk Venue,1
1301,Hard Times,2019,2019-01-01,Insecure Straight Edge Guy Leaves Bartender $5 Tip on Glass of Tap Water,1
1302,Hard Times,2019,2019-01-01,Emo Album That Got Man Through Depressive Period Actually Made It Much Worse,1
1303,Hard Times,2019,2019-01-01,Local Crust Punk Scene Veteran Just a Pigeon,1
1304,Hard Times,2019,2019-01-01,Punk Sommelier Recommends Pre-2015 Franzia,1
1305,Hard Times,2019,2019-01-01,Band Giving Free EPs to First 50 Fans at Show Not Sure What to do with Box of 47 EPs,1
1306,Hard Times,2019,2019-01-01,Dropkick Murphys Cruise Just Stays Docked in Boston Harbor Whole Time,1
1307,Hard Times,2019,2019-01-01,We Interviewed Rilo Kiley but She Just Kept Saying “Stop Calling Me That. My Name’s Jenny Lewis”,1
1308,Hard Times,2019,2019-01-01,Punk Venue Offers Senior Discount to Anyone over 25,1
1309,Hard Times,2019,2019-01-01,Handsome Musician Who Is Also Really Funny Can Go Right Ahead and Fuck Himself,1
1310,Hard Times,2019,2019-01-01,The Menzingers Offer Stamped Factory Time Cards to Appease Springsteen Effigy,1
1311,Hard Times,2019,2019-01-01,Punk Father and Son Duo Restore Mint 2017 Ford Econoline to Barely Functioning Condition,1
1312,Hard Times,2019,2019-01-01,Terrifying: Meet the Man Still Idolizing Bam Margera,1
1313,Hard Times,2019,2019-01-01,Punk Who Signed Up to Run Marathon Shits Self at Starting Line,1
1314,Hard Times,2019,2019-01-01,Metal Fan Starting to Suspect “Fucked With a Knife” Lyrics Might be Kind of Not Cool Towards Women,1
1315,Hard Times,2019,2019-01-01,"I Know I’m Supposed to Like Fugazi, but I Don’t Know How",1
1316,Hard Times,2019,2019-01-01,Report: No One in Punk House Can Remember When They Got Cat,1
1317,Hard Times,2019,2019-01-01,We Sat Down With Rivers Cuomo Because All the Other Seats in the Cafeteria Were Taken,1
1318,Hard Times,2019,2019-01-01,REPORT: Cool TV Show Using Punk Version of Christmas Song,1
1319,Hard Times,2019,2019-01-01,Kid Brother of Guitarist Guesses He Has to Learn Bass Now,1
1320,Hard Times,2019,2019-01-01,Bomb Squad Called After Noise Rock Musician Forgets Pedalboard at Bus Station,1
1321,Hard Times,2019,2019-01-01,No One on DIY Tour Can Change Tire,1
1322,Hard Times,2019,2019-01-01,"Punk on “Wheel of Fortune” Trying to Solve Everything With Just C, G, and D",1
1323,Hard Times,2019,2019-01-01,Folk Punk Win: This 30 Year Old Finally Got Kicked out of His Parents’ House,1
1324,Hard Times,2019,2019-01-01,P.C. Punk Stoked to Find Out He and Bandmate Are “Inuit Inupiaq Brothers”,1
1325,Hard Times,2019,2019-01-01,Pop-Punk Bassist in Godflesh Shirt Clearly Wishes He Was in Different Band,1
1326,Hard Times,2019,2019-01-01,We Interviewed the Stray Cats and They All Threw up on Our Couch,1
1327,Hard Times,2019,2019-01-01,Million Frontman March Enters 17th Consecutive Day of Speeches,1
1328,Hard Times,2019,2019-01-01,Leftöver Crack Song Playing Over ASPCA Commercial for Crust Punk Dogs,1
1329,Hard Times,2019,2019-01-01,Punk Realtor Excited to Show Off Home’s Unfinished Basement,1
