,source,year,date,title,is_sarcastic
0,Hard Times,2016,2016-01-01,"College Rock Band Locked Into Groove, Student Debt",1
1,Hard Times,2016,2016-01-01,(WATCH) Lowriders: Bass Player Support Group,1
2,Hard Times,2016,2016-01-01,"Gibson Flying V’s Migrate to Warmer, Harder-Rocking Climates for Winter",1
3,Hard Times,2016,2016-01-01,Band Better Settle down or Driver Will Turn This Tour Van Around,1
4,Hard Times,2016,2016-01-01,We Gave Die Antwoord Haircuts to Several Animals at This Local Shelter and Not a Single One Was Adopted,1
5,Hard Times,2016,2016-01-01,Long-Lost Mastodon Demo Tape Found Frozen in Russian Tundra,1
6,Hard Times,2016,2016-01-01,Young Jeezy Showed Us His Atlanta and We Hate to Admit It but We Didn’t Know What the Hell Was Going On,1
7,Hard Times,2016,2016-01-01,B.C. Rich Warlock Named People’s Sexiest Man Alive,1
8,Hard Times,2016,2016-01-01,How to Kill Your Rhythm Guitarist So You Don’t Have to Play Bass Anymore,1
9,Hard Times,2016,2016-01-01,World’s First Show Flyers Found Etched On Cave Walls In France,1
10,Hard Times,2016,2016-01-01,Trump Books Banjo Kid from ‘Deliverance’ to Play Inauguration,1
11,Hard Times,2016,2016-01-01,Feel Old Yet? You’re Not Allowed to Date Any of the 15-Year-Old Girls at This Pop-Punk Show,1
12,Hard Times,2016,2016-01-01,Local Band Killing It With “Obligated Friends” Demographic,1
13,Hard Times,2016,2016-01-01,Male Feminist Demands More Female Participation in Scene,1
14,Hard Times,2016,2016-01-01,Band Nervous to Go On Awkward First Tour Together,1
15,Hard Times,2016,2016-01-01,Drake’s Studio Haunted by Ghostwriters,1
16,Hard Times,2016,2016-01-01,Punk A Cappella Band Smashes Vocal Cords After Set,1
17,Hard Times,2016,2016-01-01,5 Signs You Are Your Drummer’s Side Project,1
18,Hard Times,2016,2016-01-01,Touring Band Unboxing New Merch Already Out of Mediums,1
19,Hard Times,2016,2016-01-01,Donald Trump: “The Three Ghosts Who Visited Me Last Night Were Very Rude. Phony. Apologize!”,1
20,Hard Times,2016,2016-01-01,"Band Cashes in 10,000 Drink Tickets for Super Sweet Mountain Bike",1
21,Hard Times,2016,2016-01-01,We Used a Ouija Board to Ask Joey Ramone to Rank His Albums (But He Just Wanted to Talk About Christmas in the ’70s),1
22,Hard Times,2016,2016-01-01,"Entire Trans-Siberian Orchestra Waiting for Fucking Dale, Who’s Late for Practice Again",1
23,Hard Times,2016,2016-01-01,I Posted Morrissey Lyrics on Facebook for a Month and Nobody Called to Check on Me,1
24,Hard Times,2016,2016-01-01,Anarchist Bowling Team Fail to Organize Strike,1
25,Hard Times,2016,2016-01-01,Tatooine Punk Complains Sarlacc Pits Used to Be Way Crazier Back in His Day,1
26,Hard Times,2016,2016-01-01,Hostage Negotiations with Sound Guy Begin as Sound Check Moves into 5th Hour,1
27,Hard Times,2016,2016-01-01,10 Bible Passages That Prove Jesus Was a Working Class Skinhead,1
28,Hard Times,2016,2016-01-01,Goth Teen to Ruin Family Christmas Card for the Third Year in a Row,1
29,Hard Times,2016,2016-01-01,Don’t Worry: We Checked and Vapecore Isn’t a Thing,1
30,Hard Times,2016,2016-01-01,"In Gender-Equal Punk House, No One Does the Dishes",1
31,Hard Times,2016,2016-01-01,Innovative Stoner Metal Album Blends Influences from Black Sabbath and Black Sabbath,1
32,Hard Times,2016,2016-01-01,Band to Reunite and Play 2015 Demo in Its Entirety,1
33,Hard Times,2016,2016-01-01,This Frontman’s Heartwarming Shoutout to His Friends Fucking Shit up Will Give You All the Feels,1
34,Hard Times,2016,2016-01-01,Hero Fights Systemic Racism with Positive A Tribe Called Quest iTunes Review,1
35,Hard Times,2016,2016-01-01,Lost Guitar Picks: Where Are They Now?,1
36,Hard Times,2016,2016-01-01,Single Goth Girl Just Hoping to Meet Guy Who Loathes All the Same Things,1
37,Hard Times,2016,2016-01-01,Home Depot Closes as Cops Crack Down on DIY Spaces,1
38,Hard Times,2016,2016-01-01,Disturbed on Hiatus After Lead Singer Finishes Clearing Throat,1
39,Hard Times,2016,2016-01-01,"Eddie Vedder Desperately Trying to Tell Young Boy, “There’s Trouble at the Old Well!”",1
40,Hard Times,2016,2016-01-01,Donald Trump Demands Billie Holiday Change Name to “Billie Christmas”,1
41,Hard Times,2016,2016-01-01,Punk Releases Year-End Top 10 List of Favorite Bands He’s In,1
42,Hard Times,2016,2016-01-01,7 Pictures of Ian MacKaye in Silly Hats (You’ll Never Believe Number 4!),1
43,Hard Times,2016,2016-01-01,Dude Has Perfect Facebook Post Planned for When Iggy Pop Dies,1
44,Hard Times,2016,2016-01-01,Unlucky Dischord Records Intern Draws Ian MacKaye for Office Secret Santa,1
45,Hard Times,2016,2016-01-01,Oh No! Mom’s New Boyfriend Is Tony From Victory Records!,1
46,Hard Times,2016,2016-01-01,Club Booker Needs You to Bring Ten of Your Friends to His Dad’s Funeral,1
47,Hard Times,2016,2016-01-01,Man Lies to Guitar Center Cashier About Finding Everything OK,1
48,Hard Times,2016,2016-01-01,Drake Scrambles to Meet With Justin Trudeau,1
49,Hard Times,2016,2016-01-01,New Sammy Hagar Tequila Puts Too Much Hair On Your Chest,1
50,Hard Times,2016,2016-01-01,Scientists Discover New Microscopic Font for Shitty and Unknown Bands on Festival Posters,1
51,Hard Times,2016,2016-01-01,Band Without Cassette Deck Hasn’t Heard Their New Album Either,1
52,Hard Times,2016,2016-01-01,HELP! I Squatted for This Crew Pic and I Can’t Get Up,1
53,Hard Times,2016,2016-01-01,Metalhead’s Pilgrimage to Sweden Nowhere Near as Brutal as Expected,1
54,Hard Times,2016,2016-01-01,Obama to Throw One Last Basement Party Before Asshole Tenants Take Over Lease,1
55,Hard Times,2016,2016-01-01,5 Marilyn Manson Songs That HEY FUCK OFF DAD I’M WRITING MY ARTICLES RIGHT NOW,1
56,Hard Times,2016,2016-01-01,Crust Punk Promises Humans Will Squat On Mars by 2025,1
57,Hard Times,2016,2016-01-01,Band’s Tour Rider Just Asks For Audience,1
58,Hard Times,2016,2016-01-01,Christian Metal Flyer Not Intelligently Designed,1
59,Hard Times,2016,2016-01-01,4 Lovely Weddings Ruined by Slash Ripping a Solo,1
60,Hard Times,2016,2016-01-01,"I’m Sure There Are Lots of Examples of Vans Stealing From People, Too",1
61,Hard Times,2016,2016-01-01,Facebook RSVP Numbers So Dismal Man Actually Tells Co-workers About Upcoming Show,1
62,Hard Times,2016,2016-01-01,Top 5 Labels to Boycott for Not Signing My Band,1
63,Hard Times,2016,2016-01-01,New Band-Forming App Lets You Swipe Through Hot Bass Players In Your Area,1
64,Hard Times,2016,2016-01-01,Jill Stein Demands Recount Of “Rolling Stone’s 50 Best Albums Of 2016”,1
65,Hard Times,2016,2016-01-01,"Wow! A Local Hardcore Legend Is at Your Doorstep. He’s 15 Minutes Late with the Pizza, How Much Do You Tip?",1
66,Hard Times,2016,2016-01-01,Facebook Announces Plan to Crack Down on Fake Punks,1
67,Hard Times,2016,2016-01-01,"Hologram Tupac Seen Alive, Living in Bahamas",1
68,Hard Times,2016,2016-01-01,Awkward Kid Asks Guitarist About Pedals Mid-song,1
69,Hard Times,2016,2016-01-01,5 Bands This Teenager Has Called ‘Gay’,1
70,Hard Times,2016,2016-01-01,Beat On The Brat: Hard Times and Punktendo Made A Joey Ramone Video Game,1
71,Hard Times,2016,2016-01-01,Crowd Surfer Attacked By Crowd Shark,1
72,Hard Times,2016,2016-01-01,"RIP Lars Ulrich: We Really Didn’t Know You Had a Peanut Allergy, and That’s Our Bad",1
73,Hard Times,2016,2016-01-01,Man Magically Transforms Into Music Historian While Talking to Women,1
74,Hard Times,2016,2016-01-01,43-Year-Old Pens Next Great Teenage Anthem,1
75,Hard Times,2016,2016-01-01,Mathcore Band’s Album Art Flipped Upside Down Says ‘BOOBS’,1
76,Hard Times,2016,2016-01-01,Coward Meekly Accepts Second Copy of Same Show Flyer,1
77,Hard Times,2016,2016-01-01,Report: Punk Complaining About Consumerism Culture of Christmas Earlier Each Year,1
78,Hard Times,2016,2016-01-01,Emo Band Reunion Interrupted by Impromptu High School Bully Reunion,1
79,Hard Times,2016,2016-01-01,‘What Time R U Playing?’ Texts Friend with No Intention of Coming to Show,1
80,Hard Times,2016,2016-01-01,Speed Metal Band Wired to Explode If They Play Less Than 300 BPM,1
81,Hard Times,2016,2016-01-01,New Issue of Cometbus Mostly Perfume Samples,1
82,Hard Times,2016,2016-01-01,We Ranked Every Rancid Album by Whether it is ‘…And Out Come The Wolves’,1
83,Hard Times,2016,2016-01-01,Production of Drake’s New Single Halted by Faulty Conveyor Belt,1
84,Hard Times,2016,2016-01-01,5 NYHC Frontmen You Had No Idea Were Wicked Freakin’ Ticklish,1
85,Hard Times,2016,2016-01-01,‘90s Hardcore Scene Lives On in Uncontacted Canadian Town,1
86,Hard Times,2016,2016-01-01,Iggy Pop Now Old Enough to Start Going By ‘Iguana’,1
87,Hard Times,2016,2016-01-01,Thanksgiving Dinner Delayed 20 Minutes As Frontman Shouts Out Everyone He’s Thankful For,1
88,Hard Times,2016,2016-01-01,"We Asked a Real Teenager From Mars If They Care, and Their Answer Shocked Us!",1
89,Hard Times,2016,2016-01-01,"Victory Records Not Trustworthy Says Judge, Tell-All Book, And Everyone Else For Last Decade",1
90,Hard Times,2016,2016-01-01,"Victory Records Not Trustworthy Says Judge, Tell-All Book, And Everyone Else For Last Decade",1
91,Hard Times,2016,2016-01-01,Dog At Basement Show Stealing Attention Away From Bands,1
92,Hard Times,2016,2016-01-01,Singer/Songwriter More of a Whiny/Asshole,1
93,Hard Times,2016,2016-01-01,Rage Against The Machine’s Tom Morello Confirms It was a Fax Machine,1
94,Hard Times,2016,2016-01-01,Anal Cunt Shirt Lint Rolled,1
95,Hard Times,2016,2016-01-01,"In Your Face, Napster: Metallica Releases Album Nobody Wants to Steal",1
96,Hard Times,2016,2016-01-01,"Petition to Rewire Kanye West’s Jaw Shut Garners 25,000 Signatures in First Hour",1
97,Hard Times,2016,2016-01-01,5 Vegetables That Look Like Iconic Hardcore OK Look It’s Friday and I Just Want to Get out of Here,1
98,Hard Times,2016,2016-01-01,Brian and Susan’s Wedding Mix CD Gets 2.7 Review on Pitchfork,1
99,Hard Times,2016,2016-01-01,"Trump: “I Like the Music Legends Who Didn’t Die, OK?”",1
100,Hard Times,2016,2016-01-01,Music Industry Announces It’s No Longer Hiring,1
101,Hard Times,2016,2016-01-01,All Opinions Are Welcome at This Inclusive Venue Except Those That Are Wrong,1
102,Hard Times,2016,2016-01-01,Craigslist “Gigs” Section Lands Band Sweet Opportunity to Help Move Couch,1
103,Hard Times,2016,2016-01-01,Hardcore Lyricist Struggling to Fit All 9/11 Truths Into 90-Second Song,1
104,Hard Times,2016,2016-01-01,Voter Suppression: Jello Biafra Needs More Room on Write-In Section of Ballot,1
105,Hard Times,2016,2016-01-01,Investigation: Does This Photo Prove Donald Trump Was the Drummer of Youth Defense League?,1
106,Hard Times,2016,2016-01-01,Frontman’s Perfectly Nonsensical Political Rant Ruined by Short Bursts of Music,1
107,Hard Times,2016,2016-01-01,Minor Threat Reference Wasted on Chili’s Waitress,1
108,Hard Times,2016,2016-01-01,Pop-Punk Side Project Proving Far More Lucrative Than Original Band,1
109,Hard Times,2016,2016-01-01,Band Willing to Support Any Cause That Helps Them Get More Shows,1
110,Hard Times,2016,2016-01-01,5 Signs Your Favorite Musician Died,1
111,Hard Times,2016,2016-01-01,White Guy About to Hit First ‘N-Word’ in Kanye West Karaoke,1
112,Hard Times,2016,2016-01-01,Hardcore Band Announces Their Other Band Plays Next,1
113,Hard Times,2016,2016-01-01,Band Owes Manager 15% of Pizza,1
114,Hard Times,2016,2016-01-01,Make-A-Wish Kid Given One Last Chance to Fuck Shit Up in Pit,1
115,Hard Times,2016,2016-01-01,Friend Who ‘Attended’ ‘Smash Mouth Show at Orange Julius’ Mocks Your Standing Rock Check-In,1
116,Hard Times,2016,2016-01-01,Band Makes Up for Shitty Music with Matching Costumes,1
117,Hard Times,2016,2016-01-01,Punk House Giving Out Demo Tapes Instead of Candy,1
118,Hard Times,2016,2016-01-01,Fact Checker Debunks Frontman’s Claim of Cincinnati Having “One of the Best Hardcore Scenes”,1
119,Hard Times,2016,2016-01-01,Warped Tour ’98 Carpool Reunites for Fest 15 Road Trip,1
120,Hard Times,2016,2016-01-01,Punk Spends Six Months Mocking the Appalachian Trail,1
121,Hard Times,2016,2016-01-01,This Artist Re-Imagined Your Favorite Hardcore Bands as Pokemon and Did a Really Shitty Job,1
122,Hard Times,2016,2016-01-01,Dad Continues to Remind Band They Should Be Paid for Gigs,1
123,Hard Times,2016,2016-01-01,"Where Are They Now? NOFX: Oh Wait, There They Are",1
124,Hard Times,2016,2016-01-01,Venue Closed Due to Toxic Levels of Nostalgia,1
125,Hard Times,2016,2016-01-01,Original Members of Misfits Cover Band Reunite for Halloween Show,1
126,Hard Times,2016,2016-01-01,8 Pumpkin Patches Personally Approved by AFI,1
127,Hard Times,2016,2016-01-01,Bad Father Still Pretty Good DJ,1
128,Hard Times,2016,2016-01-01,Dork Keeps Flashing Wristband at Door Guy Every Time He Re-enters Show,1
129,Hard Times,2016,2016-01-01,Skinhead Band Not Racist But Also Not Good,1
130,Hard Times,2016,2016-01-01,New Homeowners Unaware Scene Once Died In Basement,1
131,Hard Times,2016,2016-01-01,New Red Hot Chili Peppers Single Just California’s Wikipedia Page Set to Music,1
132,Hard Times,2016,2016-01-01,Nardwuar the Human Serviette Key Witness in Murder of Obscure Canadian Musician,1
133,Hard Times,2016,2016-01-01,Shirtless Man Near Stage Absorbed Into Hardcore Band,1
134,Hard Times,2016,2016-01-01,"“Plagiarism Is No Laughing Matter,” Says Band Named After Movie Reference",1
135,Hard Times,2016,2016-01-01,We Might Photoshop Mike Pence Into the Misfits. Is That Something You Want to See?,1
136,Hard Times,2016,2016-01-01,50-Foot-Tall Henry Rollins Rampages Through Lower East Side,1
137,Hard Times,2016,2016-01-01,Feel Old Yet? The Painting From Warzone’s ‘Sound of Revolution’ Cover Just Turned 141,1
138,Hard Times,2016,2016-01-01,AOL Reissues Classic “50 Hours Free!” CD on Vinyl,1
139,Hard Times,2016,2016-01-01,Meet the Ken Bone-Themed Metal Band That Are Clearly Just Doing This for Attention,1
140,Hard Times,2016,2016-01-01,Psychic Music Journalist Knows Album Sucks Without Listening to It,1
141,Hard Times,2016,2016-01-01,"No One Remembers I Used to Be in From First to Last, Right?",1
142,Hard Times,2016,2016-01-01,"Tour A Whirlwind of Sex and Drugs, Imagines Teenage Band at Pizza Place",1
143,Hard Times,2016,2016-01-01,Bill Clinton Campaign Schedule Suspiciously Similar to Mighty Mighty Bosstones Fall Tour Dates,1
144,Hard Times,2016,2016-01-01,"Greg Graffin Cancelled Our Interview, but Here Is Some Stuff We Think He’d Say",1
145,Hard Times,2016,2016-01-01,Band Claims to Have Fanbase In Canada It Met At Summer Camp,1
146,Hard Times,2016,2016-01-01,The Term Skanking Is Problematic and That’s Not Even One of the Top 5 Reasons Ska Is Dead,1
147,Hard Times,2016,2016-01-01,Bored Girlfriend at Show Makes Daring Escape in Box of Merch,1
148,Hard Times,2016,2016-01-01,Amazing! These Two Bands on Opposite Sides of the Country Made the Exact Same Demo,1
149,Hard Times,2016,2016-01-01,Iggy Pop Asks Kids With Shirts To Buy Him Beer,1
150,Hard Times,2016,2016-01-01,Iggy Pop Asks Kids With Shirts To Buy Him Beer,1
151,Hard Times,2016,2016-01-01,Veteran Hardcore Frontman Emerges From Denim Cocoon a Bearded Alt-Country Artist,1
152,Hard Times,2016,2016-01-01,"Breaking: Band Has One Song Left, “You Guys Have Been Great”",1
153,Hard Times,2016,2016-01-01,I Listened to Beyonce’s Visual Album For 154 Days Straight And Lost Everything,1
154,Hard Times,2016,2016-01-01,5 Times Your Mom’s Boyfriend Told You He Liked The Clash,1
155,Hard Times,2016,2016-01-01,"$24,000 in Repairs Made to $800 Tour Van",1
156,Hard Times,2016,2016-01-01,We Interviewed the Wrong Tim Armstrong About What the Yahoo Hacks Mean for AOL,1
157,Hard Times,2016,2016-01-01,"Close Friend Can’t This Time, But Will Totally Come to Next Show",1
158,Hard Times,2016,2016-01-01,Soundman: The Art of The Grumpy (VIDEO),1
159,Hard Times,2016,2016-01-01,"Martin Shkreli Buys Fugazi, Jacks Ticket Price Up to $9",1
160,Hard Times,2016,2016-01-01,Climate Scientists Warn of Record Temperatures Inside Garage Venue,1
161,Hard Times,2016,2016-01-01,Guy with Sweatshirt Tied Around Waist Ready to Start Push Pit,1
162,Hard Times,2016,2016-01-01,Stand-Up Bassist Not That Funny,1
163,Hard Times,2016,2016-01-01,I Tried the Henry Rollins Fitness Plan for 30 Days and Now I Can’t Stop Yelling,1
164,Hard Times,2016,2016-01-01,5 Parenting Tips from a Skinhead Who Promises He’s Not Racist Anymore,1
165,Hard Times,2016,2016-01-01,7 Signs You’re The Frontman Of Terror,1
166,Hard Times,2016,2016-01-01,5 Lines of Cocaine This Garage Rock Douchebag Isn’t Going to Share With You,1
167,Hard Times,2016,2016-01-01,"Bonnaroo Flu Claims Six More Barely Clothed, Drug-Addled Victims",1
168,Hard Times,2016,2016-01-01,Drone Metal Band Holds 43-Minute Moment of Silence for Dead Friend,1
169,Hard Times,2016,2016-01-01,Emo Band Could Not Be Sadder You All Came Out Tonight,1
170,Hard Times,2016,2016-01-01,Missed Connections Ad On Chicago Craigslist Clearly Glenn Danzig,1
171,Hard Times,2016,2016-01-01,Steampunk Band Postpones Tour After Crashing Flight Apparatus,1
172,Hard Times,2016,2016-01-01,None of the Reunited Misfits Recognize Drummer,1
173,Hard Times,2016,2016-01-01,Crust Punk Hops Train to Parents’ Lake House,1
174,Hard Times,2016,2016-01-01,Touring Band Refuses to Leave for Next City After Scoring Perfect Parking Spot,1
175,Hard Times,2016,2016-01-01,Adult Woman Feeling Oddly Compelled to Impress Little Cousin Wearing Dead Kennedys Shirt,1
176,Hard Times,2016,2016-01-01,Street Punk Band Tactfully Inquires About Straight Edge Band’s Drink Tickets,1
177,Hard Times,2016,2016-01-01,Epitaph Executive Still Holding Boombox Outside G.L.O.S.S.’s House,1
178,Hard Times,2016,2016-01-01,Frontman Too Scared to Climb Down From Rafters,1
179,Hard Times,2016,2016-01-01,Fourth-Grader Already Listening to the Ramones at Eighth-Grade Level,1
180,Hard Times,2016,2016-01-01,Band Caught Taking Performance Enhancing Lessons,1
181,Hard Times,2016,2016-01-01,Musicians Promise to Start Band Together if They’re Still Solo Acts at 30,1
182,Hard Times,2016,2016-01-01,Influential Band Would Rather Just Be Rich,1
183,Hard Times,2016,2016-01-01,Misfits Reunion Canceled as Northside Kings Confirm Riot Fest,1
184,Hard Times,2016,2016-01-01,Dad Patiently Waits in Car Outside Burning Man for 8 Days,1
185,Hard Times,2016,2016-01-01,Nation Outraged After Punk Refuses to Stand for Pennywise’s ‘Bro Hymn’,1
186,Hard Times,2016,2016-01-01,Green Day Threatens to Release New Album,1
187,Hard Times,2016,2016-01-01,Verizon Announces New “Hardcore Family” Cell Phone Plan,1
188,Hard Times,2016,2016-01-01,Former Geologist Enters Post-Rock Phase,1
189,Hard Times,2016,2016-01-01,Complete Moron Claps Before Song Is Over,1
190,Hard Times,2016,2016-01-01,Stoner-Tech Metal Band Trying Really Hard to Write Song in 4/20 Time,1
191,Hard Times,2016,2016-01-01,Lemmy Impersonator Dead After Three Weeks on the Job,1
192,Hard Times,2016,2016-01-01,Investigation: Does This Drummer Even Own a Shirt?,1
193,Hard Times,2016,2016-01-01,"Girlfriend Unveils Bizarre, Somewhat Punk-Themed Monstrosity of a Birthday Present",1
194,Hard Times,2016,2016-01-01,Lonely Punk Looking for Love in All the Wrong Safe Spaces,1
195,Hard Times,2016,2016-01-01,Man Who Is Definitely Not A Criminal Selling Trailer Full Of “Professional Band Shit”,1
196,Hard Times,2016,2016-01-01,Man Acquitted Of Assault After Citing Landmark Case Of Talk Shit v. Get Hit,1
197,Hard Times,2016,2016-01-01,"Ceremony Thinks You Were Better in 2006, Too",1
198,Hard Times,2016,2016-01-01,"Get Ready, Metal Heads: This Real Life Crazy Train Just Derailed, Injuring Dozens",1
199,Hard Times,2016,2016-01-01,Hardline Straight Edge Kid Wakes From Coma to Unplug IV,1
200,Hard Times,2016,2016-01-01,Air Conditioner Works Harder Than Anyone Else at Band Practice,1
201,Hard Times,2016,2016-01-01,Bill Clinton’s Ska Band Looking Forward to Eight More Years of Practicing in White House Garage,1
202,Hard Times,2016,2016-01-01,Mashup Artist Ruins 73 Songs At Once,1
203,Hard Times,2016,2016-01-01,Henry Rollins Admits to Being “On the Fence” About an Issue,1
204,Hard Times,2016,2016-01-01,Man with G Clef Tattoo Must Be a Musician or Something,1
205,Hard Times,2016,2016-01-01,Northwest High School Battle of the Bands Will Be to the Death,1
206,Hard Times,2016,2016-01-01,Grown Man Still Angry About 20-Year-Old Album,1
207,Hard Times,2016,2016-01-01,Man Who Brought Boogie Board to Show Stabbed to Death Outside Venue,1
208,Hard Times,2016,2016-01-01,House Show Would Be Fun If It Weren’t For Bands,1
209,Hard Times,2016,2016-01-01,Legendary Frontman Proudly Recites Age of Consent in All 50 States,1
210,Hard Times,2016,2016-01-01,Legendary Frontman Proudly Recites Age of Consent in All 50 States,1
211,Hard Times,2016,2016-01-01,Convicted Murderer Clearly Hoping Testimony Gets Used on Grindcore Album One Day,1
212,Hard Times,2016,2016-01-01,Musician Mother Asks For More Baby In Monitor,1
213,Hard Times,2016,2016-01-01,Bassist with Wireless System Journeys Off-Stage to Find New Trade Route with India,1
214,Hard Times,2016,2016-01-01,Metallica Adopts Hologram Technology to Replace Perfectly Healthy Lars Ulrich,1
215,Hard Times,2016,2016-01-01,"Man Takes Green Day Cover on Two-Week, 17-Guitar Center Tour",1
216,Hard Times,2016,2016-01-01,Mom Likes Band But Doesn’t Understand Why You Need All The Screaming,1
217,Hard Times,2016,2016-01-01,Reunion Show Cancelled for Same Reasons Band Broke Up in First Place,1
218,Hard Times,2016,2016-01-01,Evil Mastermind Making Way Through Crowd Doesn’t Actually Have a Friend Up There,1
219,Hard Times,2016,2016-01-01,Lead Singer of Punk Band Practices Selling Out in Front of Mirror,1
220,Hard Times,2016,2016-01-01,Punk’s Out-of-Office Email Response Needlessly Offensive,1
221,Hard Times,2016,2016-01-01,Reuniting Screamo Band to Play Classic Split 7” in its Entirety,1
222,Hard Times,2016,2016-01-01,"Clint Eastwood Defends Crowd Killing at Shows: ‘When I was growing up, we called that moshing’",1
223,Hard Times,2016,2016-01-01,Malia Obama’s Secret Service Detail Subtly Suggests Iron Maiden Might Be Fun Concert to Attend,1
224,Hard Times,2016,2016-01-01,Historic Punk Venue Seeks Fifth Roommate,1
225,Hard Times,2016,2016-01-01,Tom Delonge’s “New Material” A Beautiful Polyester/Silk Blend,1
226,Hard Times,2016,2016-01-01,Punk Caddy Doesn’t Give A Fuck Which Club You Use,1
227,Hard Times,2016,2016-01-01,The Ramones Reunite for One Last T-shirt,1
228,Hard Times,2016,2016-01-01,Ozzy Osbourne Googles “Black Sabbath Lyrics”,1
229,Hard Times,2016,2016-01-01,Drummer’s Other Band Has A Show That Night,1
230,Hard Times,2016,2016-01-01,Rockstar Noise Musician Smashes Laptop on Stage After Every Set,1
231,Hard Times,2016,2016-01-01,Exclusive Trailer: Straight Edge Kegger,1
232,Hard Times,2016,2016-01-01,Warped Tour Unveils New Tent for Adults to Complain About Lineup,1
233,Hard Times,2016,2016-01-01,"College Student Discovers Pink Floyd Syncs up Perfectly With Failing Grades, Loss of Friends",1
234,Hard Times,2016,2016-01-01,Dave Grohl to Lead All-Male Sleater-Kinney Reboot,1
235,Hard Times,2016,2016-01-01,OPINION: I’ve Loved This Band Ever Since I Found Out I Was Going To See Them,1
236,Hard Times,2016,2016-01-01,Hardcore Conclave Meets to Decide Which Pop-Punk Bands Get a Pass,1
237,Hard Times,2016,2016-01-01,Merch Guy Continues Tour After Entire Band Denied at Canadian Border,1
238,Hard Times,2016,2016-01-01,Tour Tips: Thank Your Non-Existent Fans,1
239,Hard Times,2016,2016-01-01,"Report: Don’t Tell Anyone, But There’s a Bathroom Upstairs",1
240,Hard Times,2016,2016-01-01,Fire Marshal Pleasantly Surprised with Low Show Turnout,1
241,Hard Times,2016,2016-01-01,Taking Back Sunday Threaten Military Campaign to Take Back Rest of Week,1
242,Hard Times,2016,2016-01-01,Drama-Filled Break-Up Letter Most Entertaining Thing Band Has Ever Released,1
243,Hard Times,2016,2016-01-01,"George W. Bush’s Administration to Reunite, Play Classic Presidency In Its Entirety at RNC",1
244,Hard Times,2016,2016-01-01,Hillary Clinton Sells Enough Tickets to Headline Democratic National Convention,1
245,Hard Times,2016,2016-01-01,Government Concedes to 13-Year-Old Anarchist’s Demands,1
246,Hard Times,2016,2016-01-01,Tour Tips: Picking The Perfect Cause to Rage Against,1
247,Hard Times,2016,2016-01-01,Guitarist One More Disruptive Quip Away From Losing Microphone Privileges,1
248,Hard Times,2016,2016-01-01,Successful Tour Loses Only $800,1
249,Hard Times,2016,2016-01-01,Crust Punk Father Will “Let Kids Touch His Bullet Belt When They’re Older”,1
250,Hard Times,2016,2016-01-01,Venue Bouncer Discovers Fire,1
251,Hard Times,2016,2016-01-01,Local Music Historians to Reenact 1993 Battle of the Bands,1
252,Hard Times,2016,2016-01-01,Local Punk House Not Accepting Ticketmaster Vouchers for Friday’s Show,1
253,Hard Times,2016,2016-01-01,Local Dad Offered Record Deal After Sick Drum Solo on Buick Steering Wheel,1
254,Hard Times,2016,2016-01-01,Oh Boy: This Band Has Two Singers,1
255,Hard Times,2016,2016-01-01,New Ibanez Guitar Comes With Free Soul Patch,1
256,Hard Times,2016,2016-01-01,"Black Metal Band Sacrifices Animals, Sex Lives",1
257,Hard Times,2016,2016-01-01,Def Leppard Drummer Would Love to Talk About Something Else,1
258,Hard Times,2016,2016-01-01,"Guitarist, Guitar Solo Going Nowhere",1
259,Hard Times,2016,2016-01-01,Black Metal Band Lost In Woods After Photoshoot,1
260,Hard Times,2016,2016-01-01,Man’s Chain Wallet Sole Remaining Link to Nu-Metal Phase,1
261,Hard Times,2016,2016-01-01,Tour Tips: Leech Off The Headliner’s Fame,1
262,Hard Times,2016,2016-01-01,Stoner Metal Fan Needs More and More Metal to Get Same Effect,1
263,Hard Times,2016,2016-01-01,Fantasy Metal Band Embarks On Quest to Mystical Land of Minneapolis,1
264,Hard Times,2016,2016-01-01,Yngwie Malmsteen Album Not Living up to Cover Art,1
265,Hard Times,2016,2016-01-01,"Satanic Ritual Actually Works, Jesus Fucking Shit RUN!!!",1
