,source,year,date,title,is_sarcastic
1033,Hard Times,2019,2019-01-01,Casey Hudson Visits Terminally Ill Teen to Tell Him in Person There Will Be No ‘KOTOR 3’,1
1034,Hard Times,2019,2019-01-01,Fun Late Night Date Ideas that Just Happen to Coincide With Server Maintenance,1
1035,Hard Times,2019,2019-01-01,5 Awesome ‘Breath of the Wild’ Recipes to Make While Ganon’s Genocide Rages On,1
1036,Hard Times,2019,2019-01-01,Vince McMahon Breaks ‘No Blood’ Rule to Count Saudi Money,1
1037,Hard Times,2019,2019-01-01,PepsiCo Announces New Mountain Dew Keurig Pods for Working Gamers,1
1038,Hard Times,2019,2019-01-01,Disappointed Andy Serkis Unwraps Yet Another Mo-Cap Suit For Birthday,1
1039,Hard Times,2019,2019-01-01,Here are the 48 Best Times to Take a Bathroom Break During ‘Dark Phoenix’,1
1040,Hard Times,2019,2019-01-01,Therapist Says Streamer Needs to Subscribe to Himself,1
1041,Hard Times,2019,2019-01-01,Ricky Gervais-Inspired Pokémon Brags When It Evolves,1
1042,Hard Times,2019,2019-01-01,Father Surprises Son at School After Playing ‘Call of Duty’ for 12 Months Straight,1
1043,Hard Times,2019,2019-01-01,‘Magic: The Gathering’ Anime to Be 12 Episodes of Nobody Having Enough Lands to Do Anything,1
1044,Hard Times,2019,2019-01-01,New Apple iLadder Lets You Look Down on Your Poor Friends,1
1045,Hard Times,2019,2019-01-01,Gamer Asks for Longer Haircut at Barber,1
1046,Hard Times,2019,2019-01-01,40-Year-Old Asthmatic IT Analyst Explains Exactly How He Would Take Down Active Shooter in the Office,1
1047,Hard Times,2019,2019-01-01,NSA Agent ‘Heartbroken’ After Mac User Places Single Piece of Tape Over Webcam,1
1048,Hard Times,2019,2019-01-01,Dozens of Teenage Bodies Still Litter Nickelodeon’s Aggro Crag,1
1049,Hard Times,2019,2019-01-01,Jackbox Party Pack 6 to Include New Game ‘Just Draw a Penis‘,1
1050,Hard Times,2019,2019-01-01,Borderlands 3 Script Finished After Day of Browsing KnowYourMeme.com,1
1051,Hard Times,2019,2019-01-01,36-Year-Old Gamer Practicing Every Day For Casual Smash Bros Match With Nephew at Family Get Together,1
1052,Hard Times,2019,2019-01-01,"Quiz: I Know What Death Stranding Is About, I Just Want to See If You Do",1
1053,Hard Times,2019,2019-01-01,New Nintendo Phone Only Calls People You Don’t Know,1
1054,Hard Times,2019,2019-01-01,Scuba Diver Runs Out of Air and Dies After Ignoring Music Getting Faster,1
1055,Hard Times,2019,2019-01-01,Bar Fight at Warhammer Convention Enters Third Day,1
1056,Hard Times,2019,2019-01-01,Melee Player Can’t Believe Someone Would Just Throw Out Zenith CRT TV With Built-In VCR From 2005,1
1057,Hard Times,2019,2019-01-01,Gamer Who Skipped First Cutscene Pissed He Can’t Follow Game’s Story,1
1058,Hard Times,2019,2019-01-01,Riddler Tricks Batman Into Attending His Open Mic Set,1
1059,Hard Times,2019,2019-01-01,Gulf War Game Boy Finally Receives Treatment for PTSD,1
1060,Hard Times,2019,2019-01-01,Leaked Footage Shows Todd Howard Putting MoCap on Horse and Pushing It Off Mountain,1
1061,Hard Times,2019,2019-01-01,Tfue Posts YouTube Rant on How Cesar Chavez Was Low Key on Some Real Labor Rights Clout Shit,1
1062,Hard Times,2019,2019-01-01,Scrapped Endgame Post-Credits Scene Reveals Capcom Beat the Shit Out of Exhausted Avengers,1
1063,Hard Times,2019,2019-01-01,YouTube Video Essayist Spends 20 Minutes Explaining Concept of Hunger to Waiter Before Ordering,1
1064,Hard Times,2019,2019-01-01,Tfue Posts YouTube Rant on How Cesar Chavez Was Low Key on Some Real Labor Rights Clout Shit,1
1065,Hard Times,2019,2019-01-01,Scrapped Endgame Post-Credits Scene Reveals Capcom Beat the Shit Out of Exhausted Avengers,1
1066,Hard Times,2019,2019-01-01,YouTube Video Essayist Spends 20 Minutes Explaining Concept of Hunger to Waiter Before Ordering,1
1067,Hard Times,2019,2019-01-01,Settlers of Catan Player Receives Passive-Aggressive ‘Longest Turn’ Card,1
1068,Hard Times,2019,2019-01-01,Thousands of Parents Now Regret Naming Their Children ‘Game of Thrones’,1
1069,Hard Times,2019,2019-01-01,Joe Rogan One Suggestion Away From Eating Human Meat,1
1070,Hard Times,2019,2019-01-01,Guy Who Created Your Favorite Flash Game Has Alt Right YouTube Channel Now,1
1071,Hard Times,2019,2019-01-01,CNET Reviews the Best Laptops For Not Burning Your Bare Stomach While Watching Porn,1
1072,Hard Times,2019,2019-01-01,"Let’s Get This Over With: Yes, My Tailpipe Is My Asshole",1
1073,Hard Times,2019,2019-01-01,Campaign Finishes Three-Year Run Without DM,1
1074,Hard Times,2019,2019-01-01,‘Game of Thrones’ Prepares for Final Climactic Clash Between Those Who Think It’s Still Good and Those Who Think It Sucks Dick Now,1
1075,Hard Times,2019,2019-01-01,New Board Game Uses All Your Other Unopened Board Games as Resource Tokens,1
1076,Hard Times,2019,2019-01-01,Adult Man Still Furious About Decade-Old Movie For Teen Girls,1
1077,Hard Times,2019,2019-01-01,YouTuber Sex Scandal Proves Medium Power Corrupts Absolutely,1
1078,Hard Times,2019,2019-01-01,Will I Understand John Wick 3 If I Haven’t Grasped Object Permanence?,1
1079,Hard Times,2019,2019-01-01,Alabama Woman Who Criticized Daenerys’ Sudden Heel Turn Now Totally Gets It,1
1080,Hard Times,2019,2019-01-01,Smithsonian Acquires Trap Card Used by Aaron Burr to Defeat Hamilton in Yu-Gi-Oh! Duel,1
1081,Hard Times,2019,2019-01-01,‘Super Mario Maker 2’ Clearly Just Re-Skinned Version of ‘Doki Doki Panic Maker’,1
1082,Hard Times,2019,2019-01-01,Twitch Streamer Loses 400 Subs While Taking Extra Long Shit,1
1083,Hard Times,2019,2019-01-01,New YouTube Series Asks ‘Is It Possible to Beat Super Mario 64 Without Making an Elaborate Video About It?’,1
1084,Hard Times,2019,2019-01-01,"Tokyo City Council Cuts High School’s Funding, Citing Failure to Produce Single Demon-Slaying Übermensch",1
1085,Hard Times,2019,2019-01-01,Rick Riordan Announces Percy Jackson a Pansexual Fuck Machine,1
1086,Hard Times,2019,2019-01-01,Just Dance Dancer Dances New Just Dance Dance,1
1087,Hard Times,2019,2019-01-01,Man Successfully Climbs Mount Everest After Months of Jumping Up Side of It,1
1088,Hard Times,2019,2019-01-01,Inspiring: This Trans Person Came Out to Their Parents by Doing a Magical Girl Transformation,1
1089,Hard Times,2019,2019-01-01,Pornhub Introduces Light Mode For Daytime Browsing,1
1090,Hard Times,2019,2019-01-01,Phase 1 of Pokémon Cinematic Universe Will Culminate in Epic Crossover Event Following 151 Solo Films,1
1091,Hard Times,2019,2019-01-01,"Pokémon Fan Only Has to Watch Movie 15,537 Times Before Seeing Shiny Detective Pikachu",1
1092,Hard Times,2019,2019-01-01,Mom Could Have Made Video Game at Home for Cheaper,1
1093,Hard Times,2019,2019-01-01,Man Selects Formal N7 Hoodie For Second Date,1
1094,Hard Times,2019,2019-01-01,This Is the Only Way I Know How to Tell My Children So That They Will Understand,1
1095,Hard Times,2019,2019-01-01,Game of Thrones Finale to Kill Off Millions of HBO Subscriptions,1
1096,Hard Times,2019,2019-01-01,Camp Crystal Lake Closes After Seven Disastrous Summers,1
1097,Hard Times,2019,2019-01-01,Date Looks Nothing Like His Mii,1
1098,Hard Times,2019,2019-01-01,Doctors Recommend Zero Hours of Gaming Per Day,1
1099,Hard Times,2019,2019-01-01,Paramount Buries Sonic Controversy With Brilliant New Kirby Design,1
1100,Hard Times,2019,2019-01-01,"Furry Entrant in Kentucky Derby Going Off at 1,786,326-1 Odds",1
1101,Hard Times,2019,2019-01-01,Sonic Team Insulted Movie Director Would Do Something So Pathetic as Respond to Fan Feedback,1
1102,Hard Times,2019,2019-01-01,Guy Who Swears He’s Playing Skyrim VR Needs to Take His Dick Out for Some Reason,1
1103,Hard Times,2019,2019-01-01,OPINION: It’s Called a Die,1
1104,Hard Times,2019,2019-01-01,Woman Starting to Warm Up to Man Who Brings Her Two Bars of Solid Gold Every Week,1
1105,Hard Times,2019,2019-01-01,Gentrification Pushes PS3 Out of Power Strip,1
1106,Hard Times,2019,2019-01-01,Gamer Mystified by Tinder’s Lack of Dialogue Options,1
1107,Hard Times,2019,2019-01-01,Anime Fan Considering Naming Corgi Ein,1
1108,Hard Times,2019,2019-01-01,BioWare Reveals Cryptic Timer to Tease Employee Layoffs,1
1109,Hard Times,2019,2019-01-01,‘The Onion’ Apparently Thinks Video Games Are a Joke,1
1110,Hard Times,2019,2019-01-01,Washed Up Duke Nukem Creates Account on Cameo,1
1111,Hard Times,2019,2019-01-01,Teen Shipping Her Divorced Parents,1
1112,Hard Times,2019,2019-01-01,‘Nah Nah Nah Boo Boo I’m Invincible’ Claims Child on Playground After Abusing I-Frames From Dodge Rolling to Cut Line at Recess,1
1113,Hard Times,2019,2019-01-01,Anti-Vax Gamer Receives Exclusive Early Access to Measles,1
1114,Hard Times,2019,2019-01-01,Sony Reveals November’s Free PS Plus Game,1
1115,Hard Times,2019,2019-01-01,Nerd Couple Has Klingon-Themed Divorce,1
1116,Hard Times,2019,2019-01-01,‘Vegeta amv Linkin park – CRAWLING’ Selected for Preservation by Library of Congress,1
1117,Hard Times,2019,2019-01-01,How Thanos Erasing 50% of Gut Bacteria Would End Nearly All Human Life,1
1118,Hard Times,2019,2019-01-01,AMC Hikes Price of ‘Avengers: Endgame’ Piss Buckets to $30,1
1119,Hard Times,2019,2019-01-01,Review: ‘Avengers: Endgame’ is a Mesmerizing Experience That Nearly Made Me Forget My Recurring Fear of a Movie Theater Shooting,1
1120,Hard Times,2019,2019-01-01,1-and-1/16 Inch Steel Ball Factory Announces Layoffs Amid Decline in Pinball Popularity,1
1121,Hard Times,2019,2019-01-01,Laid-Off Man Remembers He Still Has Millions in Offshore Runescape Account,1
1122,Hard Times,2019,2019-01-01,Brave: Pierce Brosnan Leaves House in DK Mode,1
1123,Hard Times,2019,2019-01-01,Greg Announces ‘Greg Now’ Streaming Service to Feature Exclusive Greg Content,1
1124,Hard Times,2019,2019-01-01,Frugal Gamer Empties Mechanical Keyboard Over Dinner Plate,1
1125,Hard Times,2019,2019-01-01,Leather Jacket-Clad ‘Titanfall 2’ Knew You’d Come Crawling Back,1
1126,Hard Times,2019,2019-01-01,11 Easter Eggs You Might Have Missed at the Easter Egg Hunt,1
1127,Hard Times,2019,2019-01-01,Quiz: Is He Really Committed or Does He Just Need a 4th For Catan?,1
1128,Hard Times,2019,2019-01-01,CW Giving Away Misha Collins Free to a Good Home,1
1129,Hard Times,2019,2019-01-01,We Need More Games With Couch Co-op in the Event I Ever Make Friends,1
1130,Hard Times,2019,2019-01-01,Robert Mueller Offering Unredacted Report to His Patreon Subscribers,1
1131,Hard Times,2019,2019-01-01,Gaming Comedy Podcast Now Two Solid Hours of Incomprehensible Inside Jokes,1
1132,Hard Times,2019,2019-01-01,Michael Moore Makes Scathing Documentary About SimCity You Abandoned 16 Years Ago,1
1133,Hard Times,2019,2019-01-01,AV Club Seeking Person With DC Universe Login They Can Use to Review Shows,1
1134,Hard Times,2019,2019-01-01,"We Just Sponsored an Overwatch Team! Or Gave a Bunch of Random Teens $5,000",1
1135,Hard Times,2019,2019-01-01,5 Times We Had to Check Metacritic to See If We Were Right,1
1136,Hard Times,2019,2019-01-01,Vocal Anime Fan Somehow Least Toxic YouTuber,1
1137,Hard Times,2019,2019-01-01,Nintendo Executes Reggie Fils-Aimé’s Mii in Standard Retirement Procedure,1
1138,Hard Times,2019,2019-01-01,"SonicFox Challenged by Edgier, Brooding Rival ShadowWolf",1
1139,Hard Times,2019,2019-01-01,Vocal Anime Fan Somehow Least Toxic YouTuber,1
1140,Hard Times,2019,2019-01-01,Nintendo Executes Reggie Fils-Aimé’s Mii in Standard Retirement Procedure,1
1141,Hard Times,2019,2019-01-01,"SonicFox Challenged by Edgier, Brooding Rival ShadowWolf",1
1142,Hard Times,2019,2019-01-01,Developer Really Hoping You Forgot About Those Kickstarter Rewards,1
1143,Hard Times,2019,2019-01-01,"‘If You Only Watch One Anime, Watch Attack on Titan,’ Says Friend Who Has Watched Exactly One Anime",1
1144,Hard Times,2019,2019-01-01,Local Teens Sneak Back Out of Hellboy,1
1145,Hard Times,2019,2019-01-01,‘Monopoly II: Aftermath’ Explores Life in Atlantic City Ravaged by Unfettered Capitalism,1
1146,Hard Times,2019,2019-01-01,"GameStop Employee Somehow Being Threatened, Patronized, and Hit On at Same Time",1
1147,Hard Times,2019,2019-01-01,Is This New Fighting Game the Next Street Fighter? No.,1
1148,Hard Times,2019,2019-01-01,Friend Claims His Uncle Was Killed by Nintendo,1
1149,Hard Times,2019,2019-01-01,Local Hole Fan Doesn’t Mind That It’s Black But Doesn’t Get Why They Have to Force Diversity On Us,1
1150,Hard Times,2019,2019-01-01,Total ‘90s Kid Uses Pokémon Card to Chop Up Lines of Cocaine,1
1151,Hard Times,2019,2019-01-01,"No, Sekiro Absolutely Does Not Need Big Anime Titties",1
1152,Hard Times,2019,2019-01-01,How I Turned a Gig Playing the Green Power Ranger Into a Career of Being the Guy that Played the Green Power Ranger,1
1153,Hard Times,2019,2019-01-01,Sekiro Should Respect Its Players and Add Big Anime Titties,1
1154,Hard Times,2019,2019-01-01,Andrew Yang Proposes Universal Crunchyroll Premium for Americans,1
1155,Hard Times,2019,2019-01-01,Super Smash Bros.-Inspired Microsoft Fighting Game Features Two-Character Roster,1
1156,Hard Times,2019,2019-01-01,"WHOA THERE BROTHER, THAT DUDE IS A LITTLE TOO SMALL TO PLAY THE HULKSTER",1
1157,Hard Times,2019,2019-01-01,Kaplan Test Prep Releases Marvel Flashcard Set to Review Before Avengers: Endgame,1
1158,Hard Times,2019,2019-01-01,Ocarina Teacher Sighs Deeply as She’s Asked to Teach ‘Saria’s Song’ Yet Again,1
1159,Hard Times,2019,2019-01-01,1st Edition ‘Cards Against Humanity’ Bukkake Card Sells For Record Price at Auction,1
1160,Hard Times,2019,2019-01-01,"Tolkien Biopic to Be Split Into, I Dunno, Six Films",1
1161,Hard Times,2019,2019-01-01,Podcast Listener Takes Fandom to Next Level by Googling What Hosts Look Like,1
1162,Hard Times,2019,2019-01-01,Dog Chewing on Xbox Elite Controller Can Taste the $90 Difference,1
1163,Hard Times,2019,2019-01-01,Expert DDR Player Dances Like He Hopes Anyone Is Watching,1
1164,Hard Times,2019,2019-01-01,"EA Assures Gamers BioWare Not Dead, Just Going Upstate to Live on Video Game Farm",1
1165,Hard Times,2019,2019-01-01,Power Surges Through Reddit Moderator’s Body as He Bans User During Social Studies,1
1166,Hard Times,2019,2019-01-01,Cruel Twilight Zone Episode Explores Alternate Reality Where Keegan-Michael Key Is the One Who Makes It Big,1
1167,Hard Times,2019,2019-01-01,Expensive Gaming Chair Perfectly Absorbs 20th Fart of the Night,1
1168,Hard Times,2019,2019-01-01,Game Informer Announces Plans to Licky Boom Boom Down,1
1169,Hard Times,2019,2019-01-01,Guy Who Hasn’t Played RPG in a Week Might as Well Just Start Over,1
1170,Hard Times,2019,2019-01-01,Borderlands 3 Cover Art Revealed to Be Randy Pitchford Shooting Himself in the Foot,1
1171,Hard Times,2019,2019-01-01,"Every Child Needs a Strong Father Figure Who Can Protect Them With Their Big, Powerful Eggs",1
1172,Hard Times,2019,2019-01-01,Man Arrested for Comic Mischief,1
1173,Hard Times,2019,2019-01-01,It’s-a No Fun Being-a Me: My-a Life With Super Mario Speech Disorder,1
1174,Hard Times,2019,2019-01-01,Harry Potter Now Receiving Donation Requests From Hogwarts,1
1175,Hard Times,2019,2019-01-01,Gamers’ Rights Breakthrough: Cory Booker Will Say The Words ‘Video Games’ On Television Tonight,1
1176,Hard Times,2019,2019-01-01,Circus Level Inexplicably Pulling Double Duty as Water Level,1
1177,Hard Times,2019,2019-01-01,Netflix Now Autoplays Trailer If You Even Think About Opening Website Up,1
1178,Hard Times,2019,2019-01-01,Rescue Team Gives Up Search for Comic Book Store Employee After Devastating Funko Pop Avalanche,1
1179,Hard Times,2019,2019-01-01,Tesla Board Begging Elon Musk to Just Open Whimsical Chocolate Factory Already,1
1180,Hard Times,2019,2019-01-01,Apple’s New Streaming Service Boldly Removes Your TV’s HDMI Ports,1
1181,Hard Times,2019,2019-01-01,Mueller Report Post-Credits Scene EXPLAINED,1
1182,Hard Times,2019,2019-01-01,Woman Logs Back Into Neopets After Fifteen Years to Find Her Kacheek Doing Well and Taking Business Classes at Community College,1
1183,Hard Times,2019,2019-01-01,"Christian Bale Gains 450,000 Pounds to Play Sandworm in ‘Dune’ Remake",1
1184,Hard Times,2019,2019-01-01,Pewdiepie Apologizes for Accidentally Promoting Alt Right Figure Pewdiepie,1
1185,Hard Times,2019,2019-01-01,"‘Alas, This Brings to Me No Comfort,’ Sighs Kirby After Winning 4,352nd Eating Contest in a Row",1
1186,Hard Times,2019,2019-01-01,"New Tax on Violent Video Games Encourages Kids to Get Outside, Kill Real People for Once",1
1187,Hard Times,2019,2019-01-01,Stoner Can Quit Smoking Weed Anytime Joe Rogan Wants,1
1188,Hard Times,2019,2019-01-01,Opinion: It’s Time for Gamers to Unionize,1
1189,Hard Times,2019,2019-01-01,Netflix’s Witcher Series Delayed as Method Acting Henry Cavill Won’t Stop Accepting Side-Gigs,1
1190,Hard Times,2019,2019-01-01,Google Stadia’s “I’m Feeling Lucky” Button Randomly Chooses Which Corporation Your Data Will Be Sold To,1
1191,Hard Times,2019,2019-01-01,Scientists Create Giant Sentient Ass in Lab to Replace Margot Robbie as Harley Quinn,1
1192,Hard Times,2019,2019-01-01,I’m Voting For Bernie Sanders Unless Another Candidate Proves They Have More Swords Than Him,1
1193,Hard Times,2019,2019-01-01,Epic Games Store to Only Accept Your Parent’s Credit Card,1
1194,Hard Times,2019,2019-01-01,Coked-Up MatPat Tries to Use Pokémon Let’s Go! Eevee to Solve JonBenét Ramsey Case,1
1195,Hard Times,2019,2019-01-01,Honoring an Irish Icon: Fox McCloud,1
1196,Hard Times,2019,2019-01-01,Tinder Releases Official Tier List,1
1197,Hard Times,2019,2019-01-01,James Gunn Rehired by Marvel in Unprecedented Victory For White Men,1
1198,Hard Times,2019,2019-01-01,Facebook Tells Shooter He Could Reach More People If He Boosts Post For $50,1
1199,Hard Times,2019,2019-01-01,Man Whose Entire Body Made of Penis Praises Spore for Representation,1
1200,Hard Times,2019,2019-01-01,NVIDIA 960 Graphics Card Spotted Delivering For Postmates After Bitcoin Crash,1
1201,Hard Times,2019,2019-01-01,Purple Smoke Coming From Nintendo HQ Means New Waluigi Chosen,1
1202,Hard Times,2019,2019-01-01,Olimar Running Out of Tiny Coffins,1
1203,Hard Times,2019,2019-01-01,"New Edition of Fighting Game Adds 4 New Characters, 7 New Meters",1
1204,Hard Times,2019,2019-01-01,USC’s Overwatch Team Made Up Entirely of Useless Children of Celebrities,1
1205,Hard Times,2019,2019-01-01,Elizabeth Warren Signs Up for Abstergo Project to Experience Life of Her Native American Ancestor,1
1206,Hard Times,2019,2019-01-01,7 Captain Marvel Easter Eggs You Missed Because You’re a Dumb Stupid Idiot. You Moron. You Disgust Me,1
1207,Hard Times,2019,2019-01-01,Game Heartbroken After Realizing You Were Only Playing Because of Free Trial Weekend,1
1208,Hard Times,2019,2019-01-01,Struggling Barnes & Noble Adds Hentai Section Behind Beaded Curtain,1
1209,Hard Times,2019,2019-01-01,Middle School Student Arrested After Attempted Kamehameha Actually Works,1
1210,Hard Times,2019,2019-01-01,Patch Notes Clearly Contain Cry For Help From Overworked Programmer,1
1211,Hard Times,2019,2019-01-01,Ubisoft Employee’s First Day of Work Spent Climbing Building for Access,1
1212,Hard Times,2019,2019-01-01,Rising Rent Forces Daredevil to Become the Devil of East Williamsburg,1
1213,Hard Times,2019,2019-01-01,We Got an Advanced Copy of MLB The Show 19 But None of Us Are Really Sports People,1
1214,Hard Times,2019,2019-01-01,Anthem Set in Fantasy World Where Freelancers Are Valued,1
1215,Hard Times,2019,2019-01-01,Uh Oh: Scrabble Opponent Knows the Weird Words,1
1216,Hard Times,2019,2019-01-01,Disturbing Poll Shows Majority of Population Still Unaware of Wordplay in “Miles Prower”,1
1217,Hard Times,2019,2019-01-01,"Character Not Overweight, Just Big-Hitboxed",1
1218,Hard Times,2019,2019-01-01,Last Fallout 76 Player Excited to Finally Have a New Single Player Fallout Game,1
1219,Hard Times,2019,2019-01-01,Marine Throws Away Magazine With 29/30 Bullets Just In Case,1
1220,Hard Times,2019,2019-01-01,Revolutionary Indie Dev Designs Platformer Where You Go Left,1
1221,Hard Times,2019,2019-01-01,Opinion: Missile Upgrade Better Be Worth All This Bullshit,1
1222,Hard Times,2019,2019-01-01,Modern Day Sisyphus Doomed to Grind in Destiny 2 Forever,1
1223,Hard Times,2019,2019-01-01,Cohen Reveals Trump Gave Order to Cut Melee From EVO,1
1224,Hard Times,2019,2019-01-01,Donald Trump SWATs Michael Cohen Hearing,1
1225,Hard Times,2019,2019-01-01,"Nintendo Immediately Cancels Pokémon: Let’s Go, Jynx! Amid Widespread Controversy",1
1226,Hard Times,2019,2019-01-01,"Game Freak Unveils New Line-Up of Pokémon for You to Be Upset About, Old Man",1
1227,Hard Times,2019,2019-01-01,Friend Asking Around For Wood Like It Grows on Fucking Trees,1
1228,Hard Times,2019,2019-01-01,Hardass Professor Won’t Allow Students to Cite Bulbapedia,1
1229,Hard Times,2019,2019-01-01,Donald Trump SWATs Michael Cohen Hearing,1
1230,Hard Times,2019,2019-01-01,"Nintendo Immediately Cancels Pokémon: Let’s Go, Jynx! Amid Widespread Controversy",1
1231,Hard Times,2019,2019-01-01,"Game Freak Unveils New Line-Up of Pokémon for You to Be Upset About, Old Man",1
1232,Hard Times,2019,2019-01-01,Friend Asking Around For Wood Like It Grows on Fucking Trees,1
1233,Hard Times,2019,2019-01-01,Hardass Professor Won’t Allow Students to Cite Bulbapedia,1
1234,Hard Times,2019,2019-01-01,Will Wright Found Dead in Swimming Pool With No Ladder,1
1235,Hard Times,2019,2019-01-01,Stan Lee to Cameo in Oscars ‘In Memoriam’ Montage,1
1236,Hard Times,2019,2019-01-01,5 Great Apex Legends Weapons That Will Be Absolutely Useless in Your Pathetic Hands,1
1237,Hard Times,2019,2019-01-01,PlayStation Classic Marked Down to Whatever You Have in Your Pocket,1
1238,Hard Times,2019,2019-01-01,Star Wars Universe Expanding Slower Than Scientists Initially Thought,1
1239,Hard Times,2019,2019-01-01,Game Industry Marvels as Employee Leaves Job By Choice,1
1240,Hard Times,2019,2019-01-01,Opinion: My Squad Won in Apex Legends. Here’s Why I Refuse to Go to the White House,1
1241,Hard Times,2019,2019-01-01,Red Dead Redemption 2: Extended Edition Just Regular Edition With Slower Horses,1
1242,Hard Times,2019,2019-01-01,DNC Struggling to Pick a Main,1
1243,Hard Times,2019,2019-01-01,Gamer Girl Toes [DO NOT PUBLISH],1
1244,Hard Times,2019,2019-01-01,Nation’s Parents Confirm Top New Streamer Named ‘Fungo’ or Something Along Those Lines,1
1245,Hard Times,2019,2019-01-01,Installing Linux and 10 Other Sexy Ideas to Set the Mood This Valentine’s Day,1
1246,Hard Times,2019,2019-01-01,Red Dead 2 Walkthrough: How to Find a Single Fucking Beaver,1
1247,Hard Times,2019,2019-01-01,Switch Owner With No Other Technology Desperately Hoping Nintendo Announces Netflix Support,1
1248,Hard Times,2019,2019-01-01,Farfetch’d Unsure How Much Longer He Can Convince People He’s a Pokemon and Not Just a Duck Holding a Leek,1
1249,Hard Times,2019,2019-01-01,Blizzard Gives Employees Box With 8.3% Chance of Containing Pink Slip,1
1250,Hard Times,2019,2019-01-01,Tom Cruise Announces He Will Be Running in 2020,1
1251,Hard Times,2019,2019-01-01,Kid Whose Uncle Actually Works at Nintendo Ostracized at School,1
1252,Hard Times,2019,2019-01-01,New Economic Report Shows 95% of “Work-From-Home” Productivity Occurred During Kingdom Hearts 3 Cutscenes,1
1253,Hard Times,2019,2019-01-01,Division 2 Beta Lets Players Explore Utopian Vision of Washington D.C.,1
1254,Hard Times,2019,2019-01-01,"Hey, Wanna See Some Nazi Shit?",1
1255,Hard Times,2019,2019-01-01,Female Gamer Angry About How Breast Physics Work in Real Life,1
1256,Hard Times,2019,2019-01-01,Dead Aunt Still Sends Candy Crush Requests,1
1257,Hard Times,2019,2019-01-01,21 Savage Now PEGI 18 Savage,1
1258,Hard Times,2019,2019-01-01,QWOP Runner Finishes 2015 Boston Marathon,1
1259,Hard Times,2019,2019-01-01,Trump Drops Surprise Announcement of New 325 Million-Player Battle Royale,1
1260,Hard Times,2019,2019-01-01,Republicans Try to Appeal to Younger Voters by Releasing State of the Union on YouTube,1
1261,Hard Times,2019,2019-01-01,UCB Opens “Improv for Dungeon Masters” Class,1
1262,Hard Times,2019,2019-01-01,"Boston Dynamics Robot Found Drunk, Wearing Patriots Jersey in Dunkin’ Donuts Parking Lot",1
1263,Hard Times,2019,2019-01-01,Hoarders Episode Explores Man Who Owns Two Different Years of Madden,1
1264,Hard Times,2019,2019-01-01,Opinion: It’s Time for Game Developers to Unionize OR Make a Game About a Guy With a Giant Fucking Gun,1
1265,Hard Times,2019,2019-01-01,A Kirby Main’s Guide to What Other Characters Probably Taste Like,1
1266,Hard Times,2019,2019-01-01,"J.K. Rowling Reveals That You, The Reader, Were Gay All Along",1
1267,Hard Times,2019,2019-01-01,Ice Puzzle Warning in Effect for Chicago Region,1
1268,Hard Times,2019,2019-01-01,Smash Bros Character Blames Low-Tier Player For Loss,1
1269,Hard Times,2019,2019-01-01,IGN Updates Kingdom Hearts 3 Score After Realizing They Just Reviewed ‘A Goofy Movie’,1
1270,Hard Times,2019,2019-01-01,Group of Friends Celebrate Five Years of Planning Podcast,1
1271,Hard Times,2019,2019-01-01,ZeRo Tells Fiancée He’d Rather Just Stream Their Wedding Than Attend,1
1272,Hard Times,2019,2019-01-01,Review: Kingdom Hearts 3 is Damaged by Sora’s Continued Work With Johnny Depp,1
1273,Hard Times,2019,2019-01-01,Mountain Goats Make Second Album In a Row About People Who Don’t Get Enough Sun,1
1274,Hard Times,2019,2019-01-01,Report: First Person to Play Death Stranding May Have Already Been Born,1
1275,Hard Times,2019,2019-01-01,Democrats in Disarray After President Trump Tweets That US Constitution Isn’t Canon,1
1276,Hard Times,2019,2019-01-01,Here’s the Top 284 Custom Characters Banned From Soul Calibur Due to Being Penises,1
1277,Hard Times,2019,2019-01-01,Kensuke Tanabe Backtracking Through Nintendo Offices to Find Key That Lets Him Continue Metroid Prime 4 Development,1
1278,Hard Times,2019,2019-01-01,Will I Understand Kingdom Hearts 3 If I Haven’t Played the First 12?,1
