,source,year,date,title,is_sarcastic
2080,Hard Times,2020,2020-01-01,Punk Dad Really Only Able to Homeschool Kids on History of Black Flag Lineup Changes,1
2081,Hard Times,2020,2020-01-01,"I Like My Relationships Like I Like My Tuning, Open D",1
2082,Hard Times,2020,2020-01-01,Goth Wardrobe No Match for Powdered Donut,1
2083,Hard Times,2020,2020-01-01,Indie Band on Wheel of Fortune Not Familiar With Vowels,1
2084,Hard Times,2020,2020-01-01,Western Addiction Superfan Moshes with Dictionary/Thesaurus Combo,1
2085,Hard Times,2020,2020-01-01,We Look Back on Blur’s Hit “Woo-Hoo”,1
2086,Hard Times,2020,2020-01-01,Quarantined Punk Vandalizes Own Bathroom,1
2087,Hard Times,2020,2020-01-01,Quarantined Black Metal Guitarist Clearly Only Doing Corpse Paint from the Chin Up,1
2088,Hard Times,2020,2020-01-01,Metal Band Regrets Naming New Album “Decimate the Weak and Underfunded Hospital Staff”,1
2089,Hard Times,2020,2020-01-01,This Shelter Dog Looks Just Like Gene Simmons So We Are Putting It Down,1
2090,Hard Times,2020,2020-01-01,Missouri Punk Band Paid in Exposure to COVID-19,1
2091,Hard Times,2020,2020-01-01,"Study Confirms Timothée Chalamet Can’t Even Sweep Pick So, Like, Why Is My Girlfriend Obsessed With Him???",1
2092,Hard Times,2020,2020-01-01,Punk House With No Puzzles Just Going to Use Smashed Window,1
2093,Hard Times,2020,2020-01-01,Dead Bandmate on Floor Making Sweet New Album Cover,1
2094,Hard Times,2020,2020-01-01,Trapt Is My Favorite Band Because They Only Pick Fights Online Just Like Me,1
2095,Hard Times,2020,2020-01-01,Short-Staffed Hospital Hires “Enema of the State” Cover Model Janine Lindemulder,1
2096,Hard Times,2020,2020-01-01,All of Fiona Apple’s Exes Coincidentally Text Her The Same Day For No Reason At All,1
2097,Hard Times,2020,2020-01-01,Jack White Files Tax Return on Vinyl,1
2098,Hard Times,2020,2020-01-01,Axl Rose Arrives 6 Hours Late to Home Livestream Concert,1
2099,Hard Times,2020,2020-01-01,Slipknot Refuses to Donate Masks to Hospital Battling COVID-19,1
2100,Hard Times,2020,2020-01-01,Record Label Takes 80% of Band’s Stimulus Check,1
2101,Hard Times,2020,2020-01-01,Medical Worker Turns Down Donated Mask Made from Blaze Bayley-Era Iron Maiden Shirt,1
2102,Hard Times,2020,2020-01-01,"I Spent 10,000 Hours Practicing Creed Songs and All I’ve Mastered Is Regret",1
2103,Hard Times,2020,2020-01-01,Bassist on Zoom Still Hasn’t Realized He’s Muted,1
2104,Hard Times,2020,2020-01-01,The World Is a Beautiful Place & I Am No Longer Afraid to Die Finally Considering Name Change,1
2105,Hard Times,2020,2020-01-01,"Jello Biafra Sells 45-Minute Long, Politically Charged Birthday Wish Video on Cameo",1
2106,Hard Times,2020,2020-01-01,If You Don’t Stand for Good Charlotte’s “The Anthem” You Dishonor All Those Hands That Are No Longer Up,1
2107,Hard Times,2020,2020-01-01,Guy Can’t Decide Which Shirt to Wear While Watching Band’s Instagram Live Stream,1
2108,Hard Times,2020,2020-01-01,CDC Retroactively Bans Groups of 10 or More Bikini-Clad Women in Same ’80s Metal Video,1
2109,Hard Times,2020,2020-01-01,Woman Matures From Being Ghosted by Morrissey Fans to Being Ghosted by Radiohead Fans,1
2110,Hard Times,2020,2020-01-01,"Opinion: Hey There Delilah, I Don’t Think I’m Gonna Come Visit You in New York City Actually",1
2111,Hard Times,2020,2020-01-01,Show Flyer Used as Face Mask Instinctively Crumpled Up and Thrown to Ground,1
2112,Hard Times,2020,2020-01-01,Insane Clown Posse Announce Inaugural “Distancing of the Juggalos”,1
2113,Hard Times,2020,2020-01-01,Crust Punk’s DIY Face Mask Gives Him 32 Other Diseases,1
2114,Hard Times,2020,2020-01-01,We Interviewed WWE Tag Team Legends Demolition and It Turns out They Don’t Know Shit About the ’80s Leather Daddy Scene,1
2115,Hard Times,2020,2020-01-01,Promoter Staying Busy By Stealing Cut of Daughter’s Cereal,1
2116,Hard Times,2020,2020-01-01,Aging Imagine Dragons Fan Celebrates 11th Birthday,1
2117,Hard Times,2020,2020-01-01,We Ranked the Top 10 Most Metal Moments in Ace Ventura: Pet Detective,1
2118,Hard Times,2020,2020-01-01,Donald Glover Quietly Releases Coronavirus Vaccine at 4 a.m. Before Deleting It,1
2119,Hard Times,2020,2020-01-01,"Careless Girlfriend Endangers Older, Compromised Immune System of Pop-Punk Frontman Boyfriend",1
2120,Hard Times,2020,2020-01-01,5 Places City Officials Made More Punk Rock,1
2121,Hard Times,2020,2020-01-01,Iggy Pop Removes Torso Section From Hazmat Suit,1
2122,Hard Times,2020,2020-01-01,Modern Day Yoko? This Woman’s Boyfriend Is in a Shitty Band,1
2123,Hard Times,2020,2020-01-01,“A Pox on the Police!” Proclaims Elizabethan Punk,1
2124,Hard Times,2020,2020-01-01,Coronavirus Forces Punk to be Unemployed From Home,1
2125,Hard Times,2020,2020-01-01,"Dang, I Was Totally Gonna Go to Your Show This Time Too",1
2126,Hard Times,2020,2020-01-01,Metalhead Asks CDC Hotline What to Cough Into If They’ve “Hypothetically” Cut off Their Sleeves,1
2127,Hard Times,2020,2020-01-01,Punk House Adds More Water to Dr. Bronner’s Bottle to Prepare for Coronavirus,1
2128,Hard Times,2020,2020-01-01,Opinion: I Was Gonna Quit the Band Anyway,1
2129,Hard Times,2020,2020-01-01,CDC Recommends Not Attending House Show to Limit Spread of Frontman’s Ego,1
2130,Hard Times,2020,2020-01-01,Basement Show Canceled Due to Mom Stocking up on Dry Goods,1
2131,Hard Times,2020,2020-01-01,Punk Venue’s Green Beer Not a St. Patrick’s Day Thing,1
2132,Hard Times,2020,2020-01-01,"CDC Issues Reminder No One Would’ve Attended Show Anyway, Scene Sucks Now",1
2133,Hard Times,2020,2020-01-01,Hardcore Saint Patrick Drives Snakes Out of Scene,1
2134,Hard Times,2020,2020-01-01,How to Talk to the Woman You Just Annihilated in the Pit,1
2135,Hard Times,2020,2020-01-01,Bernie Sanders Accidentally Tells Joe Biden “Nice Set” After Debate,1
2136,Hard Times,2020,2020-01-01,Opinion: A Jury of My Peers Wouldn’t Be Dressed so Nice,1
2137,Hard Times,2020,2020-01-01,We Ranked Every Cannibal Corpse Album Cover by the Length of the Shower We Had to Take After Looking at It,1
2138,Hard Times,2020,2020-01-01,And1 Clothing Announces Line of Shorts for Hardcore Guys Who Never Play Basketball,1
2139,Hard Times,2020,2020-01-01,How Metallica’s St. Anger Album Changed the Wobble in My Coffee Table Forever,1
2140,Hard Times,2020,2020-01-01,Punk to Send Death Threat to Congressman as Soon as He Figures Out Who That Is,1
2141,Hard Times,2020,2020-01-01,Frontman Makes It Perfectly Clear Coronavirus Not Welcome In This Scene,1
2142,Hard Times,2020,2020-01-01,CDC Recommends Full-Body GWAR Costume to Protect Against Coronavirus,1
2143,Hard Times,2020,2020-01-01,Band Takes Drummer on One Last Day of Doing All of His Favorite Things,1
2144,Hard Times,2020,2020-01-01,Touring Band Makes Bass Player Order Off Kids Menu,1
2145,Hard Times,2020,2020-01-01,Punk Buys Pack of Gum to Distract from $300 Worth of Merchandise She’s Shoplifting,1
2146,Hard Times,2020,2020-01-01,Panicked Punk Calls Parents to Find Out Status of Trust Fund,1
2147,Hard Times,2020,2020-01-01,Rise Against Brought This Lucky Fan on Stage to Live out His Dream of Telling Them Everything After “Appeal to Reason” Sucks,1
2148,Hard Times,2020,2020-01-01,All of Punk’s Good Deeds Court-Mandated,1
2149,Hard Times,2020,2020-01-01,Punk Church Features Stained Glass Window of Martyr Who Stayed Past Friends’ Set,1
2150,Hard Times,2020,2020-01-01,"We Look Back on the Entire History of Punk, 1977-1977",1
2151,Hard Times,2020,2020-01-01,Daylight Savings Causes Punk Show To Accidentally Start on Time,1
2152,Hard Times,2020,2020-01-01,Depressed Black Metal Frontman Sees Own Face in Rorschach Test,1
2153,Hard Times,2020,2020-01-01,California Basement Show Held In Garage,1
2154,Hard Times,2020,2020-01-01,Probation Officer Closest Thing Punk Band Has to Tour Manager,1
2155,Hard Times,2020,2020-01-01,Help! I Got an English Degree and Now I’m the Lead Lyricist for the Wonder Years,1
2156,Hard Times,2020,2020-01-01,Crust Punk Too Busy Dealing With Raccoon Flu to Worry About Coronavirus,1
2157,Hard Times,2020,2020-01-01,"Given That I’ve Exhausted My Library of Believable Excuses, I Feel I Should Tell You I Don’t Like Your Band",1
2158,Hard Times,2020,2020-01-01,Massive Backlog of Back Stabbings Paralyzes Hardcore Street Justice System,1
2159,Hard Times,2020,2020-01-01,Bag of Drugs Get Through Security Line Without Having Phish Fan Confiscated,1
2160,Hard Times,2020,2020-01-01,Uh Oh: That Band You Like Just Discovered the ’80s,1
2161,Hard Times,2020,2020-01-01,Crust Punk Who Passes out at Party Wakes up With Their Face Tattoo of a Dick Covered Up,1
2162,Hard Times,2020,2020-01-01,"Straight Edge Kid Blows Clean, Breathable Air Into Cat’s Ear",1
2163,Hard Times,2020,2020-01-01,We Interviewed Former Blink Drummer Scott Raynor and Think He’s Got a Great Chance Getting Hired at Our Call Center,1
2164,Hard Times,2020,2020-01-01,Punk Uses Floss To Fix Everything But Gum Disease,1
2165,Hard Times,2020,2020-01-01,Supposed Metal Band Doesn’t Even Have “Controversy” Section On Wikipedia Page,1
2166,Hard Times,2020,2020-01-01,I’m Drunk and an Hour Late but I Deserve to Be Right in Front of the Stage,1
2167,Hard Times,2020,2020-01-01,Date Brought to Grinding Halt After Third Eye Blind Used as Example of Punk Band,1
2168,Hard Times,2020,2020-01-01,Four Year Strong Trapped in Breakdown to Song They Don’t Remember,1
2169,Hard Times,2020,2020-01-01,Litter Box Only Working Toilet in Punk House,1
2170,Hard Times,2020,2020-01-01,Grateful Dead Fan Thoroughly Confused That Other Bands Exist,1
2171,Hard Times,2020,2020-01-01,Vinyl Record Without Download Code Kinda Asking A Lot,1
2172,Hard Times,2020,2020-01-01,Hilarious Drummer Cracks Band Up by Asking for Songwriting Credit,1
2173,Hard Times,2020,2020-01-01,I Have as Much Right as the B-52’s to Sing Loudly in Public About My Homemade Fuck-Shed,1
2174,Hard Times,2020,2020-01-01,Music Snob EMT Can’t Decide Which Song to Set Chest Compressions To,1
2175,Hard Times,2020,2020-01-01,Conor McGregor Open to Superfight With Henry Rollins,1
2176,Hard Times,2020,2020-01-01,Eight Somehow Dead After Launch of Black Metal Streaming Service,1
2177,Hard Times,2020,2020-01-01,Mötley Crüe Reunion Introduces Bands’ Iconic Catalogue to Same Exact Generation As Before,1
2178,Hard Times,2020,2020-01-01,We Interviewed Anarcho-Punk Pioneers the Boxcar Children,1
2179,Hard Times,2020,2020-01-01,"Nü-Metal Doctor Asks You to Open Mouth and Say, “Ooh WA-AH-AH-AH-AH!”",1
2180,Hard Times,2020,2020-01-01,House Show Not Even Attended By House Residents,1
2181,Hard Times,2020,2020-01-01,I Hate Ska Except for When It’s in Every Single Comedy Movie I Loved From the ’90s,1
2182,Hard Times,2020,2020-01-01,"Cool: Millencolin Covering Pennywise Song Or, Actually, Other Way Around, Maybe",1
2183,Hard Times,2020,2020-01-01,Old Punk Who’s Done So Much for the Scene Completely Unbookable,1
2184,Hard Times,2020,2020-01-01,Punk in 30s Relieved to See Cops End Show Early,1
2185,Hard Times,2020,2020-01-01,I Will Defeat Fascism Once I Find a Sharpie for This Banjo,1
2186,Hard Times,2020,2020-01-01,Alabama Punk Prepares for Another Drive to Atlanta to Support Local Scene,1
2187,Hard Times,2020,2020-01-01,"I Don’t Care How Many Hits He Wrote, Paul McCartney Is Still a Fucking Bassist and I Will Never Respect Him",1
2188,Hard Times,2020,2020-01-01,Folk-Punk Band Accidentally Books Paid Gig,1
2189,Hard Times,2020,2020-01-01,Man Watches Entire Show Through The Gauged Ear Of Guy In Front Of Him,1
2190,Hard Times,2020,2020-01-01,Socially Awkward Anarchist Unsure of Right Moment to Start Riot,1
2191,Hard Times,2020,2020-01-01,Frontman Saves Mediocre Set by Doing Everything Venue Owners Politely Asked Him Not to Do,1
2192,Hard Times,2020,2020-01-01,GWAR asks NPR’s Tiny Desk Staff if They’re Ready to Get Their Assholes Ripped Open,1
2193,Hard Times,2020,2020-01-01,Struggling Actor Adds Hate5six Listing to IMDB,1
2194,Hard Times,2020,2020-01-01,Stop Asking Me to Play Folk Punk Just Because I’m an Opossum,1
2195,Hard Times,2020,2020-01-01,We Scored This Awesome Interview With Tom Morello After Hitting Every Button on the Elevator,1
2196,Hard Times,2020,2020-01-01,We Asked Jadakiss About His Best Valentine’s Kiss and He Just Tried to Offload Bricks of Cocaine on Us,1
2197,Hard Times,2020,2020-01-01,Woman Rudely Wears Black to Goth Friend’s Wedding,1
2198,Hard Times,2020,2020-01-01,Punk Attending First Show Can’t Believe They Got to Meet Singer of Terrible Local Band That Will Break Up in Two Months,1
2199,Hard Times,2020,2020-01-01,Is He a Cop or Does He Just Like Holding His Skateboard That Way?,1
2200,Hard Times,2020,2020-01-01,Straight Edge Band Run Out of Scene for Not Using Varsity Font in Logo,1
2201,Hard Times,2020,2020-01-01,Lead Singer Sitting Back as Rest of Bandmates Help Him Move to New Apartment,1
2202,Hard Times,2020,2020-01-01,Punk Ghost Been Trying to Escape Small Town for 163 Years,1
2203,Hard Times,2020,2020-01-01,BREAKING: Oscars to Add Local Scene to In Memoriam Reel,1
2204,Hard Times,2020,2020-01-01,Aging Punk Enters “I Don’t Even Really Listen to Punk Anymore” Phase of Being Punk,1
2205,Hard Times,2020,2020-01-01,Andrew Yang Promises Universal Basic Exposure for Every Band in America,1
2206,Hard Times,2020,2020-01-01,Palpable Sexual Chemistry Between Folk Duo Expressed Through Repeated Stomps on Empty Suitcase,1
2207,Hard Times,2020,2020-01-01,We Wanted to Do a Retrospective on The Clash’s London Calling but Our Older Brother Says We Can’t Borrow It Cuz He’s Listening to It,1
2208,Hard Times,2020,2020-01-01,Best Coast and Red Hot Chili Peppers Protest New California Law Limiting Artist to 35 Songs About State Per Year,1
2209,Hard Times,2020,2020-01-01,White Claw® Files Lawsuit Against Similarly Named Racist Black Metal Band,1
2210,Hard Times,2020,2020-01-01,A Comprehensive Guide of What You’re Allowed to Wear When Fighting Fascism,1
2211,Hard Times,2020,2020-01-01,Deceased Sober Punk with No Tattoos Unable to be Buried in Straight Edge Cemetery,1
2212,Hard Times,2020,2020-01-01,Better Than Ezra and Less Than Jake Form Pretty Average Supergroup,1
2213,Hard Times,2020,2020-01-01,We Look Back on “Now That’s What I Call Music! 22” Because That’s the Only CD My Mom Had in Her SUV,1
2214,Hard Times,2020,2020-01-01,I’m Sorry I’m 6’3” and God Wanted Me to See Concerts Better Than You,1
2215,Hard Times,2020,2020-01-01,Punk Mom Adds Studs to Fitbit,1
2216,Hard Times,2020,2020-01-01,Comic Book In “Take on Me” Video Getting Gritty Film Adaptation from Zack Snyder,1
2217,Hard Times,2020,2020-01-01,Acoustic Bass Industry Begs Violent Femmes to Buy Another Acoustic Bass,1
2218,Hard Times,2020,2020-01-01,Super Power? This Woman Can Identify a Predator Just by Seeing If She’s Sexually Attracted to Them,1
2219,Hard Times,2020,2020-01-01,We Sat Down With This Five Finger Death Punch Fan to Hear What Color Mustang He’s Buying After Basic Training,1
2220,Hard Times,2020,2020-01-01,Neglected Punk House Vacuum Yearns for Tender Embrace of Human Hand,1
2221,Hard Times,2020,2020-01-01,Baha Men Hoping for Big Puppy Bowl Payday,1
2222,Hard Times,2020,2020-01-01,Guy Who Once Stabbed a Cop with a Screwdriver at a House Show Can’t Believe What Just Happened on “Great British Bake Off”,1
2223,Hard Times,2020,2020-01-01,Man Who’s Bad at Accepting Compliments Joins Friend’s Band to Avoid Them,1
2224,Hard Times,2020,2020-01-01,Comedy Central Cancels “Straight Edge History” After One Episode,1
2225,Hard Times,2020,2020-01-01,Punk Didn’t Plan on Living Long Enough for Metabolism to Slow Down This Much,1
2226,Hard Times,2020,2020-01-01,Hardcore Frontman Cheats On Diet With Underage Diet,1
2227,Hard Times,2020,2020-01-01,Punk Grandma Wants to Know Why You Never Drop By to Borrow Van for Tours Anymore,1
2228,Hard Times,2020,2020-01-01,Report: 90% of Music Collections Exist Solely on Hard Drive Lost Somewhere in Closet,1
2229,Hard Times,2020,2020-01-01,This Famous Film Director Went Through an Embarrassing Fred Durst Phase,1
2230,Hard Times,2020,2020-01-01,Frontman Insulted He’s Only Third on Unhinged Super-Fan’s Kill List,1
2231,Hard Times,2020,2020-01-01,What a Waste: Every Year Americans Throw Tons of Perfectly Good Food at My Band,1
2232,Hard Times,2020,2020-01-01,We Gave One Million Monkeys a Million Typewriters and These Are the Guttermouth Songs They Wrote,1
2233,Hard Times,2020,2020-01-01,23andMe Test Reveals Wes Borland Actually Member of Mudvayne,1
2234,Hard Times,2020,2020-01-01,63-Year-Old Punk Can’t Believe You Haven’t Heard of Obscure Local Band Who Broke Up in 1981,1
2235,Hard Times,2020,2020-01-01,23andMe Test Reveals Wes Borland Actually Member of Mudvayne,1
2236,Hard Times,2020,2020-01-01,63-Year-Old Punk Can’t Believe You Haven’t Heard of Obscure Local Band Who Broke Up in 1981,1
2237,Hard Times,2020,2020-01-01,I Feel Like I Should Review “The Soft Bulletin” Again Now That I Don’t Do Drugs,1
2238,Hard Times,2020,2020-01-01,Aging Punk Increases Weight Loss Regimen to Two Packs of Cigarettes a Day,1
2239,Hard Times,2020,2020-01-01,Death Grips Fan Sick of Tattoo Artists Telling Him They Won’t Write That on There,1
2240,Hard Times,2020,2020-01-01,Adorable Punk Twitching in His Sleep Must be Dreaming He’s Running from Cops,1
2241,Hard Times,2020,2020-01-01,"Friendly, Helpful Record Store Employee Fired",1
2242,Hard Times,2020,2020-01-01,Punk Couple Prefers Their Earlier Kid,1
2243,Hard Times,2020,2020-01-01,“Daft Punk Is Playing at My House” and Other Times LCD Soundsystem Were Lying Sacks of Shit,1
2244,Hard Times,2020,2020-01-01,Top 5 Feminist Icons That Also Happen to Be Cartoon Goth Girls That Make Me Horny,1
2245,Hard Times,2020,2020-01-01,Gallagher Brothers Reunite to Argue in Front of Terminally Ill Oasis Fan,1
2246,Hard Times,2020,2020-01-01,Band Member With Kid Subtly Adds Girl Scout Cookies to Merch Table,1
2247,Hard Times,2020,2020-01-01,"The Ultimate Playlist to Let Her Know You’ve Moved On, but Are Still Down to Bang, Get Back Together",1
2248,Hard Times,2020,2020-01-01,We Sat Down With We the Kings Without Even Realizing,1
2249,Hard Times,2020,2020-01-01,Imagine Dragons Scrap New Album Because No Songs Are Fit to Play Leading Into NFL Commercials,1
2250,Hard Times,2020,2020-01-01,Wife Confident Husband’s Band Too Shitty for Groupies,1
2251,Hard Times,2020,2020-01-01,Inspiring? This Man Escaped North Korea but Now Makes Pretty Bad Art,1
2252,Hard Times,2020,2020-01-01,Man Asks Record Store Employee If They Validate Opinions,1
2253,Hard Times,2020,2020-01-01,Huge Mannequin Pussy Fan Surprised to Find Band of Same Name,1
2254,Hard Times,2020,2020-01-01,Frontman Tries so Hard  to Write Lyrics in Haiku  but Fucks It Up,1
2255,Hard Times,2020,2020-01-01,What Was the Name of That One Band From Like 2008 That the Main Dude Sang Super High and Wore Black Skinny Jeans and Guyliner and His Hair Did That Cover-One-Eye Thing?,1
2256,Hard Times,2020,2020-01-01,Recruitment Numbers for Tiger Army Hit 20-Year Low,1
2257,Hard Times,2020,2020-01-01,Divorce Papers Straight Up Quote Mountain Goats Lyrics on Page Three,1
2258,Hard Times,2020,2020-01-01,Punk Astronaut Costs NASA Millions After Cutting Sleeves Off Spacesuit,1
2259,Hard Times,2020,2020-01-01,Record Store Owner Nervous Customers Will Find Out They Can Stream All These Albums on Spotify,1
2260,Hard Times,2020,2020-01-01,Amps Outnumber Attendees 6 to 1 at Weeknight Doom Metal Show,1
2261,Hard Times,2020,2020-01-01,59-Year-Old Man Is 413 in Punk Years,1
2262,Hard Times,2020,2020-01-01,311 Cruise Spills 11 Million Gallons of Hash Oil Into Caribbean,1
2263,Hard Times,2020,2020-01-01,Punk Dad Discovers They Make Pedialyte for Kids Now,1
2264,Hard Times,2020,2020-01-01,Punk Parents to Squeeze Out 17 Years of Excuses to Miss Show from Single Baby,1
2265,Hard Times,2020,2020-01-01,Man Tuning Guitar Also Scoring True Crime Podcast,1
2266,Hard Times,2020,2020-01-01,Town Still Ravaged Decades After Dookie Airstrike of ’94,1
2267,Hard Times,2020,2020-01-01,Report: Punk with Poster in Frame Must Be Doing Pretty Well for Himself,1
2268,Hard Times,2020,2020-01-01,"If Your Job Posting Asks for a Rockstar Candidate, Don’t Get All Pissy When I Show up Coked out of My Mind and Trash the Place",1
2269,Hard Times,2020,2020-01-01,Aging Punk Hires Grizzled Private Investigator to Find Exact Time Headliner Goes On,1
2270,Hard Times,2020,2020-01-01,Snack Pack Announces Reissue of Hickey/Voodoo Glow Skulls Split 7”,1
2271,Hard Times,2020,2020-01-01,Iggy Pop Crosses Fingers During Team Selection in Shirts vs. Skins Pickup Game,1
2272,Hard Times,2020,2020-01-01,Study Confirms Riff Should Have Just Been in 4/4,1
2273,Hard Times,2020,2020-01-01,Mitski Announces Plans to Place Merch Table In Your Therapist’s Office,1
2274,Hard Times,2020,2020-01-01,Neil Peart’s Drum Set Donated to Supply Every Public School Music Department in Canada,1
2275,Hard Times,2020,2020-01-01,Band Surprises One Lucky Fan with Long-Forgotten Patreon Reward,1
2276,Hard Times,2020,2020-01-01,Folk-Punk Band Asks Neighbor Banging Broom on Ceiling to Join Group,1
2277,Hard Times,2020,2020-01-01,"If There Was a God, He Wouldn’t Have Let Me Get This P.O.D. Tattoo",1
2278,Hard Times,2020,2020-01-01,Band Who Cites Kiss As Influence Also Sucks,1
2279,Hard Times,2020,2020-01-01,Punk Going On Vacation Asks if You Can Throw Out His Mail for Him,1
2280,Hard Times,2020,2020-01-01,Survivor Producers Following Crust Punk On Island Unaware He Is Not Contestant,1
2281,Hard Times,2020,2020-01-01,Punk Guru Says Treat Your Body Like Fucked Up Temple Bathroom,1
2282,Hard Times,2020,2020-01-01,5 Punk Fashion Trends That Are Officially Canceled After My Mom Complimented Them,1
2283,Hard Times,2020,2020-01-01,Aging Scenester Distraught Emo Kids No Longer Learning About Cursive,1
2284,Hard Times,2020,2020-01-01,Friend Back with Band You Spent Months Shit Talking About After Breakup,1
2285,Hard Times,2020,2020-01-01,Anti-Flag Already Releases Album About War That Started Two Hours Ago,1
2286,Hard Times,2020,2020-01-01,Friend Will Be Live on College Radio Station From 1 A.M. to 4 A.M. If You Want to Tune In,1
2287,Hard Times,2020,2020-01-01,"Aspiring Symphony Musician Seeks 20 Violinists, 10 Violists, 10 Cellists, 10 Bassists, Two Flautists, Two Clarinetists, Two Bassoonists, Two Oboists, Three Trumpet Players, Three Trombonists, One Tubist, Three Percussionists, One Timpanist, and No Drama",1
2288,Hard Times,2020,2020-01-01,BMX Rider Puts on Best Hatebreed Shirt to Officiate Wedding,1
2289,Hard Times,2020,2020-01-01,Favorite Band Playing Favorite Song Still Loses Woman’s Applause to Holding a Warm PBR,1
2290,Hard Times,2020,2020-01-01,Two Fully Grown Male Punks Ram Spiked Heads in Pit to Impress Potential Mate,1
2291,Hard Times,2020,2020-01-01,Bassist on Life Support Not Even Plugged In,1
2292,Hard Times,2020,2020-01-01,Show Promoter Grossly Overestimates Audience’s Ability To “Pay What You Can”,1
2293,Hard Times,2020,2020-01-01,"Scene Veteran’s Tits Diagnosed with CTE After 17,000th Elbow Shot",1
2294,Hard Times,2020,2020-01-01,Man in Audience Upset to Learn Mighty Mighty Bosstones Have Written New Songs Since 1997,1
0,Hard Times,2016,2016-01-01,"NES Classic Edition Lets You Play for One Hour, Then It’s Your Little Brother’s Turn",1
1,Hard Times,2016,2016-01-01,16-Year-Old Skateboarder Finds Secret Tape In Airport,1
2,Hard Times,2017,2017-01-01,Noam Chomsky’s Commentary Going Over About Just as Well in Phantasy Star IV as in Real Life,1
3,Hard Times,2017,2017-01-01,Teen Practicing for School Shooting in PUBG Keeps Getting Killed Before Finding Weapon,1
4,Hard Times,2017,2017-01-01,Whole Episode of Anime Just Recap Followed by Preview,1
5,Hard Times,2017,2017-01-01,George RR Martin Under Fire After Speech in Front of Banner That Reads “Series Accomplished”,1
6,Hard Times,2017,2017-01-01,Stan Lee Makes Unexpected Cameo in #MeToo,1
7,Hard Times,2017,2017-01-01,Nintendo Announces XL SNES Classic,1
8,Hard Times,2017,2017-01-01,"Bright 2 to Explore Classic Fantasy Character “Max Landis, Professional Screenwriter”",1
9,Hard Times,2017,2017-01-01,Hour 117 of RPG Reportedly Where Things Really Get Going,1
10,Hard Times,2017,2017-01-01,NetherRealm Studios Apologizes for Poorly Timed “Sub-Zero Fatality” Tweet,1
11,Hard Times,2017,2017-01-01,Laid Off Bethesda Employee Cleans 70 Cheese Wheels Out of Desk,1
12,Hard Times,2017,2017-01-01,Verizon Suspiciously Throttling Internet of Whoever Playing Against Ajit Pai in Overwatch,1
13,Hard Times,2017,2017-01-01,Man Wishes Game Wouldn’t Tell Him How Much Time He’s Spent Playing It,1
14,Hard Times,2017,2017-01-01,Disney Buys “Fantastic Four” Script to Balance Wobbly Coffee Table,1
15,Hard Times,2017,2017-01-01,Peter Molyneux Wins Lifetime Underachievement Award,1
16,Hard Times,2017,2017-01-01,EA Offers to Help Drop the Ball,1
17,Hard Times,2017,2017-01-01,Hard Drive’s Top 5 Games of 2017 We’ll Get Around To Playing in 2019,1
18,Hard Times,2017,2017-01-01,IGN Reveals Its 104-Way Tie for Game of the Year,1
19,Hard Times,2017,2017-01-01,Dungeon Master’s Campaign Clearly Allegory for His Recent Break Up,1
20,Hard Times,2017,2017-01-01,"If We Want Video Games to be Taken Seriously as an Art Form, We Need to be Really Insufferable",1
21,Hard Times,2017,2017-01-01,"Our Duck Hunt Remake Will Feature Gorgeous 60fps Animation, A Shitload More Ducks",1
22,Hard Times,2017,2017-01-01,Speedrun Streamer Sets New Record Time Explaining What That Means to Grandpa During Christmas Dinner,1
23,Hard Times,2017,2017-01-01,Yahtzee Croshaw Single Attendee of Escapist Christmas Party,1
24,Hard Times,2017,2017-01-01,EA Apologizes to Battlefront Fans With Free “Star Wars Holiday Special” DLC,1
25,Hard Times,2017,2017-01-01,Shooting Death of Los Santos Police Officer Prompts Exhaustive 81-Second Manhunt,1
