headline,year
Are You Ready To Straight Up Inhale His Balls?,2017
How to Drink So Much Cold Brew Your Eyes Start Shooting Words At the Screen,2017
Find Out if He’s Into You With a Simple Polygraph Test,2017
"Men Taking Condom Off Without Consent During Sex: Is It Rape, or Is It Rape?",2017
This New App Delivers Fresh Produce Directly To Your Garbage Can,2017
Why I Decided to Knight Everyone With My Tampon On the Way to the Bathroom,2017
This CEO Ditched Her Car and Started Riding a Man to Work,2017
How To Coexist With Men Even Though All They Want To Do Is Cum On A Mermaid’s Face,2017
"Spring Looks That Say, ‘Please Don’t Ask Me to Go Hiking’",2017
"Forget Beachy Waves, Here Are 99 Downright Biotchy Waves",2017
Prescription Antidepressants Ineffective? Try Gazing Out Of A Bay Window,2017
How To Have Hot Sex By Just Saying ‘Hot Hot Hot’ The Whole Time,2017
Kaitlin Awarded PhD for Research on Ex’s New Girlfriend,2017
How To Balance Your Career And A Weird Dating Thing,2017
Five Hot Bikinis For Sitting Very Still Next To The Pool,2017
"How To Eat Healthy, But Still Die In The End",2017
"Wow! You Generate A New Set of Skin Every Month, Except Around Your Acne Scars",2017
He Accepts Me For Who I Am: A Pizza-Loving Dick Vessel,2017
How To Say You’re Doing Well Without Being A Huge Bitch,2017
"3 Flirty Glasses Frames That Say, ‘Natural Selection Should Have Weeded Me Out’",2017
How To Give Parenting Advice To The First One In Your Friend Group to Have a Baby,2017
"‘I Love to Party,’ Says Friend Who Ruins Every Party",2017
How to Dig So Deep Down Into His Facebook That You Hit The Core of Earth,2017
How To Journal For You But Also So You Leave Behind An Enduring Literary Masterpiece,2017
How To Get Your Man In The Mood By Bending Over and Waiting,2017
Empowering Ivanka Quotes That Are Things Other People Said,2017
100 Reasons Why Kurt Cobain Is Our Soulmate and Only 87 Of Them Are Cause He’s Hot,2017
Mom Quietly Plots News to Bring Up In Last 10 Minutes of Phone Call,2017
Stop Calling My Beauty Exotic. I’m From Pittsburgh.,2017
6 Signs Your Troubled Relationship is Ready To Host a Home Renovation Show,2017
Inspiring! This Woman Landed a Hot Air Balloon On Her Body Shamer,2017
How to Be a Work Who Sometimes Womans,2017
Man Who Won’t Shut Up About Standing Desks Not Willing To Give Up Seat On The Subway,2017
Pre-Photoshop Pics to Remind You That Models Are Only ALMOST Perfect,2017
"6 Decorative Bowls Perfect For When He Asks, ‘Where Do You Want Me To Cum?’",2017
How I Lost 45 Pounds by Making My Teen Daughter Freaky Friday Me,2017
How to Quantify Your Feelings So Men Will Listen,2017
Inspiring! This Woman Shuts Out Toxic People and Also Her Good Friends,2017
Glossier Announces New Line of Makeup For Women Not Already Beautiful,2017
Burn Some Extra Calories By Storing Your Vibrator Across the Room…Actually Don’t,2017
I Met The Man Of My Dreams On The Only Dating Site Just For Lighthouse Keepers,2017
"8 Things Your Man Wishes You’d Do More Often, Besides Praise His Monster Peen",2017
"This Woman Threw Out Her Scale, and Now She Just Weighs Herself When She’s At Jill’s House",2017
5 Nonfiction Audiobooks To Start Before Putting ‘Love On Top’ On Repeat,2017
Wow! Watch These $38 Makeup Brushes Vanish Into the Ether,2017
"Gatsby-Themed Wedding Ideas That Say, ‘I Didn’t Read The Book’",2017
"Vocal Warmups For Meekly Shouting, ‘Someone’s In Here!’ From The Starbucks Bathroom",2017
Bento Box Lunches That Can’t Hide the Fact That Your Son Gave the Whole School Lice,2017
Did You Know Your Nipple Is The Same Size As Your Butthole? I Know Because I’ve Tried,2017
"Natural Makeup Looks That Say, ‘Yeah, I Just Fucked In The Forest’",2017
I Didn’t Know I Was Pregnant or That Pickles Are Cucumbers,2017
Town’s Thriving Literary and Arts Scene Exists Entirely in Woman’s Living Room,2017
High School Friend So Basic They Start Selling Her in Multiple Colors at H&amp;M,2017
"5 Cocktail Dresses That Are Cuter Than Any Bridesmaid Dress, Anyway",2017
The 5 Hottest Guys In The Handmaid’s Tale You Didn’t Even Notice Because That’s Not What It’s About Jesus Christ,2017
Woman Who Regrets Voting for Trump Still Pretty Racist,2017
Man Who Likes to Choke Girlfriend During Sex Complains About Getting Dragged to Sephora,2017
"QUIZ: Is He Into You, Just a Friend, or Trying to Get You to Join the Democratic Socialists?",2017
"Calling My Representative Wasn’t Enough, So I Fucked His Wife",2017
How to Heal Yourself With Guns When You Don’t Have Access to Healthcare,2017
"Maybe She’s Born With It, Maybe She Worries About It Constantly",2017
"3 Blowjob Techniques To Make Him Say, ‘Oh So Thaaaat’s Why We Had So Many Zucchinis In the Fridge’",2017
You HAVE to See These Lipsticks Before I Drop Them On The Bathroom Floor,2017
QUIZ: Can We Guess Which American Girl Doll You Had Based Only On Your Social Security Number?,2017
Newly-Single Haley Casually Drops She’s Willing To Be Set Up For 28th Time,2017
"How I Turned My Weird Eating Habits Into A Cute, Profitable Blog",2017
Sex Positions That Will Make You Feel Self-Conscious About Your Armpits,2017
6 Best Things About Music Festivals The Wind Whispers To Your Hungry Soul,2017
Dove ‘Real Beauty Bottles’ Take Whitewashing to a Whole New Level With New Campaign,2017
Man Not Yet Revealed to Be Serial Abuser Bravely Denounces Man Revealed to Be Serial Abuser,2017
QUIZ: Is He the One You Should Arbitrarily Project Everything Onto?,2017
Body Getting Older With Time For Some Reason,2017
Male Studio Head Claims ‘Wonder Woman’ Marketing Just Takes Longer to Get Ready in The Morning,2017
I Went On The Smoothie Diet And Now Santana’s “Smooth” Keeps Playing Everywhere I Go,2017
"Is He A Bartender, A Mixologist or Someone You’d Introduce to Your Family?",2017
Wedding Hashtags You’ll Share With An Aspiring Bodybuilder,2017
10 Romantic Adventures Your Ex Can Die On With His New Girlfriend,2017
Guy Who Can’t Afford $10 Condoms Miraculously Able to Afford $50 Plan B Pill,2017
Woman Gazing Wistfully At Sunset Also Mentally Tallying Day’s Calories,2017
Who’s The Lesbian And Who’s The Other Lesbian In This Straight Couple?,2017
Minimalist Friend Borrowing Your Stuff Again,2017
Still Think Women Aren’t Funny? Check Out These Classic Jokes Written in Menstrual Blood,2017
Shitty Friend Extra Shitty While Going Through Shitty Time,2017
4 Date Ideas that are Almost as Exciting as a Dress With Pockets,2017
"4 Situations To Which You Can Respond, ‘Mmm Whatcha Saaaaaay? Mmm That You Only Meant Well?’",2017
"5 Shows That Are Not Feminist, Nothing Is Feminist, Please Don’t Send Me To The Red Center",2017
"No One ‘Has’ to Be a Feminist, But I Will Use Your Skull As a Toilet If You’re Not",2017
How to Come to Terms with the Fact That You Don’t Watch The Kardashians Ironically,2017
Renowned Theater Haunted By Actresses Over 40,2017
5 Jelly Sandals That Prove You Miss The 90s More Than All The Other Bitches,2017
This Woman Is So Thirsty She Just Calmly Asked Where The Relationship Was Going,2017
This Pyramid Scheme Is Okay Because It’s Necklaces,2017
"Oh Great, Here Are 15 More TV Shows You HAVE To Watch",2017
5 Dresses With Waist Ties You’ll Definitely Dunk Into Your Pee Water,2017
"My Conservatism Doesn’t Define Me, But This Tattoo Of A Gun With Angel Wings Does",2017
Meet The Genius Woman Who Figured Out Where to Put Her Purse While Getting a Haircut,2017
Same Sexist Thing Also Happened To Jared If It Makes You Feel Any Better,2017
Lifelong Friends Celebrate 85 Years of Shitting On Susan,2017
"Holy Fuck! Unlike Most People, This Guy Loves Good Conversation",2017
6 Actresses We Want to See in the New Batgirl Film That Your Boyfriend Will Jerk Off To,2017
"Unicycles Are Feminist, and Here’s Why",2017
We Interviewed 13 Queer Women About Their Dating Lives And Lost the Transcript,2017
I Used to Never Queef in Meetings. Now I Always Do. Here’s Why.,2017
How To Pretend the Sex Dungeon You’re Trapped In Is the Disney Vault,2017
"I Lost My Virginity At This County Fair…Hello? I Think It’s By The Popcorn, Help?",2017
How to Tell If He’s Really Into You or If Your Backyard Just Has Really Great Lighting for His Next Short Film,2017
7 Acts of Resistance I Stopped Doing a Month Ago,2017
4 Spring DIY Projects That Aren’t As Fun As Masturbating to ‘Buffy The Vampire Slayer’,2017
"Sure He’s Great, But Do You See Yourself Arguing In A Mall With This Guy?",2017
Airline Attendant Drives Onto Plane and Hits Overbooked Passenger With Car,2017
I’m Not Going To Text Him Until He Texts Me Or Until I Think About How Grandma Died Alone,2017
How to Use Your Hands For Holding Tea Instead of Drugs,2017
Thawing Lake Ice You Can Stand On Instead of Going On Tinder Ever Again,2017
3 Solo Getaways We Think Would Be Really Good For You,2017
Wow! This Woman Double-Checked to Make Sure She Sent That Text to the Right Person,2017
4 Important Nutrition Tips That Bethany is Probably Making Up As She Speaks,2017
I Wasn’t Sure What I Was Supposed To Do With My Underwear During My Massage So I Put Them In My Mouth And I Swallowed Them,2017
I Protect My Skin On Beach Days By Keeping It In a Tote and Leaving It In The Shade,2017
Wow! This 90-Year-Old Theatre Major is Still ‘Figuring it Out!’,2017
My Boyfriend Ate Nothing But Pineapple For A Week And Now His Dick Is Covered In Bees,2017
Woman Still Haunted By Missed Field Hockey Goal in 2003,2017
Elegant Summer Dresses to Make You Feel Like a Pampered Show Horse,2017
Dana Brushing Up On Classmates’ Worst Flaws Before High School Reunion,2017
"Affordable Alternatives To Today’s Trends That Will Make Friends Say, ‘I Saw That At Target!’",2017
Hangover Cures That Can’t Fix How You Told Your Life Story to Everyone,2017
Cut Your Coffee Consumption in Half by Pouring Half into Your Lap,2017
Why I’m Still Saving Myself For Logan from ‘The Babysitters Club’,2017
Why I Stopped Wearing Makeup And Started Being A Border Collie,2017
Hero Woman Leaves Sephora Without Buying Anything,2017
Wow! This Woman Crafted the Perfect Response to a Twitter Troll When She Could’ve Been Enjoying Time With Her Family,2017
Why Are Women So Afraid to Embrace the Label ‘Ambitious Shrew Who Needs to Get Fucked?’,2017
Bold Spring Hair Colors That Will Shock Absolutely No One,2017
How to Subtly Put in a New Tampon When You Get Stuck on Top of a Ferris Wheel,2017
Should You Keep Fucking Kevin Through His Bed Bug Scare?,2017
Friends With Benefits Arrangements to Ruin Both The Friendship and The Benefits,2017
"He Was a Porn Addict, She Was a Matrilineal Arctic Forager, and Now They’re Married",2017
Man Generously Offers Not to Judge Woman He’s Trying to Fuck,2017
How to Reach the Peak of Your Success So a Man Can Take You Under His Wing,2017
6 Quotes That Sum Up What Being An Adult Is Like If That’s Your Defining Characteristic,2017
Guided Meditations For When He Tells His Ayahuasca Story,2017
4 Light-Colored Pants That Are Great For Spring Until You Accidentally Pee On Them a Little,2017
Why I’m Settling For a Man Who’s Not My High School Poster of Aragorn,2017
4 Photos of Kendall Jenner That Prove She Is a Social Justice Warrior and I Am Being Held Hostage By Kris Jenner,2017
How to Build Strong Female Friendships Now That You’ve Killed the Pizza Guy,2017
4 Dance Moves To Get You Out Of The Room After A Guy Asks You If His Dick Is Proportional,2017
Are You Washing Your Hair The Right Way? Our Panel Of Experts Will Tell You How Dumb and Wrong You Are,2017
Twitter Scholar Helpfully Points Out Logical Fallacy In Meghan’s Joke,2017
Courtney Not Sure Which Cracked Phone Is Hers At This Party,2017
5 Times ‘SVU’ Gave Me Unrealistic Expectations About Cops Listening To Rape Victims,2017
4 Ways To Speak Your Truth To The Intruder In Your Home,2017
"I Love Cheap Wine, Which Is Adorable Because My Dog Cost Three Grand",2017
How To Talk About Whitewashing Without Revealing You Were Originally Written As A Woman Of Color,2017
"Candles That Will Help You Relax, But Not Forever, Because You Have To Blow Them Out",2017
How I Politely Rejected His Advances by Turning Into A Laurel Tree,2017
The Best Lubes for Sliding Into His DMs,2017
I Thought I Was Going to Take It To Go But I Decided to Stay,2017
4 Recent Hillary Outfits That Say ‘LOL Fuck You Guys’,2017
3 Dystopian Novels to Read While They’re Still Fiction,2017
Man Too Busy to Send ‘Happy Birthday’ Text Somehow Finds Time to Leave Voicemail of Himself Cumming,2017
Science Finally Invents a Dick That Shrinks In Your Mouth and Grows in Your Pussy,2017
Woman So Pissed That She Actually Cleans,2017
Woman Scares Man Off By Leaving Flowers At His Grave,2017
These Cute Dog Photos Will Make You Lose It For Just Long Enough That I Can Swoop In And Steal Your Man,2017
Wow! This Working-Class Mom Is Forced to Have It All,2017
"There’s A Special Place in Hell for Women Who Don’t Help Me When I’m Trapped Down This Well, Again",2017
Unique Baby Names That Honor Your Mermaid Heritage,2017
How to Spot That Twinkle In His Eye That Says He’s Going To Masturbate To You Later,2017
Wedding Hashtag Mostly College Roommate’s Selfies,2017
Wow! This Woman Made a Week’s Worth of Groceries Last Only One Day,2017
New Bill Requires Women Seeking Abortions to Paint Still Life of Fetus,2017
My Period Flowed So Hard Everyone Grabbed Surf Boards and Is Having Fun,2017
"I Ended My Five-Year Relationship To Focus on Myself, and Brad, My Side Piece",2017
"5 Smiles That Say, ‘Ha Ha, I Never Have Any Idea What’s Going On’",2017
"‘I Wish I Knew How to Help Innocent Syrians,’ Says Woman Who Just Googled Wine Stain Removal",2017
4 Facebook Thirst Traps That Were Ruined By The Comment ‘You Look Like Your Dad’,2017
School’s Insanely Detailed Prom Dress Code Has a Seven-Page Foreword By Kate’s Mom,2017
Calming Meditations For When You Touch a Wet Bathroom Doorknob,2017
3 Ways To Use Your Words Instead of Rolling Your Eyes So They Know You’re Really Pissed,2017
5 Easy Dinner Ideas Your Man Can Cook After He Cums Right Away,2017
Man Who’s Afraid of Commitment Also Has No One Willing to Commit to Him,2017
I Put Aside My Ambitions for My Husband Because I’m a 50s Housewife That Slipped Through a Wormhole into the Present,2017
"I Have Perfect Bedroom Eyes And Bedroom Hair And Okay Yes, I’m A Bed",2017
Friend Just So Glad To See You Happy For Once,2017
5 Mistakes That Will Infuriate All Grammar Nerds Who Need To Feel Superior,2017
"Please Don’t Blame My Irrational Behavior on My Period, Even Though It Did Just Start",2017
"This Woman Just Got Promoted, And All It Took Was Switching Bodies With A White Guy During a Lightning Storm",2017
Is Now The Right Time To Have Step-Kids?,2017
What to Do if You Kill Your Earth Day Party Host’s Beloved Kombucha Scoby,2017
‘You Make Me Want to Be a Better Man’ Just Veiled Excuse For Being Worse Man,2017
5 Facial Mists We Guess Are A Thing We Fucking Do Now,2017
I Started a Podcast Just So My Nerd Boyfriend Would Listen to Me,2017
"How To Tell If You’re Being Manipulated By A Narcissist Who Isn’t Really That Bad, You Just Have To Get To Know Him",2017
‘Devil’s Advocate Boy’ Statue Erected On Wall Street Next To ‘Fearless Girl’,2017
Sad? These Five Sadder Things Will Hopefully Guilt You Into Being Happy,2017
I Don’t Need Makeup to Feel Like Men Should Fear Me,2017
Inspiring! This Girl Did So Many Pilates She Turned Into A Tricep,2017
Drunk Self Goes to Bed Without Washing Your Face Again,2017
How To Delete His Number So You Can Add It Back Later,2017
Are You Dating Or Just Friends Who Have Sex and See Each Other 5 Times A Week?,2017
Office Really Going All Out With Fancy Water,2017
My Out-of-Network Somatic Healer Cured Me of My Class Privilege Guilt,2017
QUIZ: Should You Get High Right Now Or Yes?,2017
"‘You Don’t Know How Pretty You Are,’ Whispers Man Who Doesn’t Know How Terrible He Is",2017
How to Feed Yourself in the Year Between When Karen Does Her Dishes,2017
Amazing! This Woman Didn’t Let Her Relationship Stop Her From Being Charged by Inactive Dating Apps,2017
Dry Shampoos That Will Make You Look Like A Teenager Portraying An Old Woman In A High School Play,2017
These Retro Spring Trends Will Let You Yell At Your Mom Again for Giving Your High School Wardrobe to Goodwill,2017
Is Siri Mad At You or Does She Just Not Use Exclamation Points?,2017
How to Still Find Alexander Skarsgård Hot After Watching ‘Big Little Lies’,2017
"I’m Not Tiny Because I’m Asian, I’m Tiny Because You’re White",2017
Intern Gains Invaluable Experience of Explaining Cis Privilege to 55-Year-Old Employer,2017
How to Tell Your Body to Cut the Bullshit,2017
4 Geometric Necklaces That Will Chafe Your Chest,2017
I’m Sorry I Was Being So Crazy While You Were Treating Me Like Shit,2017
Amazing! This Baby-Food Diet Really Works! For Babies!,2017
I’m Going to Draw Clear Boundaries With You As Soon As I Learn How to Do That,2017
The Best Diets to Help You Fit Through a Tiny Window if A Murderer Is After You,2017
$400 Headphones to Block Out the Noise at Your $200 Coworking Space,2017
"3 Vintage-Style Swimsuits That Show Your Truest Self, and Also Hide Your Naked Body, But It’s Not About That",2017
Julie Really Hoping Alma Mater Trending For Basketball And Not Rape,2017
Wow! Woman Completes Online Clothing Review Without Mentioning Her Long Torso,2017
How I Used A Bracket To Help My Boyfriend Define Our Relationship,2017
Woman Somehow Gets That Same Creepy Fucking Uber Driver Again,2017
5 Selfie Angles You’ll Use Just to Show Off Your Boobs,2017
"6 Celebrities I Want To Show My Vagina To, Then Slap Their Hand Away When They Get Too Close",2017
These 5 Philosophy Books Will Make You A Better Person Than Your Friends Except At Fucking,2017
Woman With Amnesia Rediscovers Lost Identity Through Her Most-Used Emojis,2017
Ways to Reward Yourself Without Food As If Such a Thing Were Possible,2017
Bridget On Fourth ‘Soulmate’,2017
"Sorry, but I Refuse to Share a Bathroom with a Greek Chorus",2017
Empower Your Friends by Punching Them In The Face If They Say Sorry,2017
Gray Hairstyles To Show Everyone How Old Your Soul Is,2017
5 Badass Female Ghosts Living Their Best Afterlife,2017
How Getting 8 Hours of Sleep Gave Me The Energy to Overcommit Again,2017
Woman Who Claimed Thongs Are Comfortable Finally Stops Living A Lie,2017
8 Responses That Show The Group Chat You’re Paying Attention,2017
Photos Of Fruit That Imply This Article Is About Juicy Vagines,2017
"How to Reach Your 10,000 Steps By Checking All the Rooms In Your House for Intruders",2017
Unisex Clothes That Are Unflattering On Every Gender,2017
The Hardest Thing About Being Single Is That Couples Keep Trying to Hunt Me for Sport,2017
Inspiring! This Woman Just Schooled this Dude on Feminism then Cried in the Bathroom for a Few Minutes,2017
How to Catch Feelings and Then Throw Them Into the Fire Where They Belong,2017
Trend Alert: Visible Bra Lines Because You Keep Putting Them In The Dryer,2017
QUIZ: You’re A Bitch,2017
How To Convince Him You’re Not Just Dating Him For His Chest Hair,2017
How to Dance Like No One’s Watching Even Though You’re Standing On The Bar,2017
6 Sex Positions That Will Make You Think You Have to Pee,2017
"‘Don’t Be So Dramatic,’ Says Boyfriend Who Punches Walls",2017
"Incredible! This Woman Transformed One Bad Relationship Into Several Sweeping, Unchecked Claims About Human Nature",2017
Woman Tragically Gives Handjob with Non-Fitbit Hand,2017
Couple Agrees on Restaurant Solely Through Shrugs,2017
How I Saved $1 A Day Just By Avoiding The Homeless Woman I Usually Give $1 To,2017
4 Bright Lip Colors That Won’t Rub Off on the Joint,2017
How to Make Yourself Cum So Hard You Fall Off the Bed and Down the Stairs,2017
Women’s Autobiographies That Will Make Unparalleled Success Feel More Relatable,2017
How to Accept Constructive Criticism While Only Crying a Little Bit,2017
Woman Wearing Same Shirt For a Week Packs 42 Different Vacation Outfits,2017
Is He Catcalling You or Trying to Stop You From Falling Down This Hooooooooooole,2017
"I Totally Want You to Ravage My Body, But Could You Please Leave Your Shoes By the Door?",2017
Former THINX CEO Asked to See Everyone’s Period,2017
"2,500 Annoying Ways to Ensure Anna Posts That Cute Picture of You",2017
Unsolicited Feedback On Your Appearance He Can Give You Because He’s Gay,2017
Why I Started Meal and Disaster Prepping,2017
Woman Spends Five Years Grooming Boyfriend to be Great Husband to Lisa,2017
4 Free Drinks With No Strings Attached Except Vigilance,2017
Sesame Street Introduces First Character That’s a Scientologist,2017
Wow! This Woman Kept Ed Sheeran In A Shoebox And Nursed Him Back To Health,2017
I Only Shop Women-owned Brands! Amazon Prime Is A Woman’s Name,2017
My Best Friend Got Her Life Together Without Consulting Me First,2017
He Ignored Me For My Entire Life Until He Finally Texted ‘Wyd’ On My Deathbed,2017
How to Show George W. Bush The Forgiveness You Can’t Muster for Your Father,2017
Disney LGBT Win! This Lesbian Fork Spends ‘Be Our Guest’ Telling Other Forks ‘You’re Such A Shane’,2017
Scientists Don’t Recommend Derek’s Apartment,2017
Inspiring! This Communications Major Has Avoided Eye Contact Since 2014,2017
Heather’s Plan To Quietly Elope Somehow Involves You,2017
Help! My SoulCycle Bike Came Loose And Now I’m In Chile,2017
Why I Traveled Around the World Just to Get Trashed in Slightly Different Rooms,2017
4 Fashion Backpacks That Are Big Enough To Fit Just One Human Head,2017
How to Turn Your Entire Home Into A Chalkboard,2017
How To Remind Him You Haven’t Forgotten His Penis Is Still In The Room,2017
"QUIZ: But Like, Did You Read The Book?",2017
Are You An Introvert? Here’s How To Flip Your Body Right-side Out,2017
Ex-Boyfriend Somehow Able to Feel Joy After Losing You,2017
6 Email Sign-Offs That Will Leave Your Coworkers Begging For More,2017
Easy Ways to Repurpose Your BF’s T-Shirts Into a New Relationship,2017
I Thought of a Better Instagram Caption After Someone Had Already Liked My Post,2017
This Woman Announced the First Openly Gay Character in Her Own Life: Herself,2017
Celebrity Quotes That Will Inspire You To Not Quit Now But Definitely Quit Later,2017
"My Yoga Teacher Said to Move However Feels Good, So I’m in the Fetal Position",2017
We Found The Best Pair Of Jeans For Every Body Type Unless You Have To Sit Down,2017
Breathtaking Hike Locations for Faking an Injury so Jackson Will Touch Your Leg,2017
"Ugh, I’m The Worst! I Just Killed My Whole Family",2017
"Study Finds Straight Women Have The Fewest Orgasms, But Keep Fucking Jeff Anyway",2017
7 Cool Makeup Tips For You to Fuck Up Later When You’re Running Late,2017
6 Sexist Movies He Dislikes For Other Reasons,2017
How To Get Your Body Bikini-Ready By 2047,2017
Good Shoes For a Nice Walk,2017
How to Replace Every Snack With Popcorn Until Your Gums Bleed,2017
Why I Want Politicians to Legislate My Butt,2017
4 Lipsticks to Make Your Mouth All Chapped and Bad,2017
3 Cute Ways to Ask a Ghost to Come Back Later,2017
"3 Middle Parts That Say ‘Look At My Scalp, Bitch’",2017
QUIZ: Are You A Big Little Lie Or A Pretty Little Lie?,2017
10 Dealbreakers Unless Your Name is Dylan Because That’s Hot,2017
Why I Give Good Diet,2017
Boobs Always In The Way,2017
"3 Jumpsuits That Scream, ‘I Don’t Know Myself Yet!’",2017
Woman Who Says She Needs Coffee Actually Needs Entirely New Life,2017
5 Sexts to Make His Dick Go ‘HEY’,2017
4 Men Named Kyle Who Have No Idea There’s a Women’s Strike,2017
Why I’m Using My Time Being Single to Dig a Really Deep Hole in My Backyard,2017
We Asked 10 Powerful Women for Their Secrets to Success and They Said ‘Pretend to be a Horse’,2017
Should You Spit or Swallow or Spray It in the Air Like a Tiny Whale?,2017
How to Get Back in the Dating Game for Exactly One Hour,2017
This Married Couple Reveals The Secret To Staying Together And Yes It’s Fucking With Wigs On,2017
How to Laugh Like ‘Tee Hee Hee’ Instead of ‘HO HO HOOOO’,2017
Women’s Conversation Just a String of Apologies for Being Terrible at Communication,2017
Woman Celebrates One Year in New York By Slurping Ramen Out of Floorboards,2017
The Best Yoga Pants for Sliding Down a Banister and Impressing Your Crush,2017
How to Stay Vigilant In Trump’s America While Also Keeping Your Baby Hairs Tamed,2017
"I Tried the RBG Workout, and Now My Body Is One Giant Fancy Collar",2017
Missing Woman Finally Located In Depths Of Fun Facebook Group,2017
How To Let Your Bachelor-Viewing Party Know That You Support Women Just Not These Women,2017
Here’s How to Go Makeup-Free Without Scaring Dogs,2017
"My Love Language Is Touch, But Not When I’m On My Period, You Monster",2017
We Cut Open These Beautyblenders and We Found The Clitoris,2017
Woman Has Wonderful 10 Seconds Before Spandex Rides Up Again,2017
How to Lucid Dream So You Can Finally Fuck Mitch,2017
I’m a Feminist But I Love Men and Want To Fuck Them and Just Listen to Me I Promise I’m Not Even Mad,2017
How to Let the Guy Who Kinda Looks Like Your Ex Ruin Your Whole Day,2017
Inspiring! This Post-Partum Mother Actually Likes Her Body,2017
How to Casually Let Him Know That Your Freezer Is Full of Pizza Bagels,2017
Therapy Dog Not Certified For Courtney’s Bulllshit,2017
Woman’s Savings Account Just Money She Forgot About in Venmo,2017
Aw! This Boyfriend Cooked His Girlfriend An 11-Pound Cube of Meat For Their Anniversary,2017
How To Get A Revenge Bod By Murdering Him And Keeping His Body,2017
I Wish I Could Just Be a Lesbian So I Could Ruin That Relationship Too,2017
The 5 Best Dry Shampoos to Use When You’re Lost at Sea,2017
What to Do If Your Friend Shows Up to the Party Wearing the Same Defeated Expression As You,2017
