headline,year
4 Tattoos That Seem Edgy Until You Realize They’re Harry Potter References,2018
On The Reductress Minute: Sex and the City Fans! Which One Are You – Sex or The City?,2018
Cool! This Woman Will Let Her Dog Lick Her on the Mouth But Won’t Drink Tap Water,2018
How to Make it Seem Like You’re Also Sleeping With Other People by Leaving Out Condom Wrappers,2018
How I Got Ahead of Tax Season by Having My Dad’s Guy Do Them,2018
4 Great Woman Singers To Check Out Since It’s Weird You Still Listen to Dispatch,2018
Study Finds I Don’t Want to Be Anything Other Than What I’ve Been Trying to Be Lately,2018
"Getting a Brazilian Hurts Everywhere – Except For My Tough, Tough Asshole",2018
How To Avoid Ticks And We’re So Sorry For Showing You A Tick,2018
"I Can’t Make You Love Me, But Trust Me I Will Fucking Try",2018
Woman Who ‘Loves Dogs’ Doesn’t Even Know How To Ride One,2018
This Eye Cream Gives the Illusion Of A Full Night’s Sleep And Happy Childhood,2018
Horoscope Says You’ll Be ‘A Weird Mix Of Sad And Horny’ For 5th Day In Row,2018
How To Live In The Moment Unless This Moment Is Super Boring,2018
I Need to Know Who Bit Beyonce Because I Just Wanna Talk to Them,2018
Wow! This Woman Who’s Never Done Yoga Signed Up For Yoga Teacher Training,2018
How To Learn To Trust Again After He Reveals His Name Is Actually His Middle Name,2018
4 Home Improvement Shows to Binge Watch While All Your Friends Are Buying Houses,2018
Wow! This Woman Missed Her Flight Waiting Until Her Neighbors Were Out Of The Hallway,2018
"If You Can’t Handle Me at My Worst, You Don’t Deserve Me When I Get Even Zeros at the Gas Pump",2018
Sweatshirts With Thumb Holes That Will Make Your Aunts Jealous,2018
Report: Skin Must Also Be Bouncy Now,2018
6 Oversized Inflatable Rafts That Would Be So Fun If You Had a Pool or Friends,2018
Aw! Restaurant Breastfeeds Into Wine Glasses In Solidarity With New Mom,2018
"‘I Would Never Date a Black Woman’, Says Man Who No Black Woman Would Ever Date",2018
How I Got Everyone to Shut the Fuck Up About Their Standing Desks With My Standing Toilet,2018
How I Use Movement to Show Everyone in This Coffee Shop That I Teach Yoga,2018
On The Reductress Minute: Study Finds It’s Still Annoying When Brian Says the Right Things About Male Privilege,2018
How to Get Rock Hard Abs by Putting Rocks Under Your Shirt and Saying ‘Voilà’,2018
6 Stainless Steel Water Bottles to Go Cling Clang Cling Clang in Your Purse,2018
Wow! This Woman Worked Out During Her Good Hair Day,2018
Wow! The House From ‘Full House’ is Totally Hot Now,2018
I LIVED IT: I Forgot About Scarves This Winter,2018
"I’m Slowly Learning Who I Am, and Honestly I Don’t Care For Her",2018
Here’s Your Horoscope For The Week Even Though Your Life Has Been The Same For 4 Years,2018
STUDY: All the Barbies You Made Fuck Now Have Teenage Children Who Want a Relationship With You,2018
My Skin is So Thirsty it Fucked My Upstairs Neighbor,2018
Salon Experts Confirm You Should Only Be Washing Your Pubes Once a Week,2018
Here’s Why You Need to Visit a Gynecologist if Your Vaginal Discharge Is Pantone Shade 373 C,2018
"How to Respond ‘Haha, Yeah!’ Instead of Just Asking People to Repeat Themselves",2018
"I Hate To Say Goodbye, but I Love to Watch His Lil’ Boy Butt Walk Away",2018
Sex and the City Fans! Which One Are You—Sex or The City?,2018
QUIZ: Does He Like You or Does He Just Like Seeing His Tiny Face Reflected In Your Eyes?,2018
Success! Woman Truly Surprised by Surprise Party She Explicitly Didn’t Want,2018
Tips to Manage Your Schedule From Successful CEOs and Polyamorous Couples,2018
5 Sexual Fantasies That Are You Getting a Good Night Sleep For Fucking Once,2018
"4 Perfume Atomizers That Scream, ‘Yeah, I Took A Burlesque Class Once’",2018
I Overthink Everything Except When It Comes To Eating Two Krispy Kremes As Long As We’re Here,2018
This Man Is Dating a Younger Woman Because She’s Mature for Her Age and Also Doesn’t Yet Know That She’s Supposed to Cum Too,2018
Woman On Tinder Just Looking For A Casual Breakup,2018
"If He Really Loves You, He’ll Ask You If You Want a Bite of His Microwave Burrito",2018
New Dating App Matches You With A Mom That Doesn’t Care If You Get Married,2018
How To Stop Procrastinating After You Deal with Each and Every Blackhead,2018
Inspiring! This Woman is Saving All the ‘Good Bags’,2018
Woman Who’s ‘Not Into Drama’ Currently Nurturing Eight Unrelated Grudges,2018
How to Pretend to Believe Julia’s Complaints About Her Large and Perfect Breasts,2018
Study Finds It’s Still Annoying When Brian Says the Right Things About Male Privilege,2018
Woman Listening to Sad Music While She’s Already Sad to Be Sadder,2018
4 Yoga Pants Nice Enough To Wear To Work If You Work As A Yoga Instructor,2018
Woman Who Thinks Pads Are Gross Spends Half Her Period With Wadded Up Toilet Paper Up Her Vag,2018
What to Do When Your First Pegging Opens Up A Mandela Effect Portal Where Sinbad’s Shazaam Exists,2018
On The Reductress Minute: Meet The American Girl Doll Who Wants To Make Sure Addy Knows How “Woke” She Is,2018
This Hot New Gym Playlist Still Won’t Make It Any Better,2018
4 Dresses To Air Out Your Vagina For The Spring Thaw,2018
Feminist Hero? This Woman Rescued a Judith Butler Book From a Burning Building,2018
Melissa Lactating Like A Fuckin’ Beast,2018
How to Explain to Your Cool Friends that You Unironically Enjoy Chain Restaurants,2018
Woman Who Gave Up on Dreams Has Advice for How to Pursue Yours,2018
5 Dad Sneakers That Are Ugly But We’ve Seen Celebrities Wear Them,2018
4 Sexy One-Piece Bathing Suits That Are Really Complicated So You Might As Well Put On A Two-Piece,2018
Inspiring! This Dentist Can Say Oral 10 Times a Day Without Laughing,2018
Brave! Mom Agrees to Try Avocado for the First Time,2018
4 Lacy Black Dresses That Totally Would Have Gotten You Killed In 1692 Salem,2018
How To Stay Calm Even Though Everyone Missed What You Just Said and It Was Really Good,2018
Dude Somehow TOO Into Eating Pussy,2018
"Woman Felt Good About An Idea She Had, But Then She Tweeted It",2018
Mom Caves On Lenten Promise To Give Up Dad’s Perfect Wang,2018
Aww! These Lesbians’ Bridal Party Is Comprised Entirely Of Exes,2018
"Smart Pants That Say, ‘I Went to a Country Day School’",2018
How to Follow Your Bliss by Following the Path With the Most Escalators,2018
How To Upgrade Your Cheap Furniture By Making Everyone Use Coasters,2018
Mom Really Hopes You Wear Nylons With That Dress,2018
4 Sweaters That Will Make You Feel Like Sandra Bullock in ‘While You Were Sleeping’,2018
Smart! These Tampons Come Partially Opened and Already at the Bottom of Your Purse,2018
4 Serums That Won’t Do Much To Stop Forehead Wrinkles If You’re Constantly Skeptical,2018
On The Reductress Minute: Wow! This Beautiful Woman Won’t Shut Up and Take The Compliment,2018
The Science Behind Why Smoking One Cigarette Per Day Is Honestly Probably Fine,2018
4 Knee Socks That Are Slutty Somehow Even Though They’re Socks,2018
Woman Beginning To Look Like Her Dog — And Her Dog Is Fucking Hot,2018
How to Make a March Madness Bracket That Ends With You and Timothée Chalamet Living On a Vineyard Together,2018
Horse Girl from High School a Cop Now,2018
Wow! This Woman Is Named ‘Quevenzhané’ But She Prefers ‘I’m Gonna Butcher This’,2018
"15 Women’s Rights Activists, Ranked by How Much I Think They Could Bench",2018
"Alexa Is Laughing at You Because Admit It, You Said Something Super Weird",2018
How I’m Letting My Ex Know I’m Over it Across Every Social Platform,2018
Get Healthy Skin By Pulling Away From A Bearded Man’s Sensual Kiss,2018
This Woman is Trying Out a New Scent and The Whole Subway Car Is Loving it!,2018
"‘Black People Have Ridiculous Names,’ Says Guy Who Worked for Newt Gingrich",2018
Track Calories By Yelling Them Out Like The Count From ‘Sesame Street’,2018
Meet Dakota! The Newest American Girl Doll Who Wants To Make Sure Addy Knows How ‘Woke’ She Is,2018
How to Stay Humble After You Had Sex for the First Time in Two Years,2018
RuPaul Just DRAGGED This Suitcase Because It Doesn’t Have Wheels,2018
"4 Groovy Graphic Tees That Say, ‘I Don’t Practice Santeria, I Ain’t Got No Crystal Ball’",2018
Wow! This Boyfriend Can’t Take One Halfway Decent Fucking Photo of His Girlfriend,2018
"Five Easy Weeknight Recip—Holy Shit, College Was Four Years Ago",2018
I Need This Emotional Support Dog In Case I Need to Take a Shit On This Plane,2018
"How To Support All Women, Particularly The One In The Stall Next To You Going THROUGH It",2018
"4 Modern Dating Trends That Make Your Grandma Say, ‘If I’d Been That Picky, You Never Would Have Been Born’",2018
I Am Enough. And Probably Also a Little Too Much.,2018
5 Mud Masks That Will Make You Feel Like a Luxurious Little Farm Pig,2018
Woman Fancies Herself Indie Darling of Her Social Media Marketing Agency,2018
Woman Who Brags About Being Dairy-Free Still Wants A Bite Of Your Nachos,2018
"3 Sex Positions That Physically Don’t Work Unless Queer Eye Is On, Sorry!",2018
How to Network Without Stalking People Like Prey,2018
This Butterfly Got a Tattoo of a Sorority Girl on Its Lower Back,2018
How to Keep Your Shit Together When Your Hair Tie Breaks,2018
Whoa. This Totally Badass Free Spirit Is Thinking About Getting a Tattoo,2018
Four Fast-Paced Careers That You Can’t Have if You’re Running Your Dog’s Instagram,2018
Are Teenagers Trying the Dangerous New Trend of ‘Bear Bleaching?’ No.,2018
Plunging Pendant Necklaces That Are Just Gonna Wobble Back and Forth on Your Boobs All Day,2018
"2018 Oscar-Nominated Movies That Are Good, But Not as Good as ‘Center Stage’",2018
"How to Win an Argument by Yelling, ‘We’re Saying the Same Thing!’",2018
Newly Discovered Pages From Anne Frank’s Diary Reveal She Was A Horse Girl,2018
4 Corsets For When You’re Headed To a Sex Party or a Renaissance Faire,2018
I Just Don’t Understand Why Black Women Who Have to Constantly Justify Their Humanity Are So Angry All the Time,2018
"Wow! This Woman Spent Her 10,000 Hours Mastering Gchat",2018
"‘It’d Just Be So Much Easier To Date Women,’ Says Tired and Correct Straight Woman",2018
"5 Consent Metaphors to Help Him Understand – Oh, He Stopped Reading at ‘Consent’?",2018
Inspiring! This Woman Won’t Even Pry into Her Own Life,2018
Would He Still Love You if You Were His Ex-Girlfriend?,2018
Friend Who Has Been Sufficiently Flattered Today Wants to Know How You’re Doing,2018
"The 4 Best Yoga Pants to Squeeze Your Big, Jiggly Ass Into",2018
How to Eat 5 Small Meals a Day if the Train is Going at 300 MPH and Hadley Left 2 Hours Ago,2018
This Sexual Predator Who Got Away With It Thinks it’s Unfair That Other Sexual Predators Haven’t,2018
I Never Thought I Would Find Love. And Then I Didn’t.,2018
Is It Love Or Does He Occasionally Allow You To Complete A Thought?,2018
Finally! This Black Woman Was Told She Looks Like a Celebrity She Looks Like,2018
Wow! This Guy Did a Beautiful Sketch of A Woman Without Her Permission,2018
"These Successful Women Were Bullied As Kids, And You Can Kinda Understand Why",2018
Amazing! This Woman Has Worn The Wrong Outfit For the Weather Every Day This Year,2018
Aw! This Man is Making Up For Emotionally Abusing His Ex by Saying Nice Things About Her to His Friends,2018
My Mom Keeps Trying to Marry Me Off to a Mean Lord,2018
Wow! This Beautiful Woman Won’t Shut Up And Take The Fucking Compliment,2018
Episode 1: Dermatologists Hate Her! This Woman Is Really Mean to Dermatologists,2018
I Finally Relate To The GOP Now That They’re Being Owned By Teenagers,2018
Fuckboy Ghost Still Won’t Cross Over For Girlfriend,2018
"4 Pairs of Keds That Say, ‘I’m Actually Worried About Nothing!’",2018
Coworker With ‘I Hate Mornings’ Coffee Mug Spends Entire Morning Talking To You,2018
"Great, Sick Friend Still Coming On This Road Trip",2018
Julianne Hough Is A Redhead Now And Her Hair Looks Redder For Sure,2018
Guy Shouting Over Everyone Must Have The Most Valid Opinions,2018
Woman Shatters Previous Record During Sunday Night’s Lotion Application,2018
Black Woman Totally Sucking the Fun Out of Conversation Demonizing Her Entire Race,2018
True Ally? This Male Feminist Only Takes Credit For His MALE Coworkers’ Ideas,2018
This New Podcast Will Blow the Lid off Your Butt,2018
How I Found the Perfect Pair of Shorts By Chanting ‘Thick Thighs Save Lives’ in Front of a Mirror,2018
Woman Deciding Between Going Out Or Oh Wow Look She Fell Asleep,2018
4 Fresh White Shirts To Ruin With Your Armpits,2018
"‘Teens are Too Young to Make Rational Decisions,’ Says Man Who Supported Roy Moore",2018
Wow! This Self-Described Feminist Is Suspicious Of All Women,2018
Woman Really Believes His Sexuality Is The Only Thing Standing Between Her and Antoni,2018
How to Attract an Older Man By Arguing About ‘Caddyshack’,2018
"Thin Eyebrows Are Back! Haha JK, But You Freaked Out For A Sec Didn’t You?",2018
6 Cute Pixie Cuts That Will Make Your Co-Workers Call You ‘Brave’,2018
Here’s How Much Water You Should be Drinking When You’re a Mermaid Pretending to be Human,2018
"5 Adidas Looks That Say, ‘I Love Adidas’",2018
EvEn FaCeBoOk FrIeNd WhO StIlL TyPeS LiKe ThIs SuPpOrTs GuN CoNtRoL,2018
Woman Reaches Yearly Crying Quota Watching One Night Of Olympic Figure Skating,2018
Cast of ‘Black Panther’ Added to FBI Watch List,2018
5 Full-Sized Animals to Eat Since You Went to the Gym This Morning,2018
Man Who Graduated College Two Years Ago Already Looks Like Middle-Aged Dad,2018
"How To Be Better In Bed, Because He’s Sure He’s Doing Everything Right",2018
Annie Upset After Not Being Invited To Thing She Didn’t Want To Go To,2018
How Being a Female Programmer Helped Me Save Jurassic Park,2018
Aw! This Man Asked His Girlfriend To Marry Him Via a Promposal Video,2018
Wow! This Woman Had To Go To A New Place And Didn’t Have A Meltdown,2018
Five Recorder Tunes To Play During Sex So He Doesn’t Hear You Queef,2018
4 Dresses That Don’t Run True To Size Because What’s The Fun In That,2018
"How To Do Your Own Taxes Like a Boss! (Sarah’s Boss, Who Got Audited That Time)",2018
How I Survived My Battle With Unsolicited Advice About My Battle With Depression,2018
Wow! This Woman Won’t Pursue Anything Unless She’s Perfect At It On the First Try,2018
"4 Pieces That Say, ‘Triangles Are My Dominant Decorating Aesthetic’",2018
5 Wines That Pair Well With Staring Out Over the Skyline Plotting the Downfall of Your Enemies,2018
"Not To Brag, But All My Favorite Porn Stars Are Women",2018
Inspiring! This Woman Got Into Such Good Shape That Her Friends Stopped Inviting Her To Brunch,2018
How I Ended My Two-Year Relationship By Repeating ‘Command Q’ Until He Left,2018
What Your Myers-Briggs Type Is Like On A Date As Long As It’s One of The Ones I Remember,2018
Amazing! This Woman Cuts Toxic People From Her Life Unless She Needs Something From Them,2018
How to Extend Your Relationship By Suddenly Calling Him ‘Bae’,2018
Study Finds It’s Time to Get Up and Pee Already,2018
4 Sex Positions That Only Work If His Dick Is Over 12 Inches,2018
"Hey, Maybe These Fun Socks Will Turn Everything Around For You",2018
Woman Dedicating Entire Life To Love Of Athletics Still Considered A ‘Tomboy’,2018
6 Hair Clips That Will Make You Look Like An Overwhelmed Librarian,2018
4 Plants That Purify The Air In Your Home But Won’t Help With The Weed Stank,2018
Aww! These Women Spent Their Entire Work Lunch Trading Excuses for Why They Were So Hungry,2018
Wow! This Man is Sapiosexual But Also Likes Big Boobs,2018
How to Act Excited About Your Valentine’s Day Gift Even Though All You Really Wanted Was a Pig in a Cowboy Hat,2018
4 Cheap Date Ideas That Are All Just Fucking,2018
The Best Podcasts To Be Pulled Away From When A Guy On The Train Wants To Talk To You,2018
I’m Celebrating Valentine’s Day By Letting Myself Be a Martyr,2018
Friend in New Relationship Talking About Sex Like No One Has Ever Had It,2018
How to Give Yourself an Orgasm Simply by Touching Your Clit a Whole Bunch,2018
5 Flirty Spring Scents Our Copywriter Is Having Trouble Describing,2018
"4 Ramekin Molds That Say, ‘I’m Finally Getting Around to The Great British Bake Off’",2018
Chris Pratt and Chris Hemsworth Had A Cute Exchange on Twitter So I Forgot to Pick My Kids Up From Soccer,2018
Help! I Accidentally Put Two Tampons in At Once and Now My Legal Name is Tanya Two Tamps,2018
Kim Kardashian Just Clapped Back at Someone On Twitter And We Weren’t Here For It But We’re On Our Way,2018
"5 Over-the-Top Valentine’s Day Gifts That Say, ‘I Know This Relationship is on Thin Ice’",2018
How to Sneak Your Man Vitamins to Keep His Dick Strong,2018
5 Subtle Ways Your Body Language Could be Revealing You Just Scarfed a Giant Burrito in Your Car,2018
What If It Was Your Sister Or Your Mother? And By ‘It’ I Mean This Three-Toed Sloth,2018
I Don’t Wear Makeup For Men. I Wear Makeup For My Nana Who Said I Look Tired,2018
I Was Hacked But All They Got Were 41 Pictures of This Butt Rash,2018
Amazing! This Woman Workshopped a Text With 20 of Her Closest Friends and Still Made a Typo,2018
4 DIY Household Crafts to Make It Look Like Your Interior Designers Were The Cast of ZOOM,2018
5 Cardi B Songs That’ll Make You Feel Like A Bad Bitch While Shopping At LOFT,2018
"What To Do When Your 23andMe Informs You That You Are Gimli, Son of Gloin",2018
Woman With Fake Nails Playing Dangerous Game With Butthole,2018
Are Twitter Feminists Ruining Sexism?,2018
"4 Sensual Moves For The Bedroom That Whisper, ‘Dear God, Please Grab My Big Ass’",2018
How To Look As Chic As These Cats Wearing Scarves,2018
My Body Type Is ‘Soft Pastry’. Here’s Why.,2018
This New App Tracks Your Period Like Javier Bardem In ‘No Country for Old Men’,2018
How To Smile At Your Birthday Brunch Even Though Life Is Slipping Through Your Fingers Like Sand,2018
Neat! This Woman Crushed Dry January By Smoking Tons Of Weed,2018
Wow! Even The Fish Man Thing From ‘The Shape of Water’ Is Doing The Whole 30!,2018
How To Admit You Don’t Relate To Friend’s Fear of Not Achieving Dreams,2018
Critical Feminist Works to Read on the Train Even Though Your Favorite Author is Still Judy Blume,2018
How I Became Successful By Clicking From Tab to Tab Until 6PM,2018
Dermatologists Hate Her! This Woman Is Really Mean to Dermatologists,2018
How To Queef Your Way Out Of A Bad Relationship,2018
4 Baby Bangs To Make You Look Like A Feral Woman,2018
89-Year-Old Woman Finally Finds The Right Hairstyle For Her Face Shape,2018
"4 Beeswax Candles That Say, ‘The Sluttiest Thing I Own is a Crop Top from The Strand Bookstore’",2018
"These Women Are Beautiful, Even Though They Are All Freshwater Catfish",2018
"I Believe Women, Except When One Tells Me Old Navy Has Good Denim",2018
Study Shows Women Have Happier Relationships When Their Partners Aren’t Massive Douchebags,2018
Wow! This 40-Year-Old Woman Can Still Squeeze Into Her High School Locker!,2018
Aww! This Couple Does Everything Together Besides Cum,2018
Gainfully Employed Black Woman Finally Has McDonald’s Money,2018
Milo Ventimiglia Fans Across the Country Rioting Over Last Night’s Devastating Loss,2018
Anti-Aging Creams That Will Make You Look Too Young To Remember Tonya Harding,2018
How to Give Him Tough Love by Throwing Him Into a Mud Pit and Sitting On His Face,2018
"Yasss! Black Women are KWEENS, Unless They’re Talking About Something I Can’t Relate To",2018
This Package Is Arriving At Our Home And We’re HERE For It,2018
"Beautiful: This Woman Embraced Her Crow’s Feet, Her Crow’s Feathers, And Every Other Part Of Her Pet Crow’s Body",2018
Quiet Chick From High School Suddenly A Breastfeeding Influencer,2018
"Ex Doing Well, Says Ex",2018
"How to Vision Board Your Perfect Life, Which Hopefully Doesn’t Involve Vision Boarding",2018
Amazon’s Cashierless Store Still Employs Old Man to Awkwardly Watch You Buy Tampons,2018
Method Actor Struggles to Get In the Headspace of Actress Who’s Been Sexually Harassed,2018
"What You Do After Sex Besides Run to the Toilet and Squeeze the Cum Out, Based on Your Zodiac Sign",2018
Wow! This Woman Had Multiple Orgasms Over the Course of Several Months,2018
This Man’s Allyship Is Entirely Reliant on His Minority Friends’ Patience,2018
"I Moved to L’Oreal’s Lash Paradise And Honestly, It’s Fucking Amazing",2018
Black Woman Attempts to Explain Her European Last Name to White Friend Without Ruining the Mood,2018
Whoa! This Woman Is Immediately Ready To Share Her Sad Story After Liz Shares Hers,2018
QUIZ: Are You a Snack or a Microwavable Frozen Dinner?,2018
Makeovers So Pretty Your Murder Will Be Turned into a Documentary,2018
Nancy Is Engaging With Showing Her Cleavage a Little More,2018
5 Rope Workouts That Will Make You Feel Like A Strong Octopus,2018
How to Rock a Feminist Tee When You Still Don’t Understand Victim Blaming Is Wrong,2018
‘What’s Your Schedule Like Tomorrow?’ Asks Friend Who You Have Plans With Tonight,2018
5 Zoodle Recipes To Make Before Getting Some Chicken Nuggets,2018
Whoa! This Woman Put a Straw In Her Hot Coffee,2018
Cheap Online Clothes That Have a 50/50 Chance of Showing Up,2018
How to Disguise a Subway Panic Attack as Stress Over Running Late,2018
How to Explain White Fragility to Your Mom Without Making Her Cry,2018
How to Wear a Turtleneck Without Being Constantly Aroused by the Light Choking,2018
Wow! This Woman Added a Dress To Her Cart and Actually Proceeded To Checkout!,2018
Maggie Realizes She Hasn’t Taken A Breath In Like An Hour,2018
This Woman Figured Out How to Be Poor in a Way That is Acceptable to Her Rich Friends,2018
Wow! This Woman Doubled Down on an Ill-Conceived Tweet Until It Became Her Entire Worldview,2018
Aw! This Couple Decided to Wait Till They Really Get to Know Each Other Before Acting Like Themselves,2018
4 Teddy Coats To Make You Look Like A Fuckable Paddington Bear,2018
"4 Sex Positions That Work Better When You Add a Pillow and Say ‘Not Tonight, Hon’",2018
Man Grappling with Past Mistakes Also Sorta Okay With How It All Shook Out,2018
How To Hide Your Concern by Laughing About His Red Flags With Your Friends,2018
How To Put Yourself First So You Get Less Prison Time,2018
"New Study Shows You Sent That Text About Me to Me, Rachel",2018
This Known Assaulter Claimed He Chose To Leave His Job As If Women Don’t Fucking Talk To Each Other,2018
"Um, God Has Another Son and He’s Totally Hot",2018
I LIVED IT: He Left Me For My Bitmoji,2018
5 Pictures Of Live Births That Will Silence Your Trolls Once and For All,2018
Wow! This Couple Knows Each Other’s Passwords But Not The Words to Crazy Town’s ‘Butterfly’,2018
Recently Woke Woman Thinks Everyone Should Resist Like She Does,2018
Amazing! This Street Magician Is Also Polyamorous,2018
How To Convince Your Boyfriend ‘The Crown’ Is Part Of The Marvel Cinematic Universe,2018
My Self-Care Is Just Me Sorting Myself Into Ravenclaw Over and Over Again,2018
4 Skin Formulas So Packed With Vitamin C That Oranges Will Try To Fuck You,2018
How I Finally Learned to Love My Curly Pubes,2018
What I Learned From Not Having Sex For A Whole Year And Then Three More Years,2018
Report: They’re All Terrible,2018
5 Organic Eye Creams That Will Drive Boys Wild,2018
‘Lady Bird’ Fans Are Begging To See More Of The Fictional ‘Sacramento’ Universe,2018
Role-Playing Games That Are Actually Just Ways To Get Him To Do Chores,2018
Instagram Now Has A ‘You’re Welcome’ Button To Hit After You Like Someone’s Selfie,2018
Woman Who Stopped Buying Coffee Still Suffering From Intergenerational Poverty,2018
5 Yogurts That Will Sit In Your Fridge Until The End Of Time,2018
New Glossier Product Just Ripe Peach That You Eat Sexily,2018
Woman Deletes Instagram Story Prompting Speculation That She Fucked Up the Cake She Was Baking,2018
"How To Tell If It’s A Beauty Blender, Or One Of The Long Lost Dragon Eggs Of Legend",2018
Meal Delivery Services To Make You Feel Like A Depressed Astronaut,2018
Awww! This Cat And Ferret Are Living Together In Order to Save on Rent,2018
The Best Jeans For Your Body Type That You’ll Rub Thigh Holes Into Regardless,2018
Inspiring Power Poses For Your Boss To Catch You Doing In The Bathroom,2018
Great! This Woman Looks Tiny and Hot in Both Her Before and After Picture,2018
"I Watch Figure Skating Once Every 4 Years But Trust Me, I’m An Expert",2018
Pixar Reveals That There’s a Woman Walking to The Pharmacy to Pick Up Her UTI Medication in The Background of All Their Films,2018
Are You Pregnant? Take This Quiz Since The Real Test Is $23.99,2018
"This Man Is Happy He Owned Up To Past, However Triggering It May Be For You",2018
Savage! Bob Ross Shades Tree,2018
Man Builds Home In ‘Gray Area’ of Consent,2018
4 Mermaid Blankets That Will Make You Feel Like a Big Warm Fish,2018
This Woman’s Sex Fantasy Is For Her Boyfriend To Pay Her Student Debt And Then Die,2018
How to Make Cute Little Dumps That Go ‘Plink!’,2018
I Lived It: Black Twitter Came for Me,2018
Older Woman Appalled By Younger Generation’s Insistence on Being Respected by Men,2018
Bowling Shoes to Change Into When You Need to Take a Stealthy Stall Poop at Work,2018
These Luscious Body Butters Will Make You Feel Like A Fluffy Lil’ Croissant,2018
This Sex Playlist Also Creates the Perfect Atmosphere for Folding Laundry,2018
Inspiring! This Woman Didn’t Drink So Much That She Wanted To Die!,2018
Holy Fucking Shit! This Woman’s Teacup Has A Swear Word On It!,2018
"We Wanted To Learn About Student Activism, So We Asked Some 60-Year-Old Pundits",2018
4 Moisturizing Sheet Masks to Put on Your Dry Vagina,2018
4 Relationship Problems You Can Maybe Fix with A Baby Named Ocean,2018
