headline,year
BREAKING: Coworker Secretly Cool?,2019
Here’s How Long To Smile At The Baby On The Subway Before It Gets Weird,2019
"Four Money Hacks That Don’t Get You Out of Tipping Your Server, You Piece of Shit",2019
This Couple Makes it Work By Only Speaking in the Event of an Emergency,2019
REPORT: Stalking That Girl Online Made You Feel So Much Better,2019
Get Hair So Thick It Ruins Your City’s Sewage System,2019
Friend Still Reading The Menu Like It’s Moby Dick Or Something,2019
How To Get More Sleep By Donating To Elizabeth Warren’s Campaign,2019
OMG: These Taylor Swift Lyrics Might Have Just Revealed She Has Hemorrhoids,2019
Get the ‘Euphoria’ Look by Finally Letting the Girl You Babysit Have Free Rein on Your Face,2019
4 Stars Who Made it Despite Having Only One Famous Parent,2019
Stay Forever Young by Never Owning Hand Towels,2019
Why I Stopped Dressing For Men and Started Wearing A Loose Necktie Like Avril Lavigne In 2002,2019
Brave: This Woman Bought Underwear That Isn’t Black,2019
I Lived It: I Looked at a Picture of Zoë Kravitz,2019
Wow! Meghan Markle Just Broke Royal Protocol By Cropdusting the Queen,2019
Mom Just Letting You Know There’s A Stop Sign Up Ahead,2019
"Fake Laughs That Say, “I Can’t Afford to Quit This Job!”",2019
How to Craft a Flawless Text to Your Crush Who Doesn’t Know What an Oxford Comma Is,2019
5 Rompers That Are Difficult — But Not Impossible — To Masturbate In,2019
Aw! This Couple Is Celebrating Two Years Of Him Taking Pictures Of Her,2019
"Lol, Nice – Fortune Teller Says You’re Going to Die at 69",2019
Diva Alert! This Lion Mauled A Zoo Patron Just For The Drama Of It,2019
Old Man Strong?,2019
"When I Say I Like Chick Flicks, I’m Talking About Chicken Run",2019
Study Finds We Should Use Smart Phones as Much as Possible Before We Fully Understand Lasting Effects,2019
Woman Watching Period Piece Narrows Down Period to 200-Year Window,2019
6 Lesbian Sex Positions That Are All Just Buying a Cottage Upstate Together,2019
Report: Girl From High School Still Wearing Her Hair Like That,2019
Meet Jenna: The First Person to Ever Go Through a Break-Up,2019
Ugh. Crystal Actually Gemstone,2019
How To Suck His Dick So Hard It Makes A Kazoo Sound,2019
"Mom Announces Tissue Is Clean, It’s Just Been In Her Purse",2019
"7 Homemade Lunches That Will Have Your Coworkers Asking, ‘Wait, Is She Poor?’",2019
"Friend Isn’t Mad, She Actually Thinks It’s Funny",2019
How To Ignore Texts From Your Ex Like A Republican Ignores White Nationalist Terrorism,2019
I Don’t Have To Be A Mother Just Because I’m The Last Sumatran Rhino,2019
"5 Lilly Pulitzer Prints That Say, ‘I’ve Masturbated To A Romney’",2019
Wow! This Woman Pole Dances for Exercise but Doesn’t Respect Sex Workers,2019
BREAKING: Dat Ass Finally Quits After 25 Years of Service,2019
How To Be Yourself On Instagram Even After Your Boss Follows You,2019
"QUIZ: Are You an Introvert, an Extrovert, or a Pervert?",2019
5 Looks To Stun Men Because Also You’re Carrying A Taser,2019
Woman Trying to Act Like Grocery Bags Aren’t Heavy,2019
Amazing! Biotin Supplements Turned This Woman’s Leg Hair to Steel,2019
"‘Vaccines Just Aren’t Natural,’ Says Woman Who Owns Two French Bulldogs",2019
"Jacqueline Kennedy’s Home is on the Market – But It Will Cost You, Like Every Home for Sale",2019
QUIZ: at the bar where are you guys?,2019
3 Perfect Scheduling Apps that Nobody On Your Team Will Bother to Learn to Use,2019
You’ll Love This Naughty Cross Stitch Art If You Have A Really Specific Personality,2019
How to Get Your Boyfriend to Show Up for Special Occasions Like Your Period Does,2019
BBQ Conversation 90% About Spiked Seltzers,2019
How to Impress Your Sugar Daddy by Reading an Analog Clock,2019
BREAKING: 7PM Dinner Time Suggestion Deemed ‘Perf’,2019
Elegant Little Cartilage Piercings That Will Absolutely Never Heal,2019
Wow! This Black Woman Was Calm in the Face of Conflict Because She is Obligated to Be,2019
"Summer Sundresses to Show Off Your Raw, Mosquito Feast Legs",2019
4 Productivity Hacks That…Wait WHAT’s Going on With Cole Sprouse and Lili Reinhart?,2019
Here Is Where Each Presidential Candidate Stands On The Student Debt Crisis And Also Where They Stand When We Make Them Line Up In Height Order,2019
Aw! These Women Came Together To Stop Their Hot Friend From Getting Bangs,2019
Dr. Pimple Popper Videos To Watch While You Absentmindedly Masturbate,2019
"Yes, I’m A Squirter, But Only When I Put Mentos And Coke Up There",2019
So-Called ‘Peacekeeper’ In Friend Group Actually Just A Goddamn Yellow-Bellied Coward,2019
How to Save Money By Wearing One Signature Outfit Like a Cartoon Character,2019
"I Floss Daily Because Strong Teeth Leads To Scary Blowjobs, And That’s A Good Thing",2019
Wow! This CEO is Still On Her Parents’ Cell Phone Plan,2019
Wow! This Razor Subscription Service Will Seriously Overestimate How Often You Shave,2019
4 Dumbass Styles You’ll Think Are Cool A Year From Now When Everyone’s Wearing Them,2019
"Yes, I Have Bed Bugs But At Least Someone Wants a Nibble",2019
"Accent Wall Ideas That Say, ‘I Will Never Own a Home!’",2019
I LIVED IT: My Brush Snagged My Hair and Now I’m Hella Horny,2019
White Woman Speaks: Of Course I Have Black Friends – Both of My Nannies,2019
This Woman Casually Dropped In On An Ex By Unfurling From The Ceiling In Aerial Silks,2019
"QUIZ: Are You in Love With Her, or Did You Just Like Her Outfit That One Time?",2019
Woman Just Texting People She Wants To Hang Out With Like Some Sort of Sick Freak,2019
How to Embrace Your Big Natural Jugs Like the Cats in the CATS Trailer,2019
How to Get Your Hair to Look Like it Did That One Time in 2017,2019
How To Go Outside In The Morning Without Hissing At The Sun,2019
10 Life Hacks That Are Still Not as Effective As Putting in Effort,2019
Boyfriend’s Little Sister Wants to Show You Just One Thing on Her iPad,2019
I LIVED IT: My Boyfriend Doesn’t Have A Camp Sensibility,2019
This Woman Looks Good On Excessively Hot Days. Here’s How We Stop Her,2019
How About Some $100 Shorts?,2019
REPORT: You’re Never Learning French,2019
4 Activities to Do With Your Friend Who’s Only Available Because Her Boyfriend is Out of Town,2019
Uh Oh! Blond Boyfriend Wants to Grow a Beard,2019
What The Actual Fuck? This Woman Had an Actual Picnic With a Fucking Basket and Everything,2019
Inspiring! This Woman Stays Young By Having Lots of Acne,2019
Man At Pool Acting Like He’s Not Jacked,2019
"4 Tevas That Say, ‘Sorry, But These Are My Feet!’",2019
Wow! This Woman Hasn’t Stopped Lotioning Her Hands in 17 Years,2019
All Shakespeare Productions Projected to Be Queer Reimaginings by 2030,2019
Brave! This Woman Clicked An Internal Link Without Knowing Whether Or Not It Would Open A New Tab,2019
Instagram Color Themes to Trap Yourself in a Prison of Your Own Creation,2019
Woman Cobbles Together Sad Little Meal From Starbucks Snack Case,2019
Boyfriend’s Ugly Shoes Taking Toll on Relationship,2019
QUIZ: Why Are You YELLING?,2019
Insane Bitch Actually Got Her Hair Wet At This Pool Party,2019
Cool! This Woman’s Phone Has Never Had More Than 15% Battery,2019
Woman Celebrates 100 Days Of Thinking She’s Getting A Cold,2019
Modified Version of Workout Still Too Hard,2019
Throwback! This Woman Has The Facebook App Installed On Her Phone,2019
Brave! This Woman Goes Online,2019
How To Spend 3 Hours Trying To Fix Your Oily Hair Instead Of Washing It,2019
Ew! This Married Couple Still Likes To Kiss,2019
QUIZ: Are You Depressed or Just Awake?,2019
New Dating App Designed Exclusively For People Who Hate Adventures,2019
"Preppy Headbands That Say, ‘I Just Discovered I Have A Twin Sister and We’re Getting Our Parents Back Together’",2019
Freshly Locked-Down Boyfriend Has No Idea He’s Never Coming in Emma’s Mouth Again,2019
Wow! This Man Has A Huge Pee Pee,2019
We Tried Every Flavor of Halo Top and We’re Sadder Than When We Started,2019
Get Toned Arms by Banging Your Little Fists on His Chest,2019
Prime Day Sales! These On-Trend Shoes Are Worth Strutting Across a Picket Line,2019
Brave! This Woman Has A Match On Bumble And She’s Going To Message –– Oh Wait She Got Afraid And Deleted The App,2019
A Quick Guide to Tarot Card Reading Since You’ve Clearly Reached That Point,2019
Is It Really My Birthday If I Don’t Have A Huge Party With A Bunch Of People I Never Speak To Who Don’t Give A Shit About Me?,2019
Cool Skater Girl Momentarily Mistaken for Loser Skater Boy,2019
‘Slight Change of Plans!’ Says Friend About To Ruin Night,2019
6 Beauty Products We Assume Are All-Natural Because They Come In Brown Bottles,2019
Woman Who Rejects All Social Invitations Feeling Excluded,2019
"Meghan Markle Just Ate A Plum With Her Hands, And The Royal Family Just Shit All Over Their Huge Hats",2019
Are You A Creative Type If You’ve Never Even Weaved On A Loom?,2019
Bold! This Woman Used Her Wedding Photo as Her LinkedIn Profile Pic,2019
Dad Just Wants To Know If You Had To Pay For The Holes In Your Jeans,2019
Hero! Woman Warned There Is No Toilet Paper In That Stall Waltzes On In Anyway,2019
"Ugh, I Guess I Have To Buy A Fucking Jumpsuit Now",2019
Woman Running with Hair Down???,2019
5 Relaxation Apps So You Can Stare at a Bright Screen Right Before Bed,2019
How To Remind Your Tiny Friend She’s Tiny Every Five Minutes,2019
"This Granola Has Four Ingredients, And All Of Them Suck",2019
Woman Who Completed Annual Jog Expected to Make Full Recovery,2019
"Wow! This Man Is Faceblind, Except for When It Comes to Hot People",2019
"6 Suction Vibrators That’ll Make You Wonder, ‘When Aliens Invade, Will It Be Safe To Fuck Them?’",2019
How To Fly Safely With A Baby and by Baby We Mean Weed,2019
Wow! This Social Floater is Tangential to a Record 14 Friend Groups,2019
Co-Star Really Out For Blood Today,2019
REPORT: Friend Overjoyed To Hear You’re Struggling Just As Much As Her,2019
Get A Naturally Dewy Look This Summer By Always Being Nose-Deep In Pussy,2019
"‘She Was Right All Along,’ Says My Ex’s Therapist, I Assume",2019
Cute Summer Shoes That Go Great With Band-Aids,2019
Sanctions Imposed on Shitty Cat,2019
"4 Sheer Tops That You’ll Definitely Just Wear Over a Cami, You Coward",2019
"BREAKING: Change The Subject, You’ve Been Talking About Yourself For Too Long",2019
Awesome! Karen’s Also Going to Hop In This Photo,2019
7 Responses To Workplace Sexism That Are Just This Picture Of Megan Rapinoe,2019
Boyfriend Extremely Proud Of This Salad He Made,2019
QUIZ: Do You Have A Charger I Could Borrow?,2019
How To Wait At Least 10 Minutes After A Convo Starts To Mention All The Things You Hate And How Tired You Are,2019
Wow! This Woman Spent $6 on an Iced Latte and It Was Kind of Bad,2019
Uh Oh! Diane Is About To Take The Playful Shit-Talking Too Far,2019
Incredible! Everything This Woman Has Accomplished Was to Spite That One Bitch From 9th Grade,2019
How to Stay Humble Even Though People Are Looking At Your LinkedIn Profile,2019
"5 Fit-and-Flare Dresses That Say, ‘My Ass Is A Cone!’",2019
Sex Positivity Win! This Guy Is Horny,2019
I’m Not Like Other Girls. I’m A Self-Help Guru Running For Healer Of The Free World,2019
How to Establish Yourself As the Mom of the Friend Group by Breastfeeding the Whole Gang,2019
Allow Me To Set You Up With Some Guy,2019
Aww! This Woman Has Her Mother’s Trauma,2019
BREAKING: Hot Person on The Train,2019
Sad Day For Social Media Interns As Pride Transitions to 4th of July,2019
Woman Shocked to Discover She’s Been Working for 60 Minutes Straight,2019
Hell Yeah! This Woman Canceled Her Evening Plans And Had A Tiny Orgasm,2019
This Wet-Look Hairstyle Will Make You Look Like You Just Came Out Of Your Mother’s Womb,2019
4 Petite Women Discuss Their Strong Little Legs,2019
I Gave Up True Crime Documentaries Because They’re Unethical And Also I’ve Watched All The Good Ones,2019
5 Public Parks To Uncomfortably Watch Movies In This Summer,2019
QUIZ: Baby Crazy Or Crazy Baby?,2019
Your Boyfriend Will Never Love You As Much As He Loves These Basketball Shorts,2019
Mom Just Calling to Say Hi––Oh And She Bought You a Stun Gun,2019
QUIZ: Am I 31 or 32 I Honestly Can’t Remember,2019
Mom Offering A Surprise Giveaway of Anything In Kitchen,2019
5 DIY Projects To Do While You Wait To See If We’re Going To War,2019
Is He Falling In Love With You Or Do You Just Own A Rare Synthesizer?,2019
"If All Student Loan Debt Is Cancelled, How Will I Have An Automatic Advantage Over My Peers?",2019
"Linen Maxi Dresses that Say, ‘I Have a Son Named Phinneas’",2019
Mom’s Birdbath Turning Into A Real Fuck Palace,2019
Absolutely Unreal: I Bought Stamps,2019
"5 Yellow Bridesmaid Dresses That Aren’t Goldenrod Like I Asked For, Mary",2019
Wow! This Woman Is The Mom Of Her Friend Group But The Helpless Baby Of Her Actual Family,2019
"How I Make $100,000 a Year From Home by Being Married to My Husband, Mr. Slick Dick Richy Rich",2019
"Wow! This Couple Named Their Son Onyx, But There’s Still a Lot of Work to be Done",2019
REPORT: Ben Having One of His Handsome Days,2019
Incredible! This Woman Realized She’s Allowed to Unfollow People on Instagram,2019
Aw! These Friends Graduated College And All Went On To Gentrify The Same Neighborhood,2019
5 Summer Sandals for Your Cat to Barf In,2019
"Bridal Shower Gifts That Say, ‘Do You Know I Hooked Up With Greg In College?’",2019
Study Finds A Result Magazines Can’t Wait To Misuse,2019
How to Watch a Long Movie Without Getting a UTI,2019
"“Fuhgettaboutit, Cupcake,” Says Barstool You Just Apologized To",2019
QUIZ: Are You the Ugliest Person Alive or Are You Just About to Start Your Period?,2019
BREAKING: Halloween Kind Of Soon?!??!?!,2019
Study Finds Women Use The Internet an Average of 65 Years a Day,2019
Find Someone Who Looks At You Like You Look At Chernobyl,2019
3 Jumpsuits to Make This Wedding About You,2019
Woman Spends Record-Breaking 13 Months Worrying That Someone She Hates Doesn’t Like Her,2019
Bi Woman in Straight Relationship Celebrates Pride With an Identity Crisis,2019
This Woman Is Haunted By A Simple Task She Needs To Do Three Weeks From Now,2019
How to Share The One Pillow Your Boyfriend Owns Like You’re Fighting For Your Life on a Door in the Atlantic Ocean,2019
"QUIZ: Is He An Ass Man, A Boob Man, Or Encino Man?",2019
"Colorful Bralettes That Say, ‘My Lil’ Titties Are Right Here’",2019
Do You Want Fries Or A Side Salad Because There IS A Right Answer,2019
Why I Use Natural Vinegars To Cure My Yeast Infection Even Though No One Told Me To And It Doesn’t Work,2019
How To Microdose Bangs,2019
"‘Oh, You Would Actually Love This,’ Says Man Who is Mistaken",2019
"Uh Oh! Kimberlee Cueing Up Her Ayahuasca Story, Again",2019
Cute Vintage Shorts Have Cute Vintage Period Stain,2019
Coworker a Little Too Ripped,2019
6 Hairstyles Your Cruel Niece Will Mock You For,2019
"Wow! When This Woman Couldn’t Afford Her Insulin, Her Whole Town Chipped in for Her Funeral",2019
How to Stop Taylor Swift From Showing Up at Your Gay Wedding,2019
NYPD Apologizes To LGBTQ Community For Surprise Taylor Swift Performance At Stonewall,2019
We Asked The Top Minds in Science Why Celebrities Look Different Without Makeup,2019
Hack Your Morning Routine by Waking Up at 2 a.m. and Having a Mini-Day Before Your Real Day,2019
Creative Ways To Plug Your Podcast in Your Maid of Honor Speech,2019
"Inspiring! This Woman Has Completed 10,000 Hours of Negative Self-Talk",2019
8-Year-Old Snaps Stunning Portrait of Apple Juice on Plane,2019
"DUDE CORNER: Most Guys Just Want Sex, But I Would Be Okay With Hand Stuff",2019
Uh Oh! Loudest Friend Suggesting Karaoke,2019
5 Morning Routines of Successful Women That Will Make You Feel Very Sorry For Them,2019
How To Listen To Your Body When It’s Farting,2019
Aw! This 20-Year-Old Is Wearing A Little Suit,2019
"QUIZ: Is it a Quarter Life Crisis, or Should You Really Get Chickens?",2019
Aw! This Group Of Friends Is Refusing To Admit It Was Too Cold To Go To The Beach Today,2019
"4 Anti-Wrinkle Creams So Effective, No One Will Know You’ve Lived A Full Life",2019
Biden Builds Bridge To 10-Year-Old’s Shoulders,2019
BREAKING: This Bitch Just Called You ‘Confident’,2019
Wow! This Top Only Works With That One Pair Of Pants,2019
Inspiring! This Woman Stays Skinny By Completely Blowing Up Her Life Once A Year,2019
Retro! This Girl Has A Tongue Ring,2019
"How to Get Beachy Waves That Are Sun-Kissed, Sun-Fingered, and Sun-Fucked",2019
I LIVED IT: My Younger Sibling Is Taller Than Me,2019
Cute Pride Flags To Conceal Your Boyfriend During Pride Month,2019
"Study Finds Everyone Can Tell When You’re Walking on Beat to Your Music, You Hapless Goof",2019
"3 Bikinis That Say, ‘I Hope You’re All Ready To See My Pubes!’",2019
Wow! This Woman Only Respects the Gender Non-Conforming Identities of People She Likes,2019
BREAKING: Baby Girl Wearing BIG FUCKING BOW,2019
Feminist Fail: Show Starring Women Doesn’t Single-Handedly Demolish The Patriarchy,2019
Uh Oh! Annoying Friend Just Discovered Kombucha,2019
Wow! This Bloody Mary Comes With A Sephora Gift Card On Top,2019
QUIZ: Is He Really This Bad At Fingering Or Did He Just Lose His Juul In There?,2019
How to Channel Megan Thee Stallion When You’re More Of a Feeble Newborn Foal,2019
Achieve Mind-Blowing Orgasms By Having Your Partner Read Direct Quotes of Democrats Calling for Impeachment,2019
"Uh Oh, Jenna Got Too High At The Aquarium",2019
Sweat Ruins Day,2019
Mindfulness Queen! This Woman Watched Three Hours of Youtube Videos While Sitting on a Yoga Mat,2019
"This Tampon Is So Green, It Just Becomes Part of You",2019
You Can Own Meghan Markle’s Wardrobe! But Prince Harry Will Never Go Down on You,2019
I LIVED IT: My Crush Didn’t Know Their Birth Time,2019
The Best Gay Credit Cards To Apply For From The Best Gay Banks This Pride,2019
REPORT: Gonna Be An Early Lunch Day,2019
"Aw, Lauren’s Fun! Oh Shit. No. Lauren’s Going Fucking Nuts. Let’s Go.",2019
"REPORT: Tomato Juice Changes Flavor at High Altitude, But Does This Pussy?",2019
10 Ways To Get Back At Your Ex That Are All Winning A MacArthur Genius Grant,2019
Get Positively Radiant Skin By Being Rich,2019
Drop Everything: Woman In Book Has Delicate Features,2019
Aw! This Woman’s Thighs Married a Subway Seat and They Had a Gorgeous Barn Wedding,2019
QUIZ: Will Your Grandma Die Before You Find Time to Visit?,2019
REPORT: That One Bee is For Sure Following You,2019
Wow! This Bug Is Femme,2019
Tiny Clutches to Whisper Haunting Secrets Into,2019
"July 4th Decorations that Say, ‘I Love My Country, But Don’t Get It Twisted’",2019
How to Be Taken Seriously When You Ate Soap and Now Bubbles Come Out Every Time You Talk,2019
"Anna Didn’t Tip The Barista, Interesting",2019
Find Out If You Forgot To Take Your Birth Control By Listening To ‘Fast Car’ And Seeing If You Cry Or Not,2019
Uh-oh! Your Aunt Is Whispering When Talking About Minorities Again,2019
Cool! Pee Stream Rerouting Down Buttcheek,2019
"5 Monokinis that Will Leave You With a Squishy, Little Blob of Fat to Poke At the Beach",2019
How To Cut Your Screen Time Before Bed Except for Watching Dr. Pimple Popper Videos,2019
5 Precious Kittens Who Unfortunately are Fiscally Conservative,2019
How to Responsibly Call Out Sick Because Your Cat is Sitting in Your Lap With Her Legs Tucked In Like a Loaf of Bread,2019
Woman Uses Friends’ Birthdays As Opportunity To Post Pictures From Her Wedding Again,2019
QUIZ: Should You Go To Bed or Start a Fight With Your Republican Aunt on Facebook?,2019
Is America Ready For A President Who Doesn’t Leave A Few Drops Of Piss On The Floor In Front Of Every Toilet?,2019
How to Get Over Baby Fever by Remembering the Earth is Dying,2019
Wow! This Flight Attendant Gets Paid To Fly Around The World And Ask Men To Stop Groping Her,2019
4 Refreshing Rosés For When You Run Out Of Weed,2019
Behind Every Successful Woman Is A Man Who Feels Weird About It,2019
What the Actual Fucking Shit? Morgan is Learning Italian?,2019
Woman Just Posting A Funny Anecdote On Facebook Like It’s 2009 Or Something,2019
How I Transitioned to an All-CBD Diet,2019
REPORT: Black Friend Not Enjoying This Blowout Bar As Much As You Are,2019
4 Mocktails That Honestly Aren’t As Good As Diet Coke So Why Bother,2019
"Can a Water Bottle Sitting in a Car Overnight Kill You? We Don’t Know, We’re Asking",2019
4 Fun Date Ideas That Take Into Account Your Lifetime Ban From the Aquarium,2019
Looking Back: The Top ‘Game of Thrones’ Moments Where Jon Snow Went Down on Ygritte,2019
How To Hit the Joke One Too Many Times So Everyone Goes Quiet,2019
"5 Moisturizers For More Oily, Delicious Skin",2019
"To Reduce Travel Stress, Just Don’t Go",2019
"4 Dark Lipsticks That’ll Have Your Dad Saying, ‘Are You a Goth?’",2019
Aw! Aw! Aw!! Aww! Three Dogs Just Walked By. And a Cat,2019
1950’s Style Swimsuits That Will Remind Your Grandpa of His First Love,2019
5 Stunning Spring Lip Shades to Leave Smeared Across His Shaft,2019
Aw! Friends On Weekend Trip Just Want to Have Fun and Also Resolve Their Deep-Rooted Issues With Each Other in Two Days,2019
Couples Who Do This One Thing Regularly Are Habitual Little Shits,2019
This Waterproof Mascara Does Not Come Off Seriously You Will Die In This Mascara,2019
Woman Sad ‘Game of Thrones’ Is Over After Eight Years of Hating It,2019
How to Do Your Makeup Perfectly For One Spot in One Room of Apartment,2019
"I Don’t Need My Presidential Candidate to be Likable, but I Do Need Them to Know All The Lyrics to Salt-N-Pepa’s ‘Shoop’",2019
"‘I Just Don’t Think a Woman Can Beat Trump Right Now,’ Says Man Who is the Reason For This",2019
How to Fuck So Good It’s Basically Unpaid Labor,2019
You’ll Never Believe How I Cleared Up My Acne Because I’m a Dirty Little Liar Who Can’t be Trusted,2019
Tinder Match Has No Idea This is All a Game to Jenny,2019
Wine Aunt Finally Feels Ready to Become Wine Mom,2019
"4 Clear Glasses Frames That Say, ‘I Haven’t Tried Polyamory, But I’ve Watched Many VICE Docs on the Matter’",2019
Senator Says The Only Acceptable Way To Kill A Fetus Is With a Gun,2019
"Sure, I’ll Put My Baby Up for Adoption as Soon as I’m Out of the Foster System",2019
Torn! This Pro-Life Conservative Has to Pretend He Believes Black Lives Have Value,2019
White Woman Complicit?,2019
The 6 Hottest Up-and-Coming Cities For Millennials Who Cherish Bodily Autonomy,2019
What Surprised Me Most About Becoming a Parent Was That I Was Forced To by The Government,2019
"If Life Begins at Conception, Maybe We Should Cut Off All the Dicks Now",2019
Aww! These Three Generations Of Women Have All Been to the Same Fucking Protest,2019
I Believe God Gave Us All Free Will – Except Pregnant Women,2019
"I’m Just A Heartbeat, And Even I Can See These Abortion Laws For What They Are",2019
Life Begins The Second A Girl’s Uncle Decides On Incest,2019
"‘I Want to Save Unborn Children,’ Says Senator Who Just Closed Seven Rural Hospitals",2019
Get Him To Notice You By Being A Small Clump Of Cells In A Uterus,2019
Sixth-Poorest State With $7.25 Minimum Wage Thinks Its Residents Need More Babies,2019
"‘If You Don’t Want a Baby, Keep Your Legs Closed,’ Says Man Who Jerks Off Five Times a Day",2019
"Life is Sacred, That’s Why This Nonviable Fetus Should Stay Inside Me So We Can Both Die",2019
Dear Disney: Why Is There No Property Brothers Ride?,2019
QUIZ: Is That a Bruise…? How Did That Get There…? Maybe You Hit It on Something…?,2019
Create a Morning Routine to Make Yourself 3 Hours Late to Work Every Day,2019
BREAKING: Something Afoot in Sleepy Little Town,2019
Woman Who Touched Damp Shower Curtain Still Alive,2019
Aw! This Puppy is So Sleepy Because He Has Mono,2019
Why I Stopped Going To Therapy And Started Listening To Lizzo 12 Hours A Day,2019
We All Need to Stop Having Sex With Mark Zuckerberg Until the Government Breaks Up Facebook,2019
Equality Win! Lesbian Also Can’t Find Clit,2019
How to Get The Girls Together Without Pulling Off An All-Female Heist,2019
4 Calming Yoga Poses That’ll Get You Just a Lil’ Horny,2019
Amazing! Yoga Bra Has 50 Straps Yet Still Offers No Support,2019
Wow! These Best Friends Are Celebrating 20 Years of Setting Up This Selfie,2019
Go Girl! This Woman’s Body is One Big Cell,2019
Wow! This Polyamorous Relationship Became a Human Rat King,2019
BREAKING: Mom is Gonna Do a Big Shop,2019
One Smile From a Passing Stranger Convinced This Woman to Release the Flock of 45 Wild Geese She Was Holding Hostage,2019
"4 Facial Sprays That Taste Pretty Bad, Actually",2019
"Wow! When They Got Her Order Wrong, This Woman Said, ‘Everything’s Perfect, Thanks’",2019
"Bumble Launches AI That Detects A Dick Pic, Goes to Man’s Home and Asks Why They Did That",2019
"Smoothie Bowls to Kick-Start Your Day into a Kickin’, Rockin’, Electric Chaos Boom Boom Kickstart Magic Explosion",2019
Nice! Stacy’s Dog is Also Named Stacy,2019
"White Woman Speaks: I Prefer to Use the Term African-American, Regardless of Where a Black Person is From",2019
This Mom Was Shocked to Discover the Actor From That One Show Also Acting in This Show,2019
Cat Remains on Bed for All of Sex,2019
"I Love Having Tattoos, But I Wish More Men Would Stop Me and Talk to Me About Them",2019
Cute Summer Dresses You Will Change When Your Friend Arrives to Better Match Her Vibe,2019
QUIZ: Which “Game Of Thrones” Character Would You Fuck Even If They Were Your Sibling?,2019
Today’s Horoscope is Perfect for Justifying Your Bad Decisions,2019
How I Turned My Life Around by Buying a Colander,2019
"4 Summer Dresses that Say, ‘This Company Doesn’t Make Clothes for My Body Type’",2019
This Serum Works On All Skin Types Except Whatever You Have Going On,2019
Gay Icon? This Straight Woman Is Fabulous!,2019
